c1dl06	2019-06-16 19:06:35	iesharael	AITA if I don’t go to this bridal shower and hang out with friends instead?	"I (20F) have a part time job and due to being one of the most flexible staff members as well as not being able to say no I work 3/4 Saturdays 9:30-5. On top of that for the past week I had work Mon-Wen on top of working ever spare minute on a project I barely finished for my Thursday night class, ended up at a recital for my niece on Friday then the hardest shift of the year (summer reading kick off that had more than double the expected turn out) on Saturday. This up coming week I work Mon-Wen with ANOTHER project (which I’m also meeting separately with group on Monday after work) due Thursday and likely being forced to go shopping on Friday. This is what most of my summer will be like.


Here’s the story part: 
I really want just a chill day with friends next Saturday to finally go on “ramen date” which we’ve been planning since December. Friends being the my best friend of 10 years and my ex boyfriend I still get along with. Problem is my mom didn’t bother to tell me until today she RSVPed for me to go to a bridal shower that day. 


Firstly, I HATE bridal showers and only go to them if they are family since I feel that as a family member I should. Second, my mom knows I have bad anxiety with group things and will still give me a lecture if I try to do any of my personal coping mechanisms (browse reddit, fiddle with trinkets, find someplace quiet for a bit) to deal with that. And lastly and most importantly, I BARELY KNOW THE CHICK. Pretty much she *used* to go to our church and I apparently went to her grad party. I can’t even remember her name beyond it starts with M. I don’t even know if I’m invited to the wedding to be honest... this was the first I heard of her since she graduated 3 years ago. 


When I asked my mom if I could get ramen with my friends instead she practically broke down about how it’s a girl thing and the rest of the girls (my 2 older sisters) are going and that it’s supposed to be a family thing (again, no relation to this chick). I dared say I want a relaxing weekend and that I haven’t seen my BFF since last summer and I should really see her since her pets died recently and I want to be there for her. My mom decided we aren’t talking about this now (fair since she’s working on cleaning the kitchen for Father’s Day picnic plan B) but I know she will say the same thing every time I bring it up until day of meaning no chance to plan with friends and even if I don’t go to the bridal shower I’d end up being home instead because friends will think ramen isn’t happening and fill the Saturday.


Her reaction is making me feel like maybe I’m being immature and I should go to the bridal shower but I know I’ll be completely miserable there like I always am at “family” things. And we will probably stay from the very very beginning until clean up is over+ (I can’t drove so I can’t just leave)


So reddit,
AITA for wanting to hang with friends and begging not to go to this random persons bridal shower? I could really use advice on how to handle this!"	Not the A-hole	0	0	1455.0	48.0	0.0	0.0
c1dk7n	2019-06-16 19:04:46	SquareCoat	AITA for telling my Fiance to stop talking about our sex life to her friends?			0	1	0.0	0.0	0.0	0.0
c1djb5	2019-06-16 19:02:35	dadsdaythrowaway11	AITA for Sticking Up For Myself On Fathers Day?			0	1	0.0	1.0	0.0	0.0
c1dj9t	2019-06-16 19:02:30		AITA if I give a month and half notice before I move out?	"I have a little more context to add. 

I’m 28, I have lived with my roommate on and off for about 10 years. My roommate is now married and we live with one other person, plus four dogs. 

I want to move out for many reasons, closer to work, cheaper, not having to clean up after three people, my roommates hate my SO, but mostly because I’d like to move in with my SO to start our own life. 

AITA if I give my roommates a little over a month and half notice? It’ll probably most likely be the end of August. I am even offering to continue paying rent $700, until I pay off what I owe them from when I lost my job last year. About $1400. So that also gives them at least until October. 

They are just going to thing I don’t like them anymore because I’m moving out. Especially, because I’ve been spending a lot of time at my SO’s place. I just want to make sure I’m not the asshole in at least giving them enough time."	Not the A-hole	1	0	0.0	0.0	0.0	0.0
c1dic9	2019-06-16 19:00:26		AITA for laughing at a spic toddler with downs syndrome as he threw a tantrum while his mom beat him?			0	1	0.0	0.0	0.0	0.0
c1dhlj	2019-06-16 18:58:33	SpiffyTLL	WIBTA is I leave my friend for dumping her problems on me, but pokes fun at mine?	"Edit: Title should be WIBTA if...

Warning: I'm not that great at writing, so I hope this makes sense. Tl;dr at the bottom.

So I have this friend, which I'll call N. We met in 7th grade through a mutual friend, and we often joked around a lot to each other. In 8th grade, she asked to vent to me. I let her, and she talks about her family and depression. I comfort her, but N started to act strange around me. I would give her my lunch because she wouldn't eat at home. She would often limp around me (a signal of being weak from not eating?), which I'm not sure was fake or not. Sometimes she would break out crying randomly, and our friend group would try to comfort her. We would tell adults that N was fine since she didn't want adults to help or question/interfere with her life at home. The strange thing is that N started to follow me around campus like she had nothing else to do. I gave a few signs that I was uncomfortable or wanted to be alone, but she would never catch any of them.
Now, I had my own problems at the time. I decided to vent back to her about something I had done that I still feel bad about today. The next day, she started poking fun at me for it, and my friends started to pressure me into ""spilling the tea"". I told them about another event to divert the conversation. I wanted to question N about why she did this, but I kept my temper and continued the day normally. She would do this to almost everything I told her.
Another thing that pulled my strings was that N would pretend to be smarter than she actually was. One example was during our 8th grade orientation. Families rotated around and checked out the teachers and classrooms. N and I were both in the math classroom we would be taking  that year. We both looked through the textbook and talked about how that math class would be really quite easy to tackle. However, throughout the year, she would constantly ask for help. I did, until I got tired and told her to ask someone else. Another example would be when we were arguing about astronomy. I told her that light-years were a unit of distance, not time. She took out her Chromebook and tried to hide the fact that she was searching it up, as if I would mock her for not knowing (something she would often do to me). She would criticize my writing and work (which got pretty good scores) and then get worse scores on hers. 
The only thing keeping me from breaking our friendship is the fact that N has pretty severe depression. I don't want to hurt her in any way, since she would take it pretty badly.

Tl;dr my friend N decides to spill her problems on me, then mock mine. However, if I do break our friendship, I would feel guilty because she has depression. WIBTA?"	Not the A-hole	0	0	5.0	2.0	0.0	0.0
c1dgiy	2019-06-16 18:56:03	Freezyfast20	AITA for scaring off birds?	So where I live there is an old woman who always throws out pieces of bread and biscuits for birds every morning. I wouldnt mind this if it wasnt right next to my house and car. This has been going on for a long time and the birds usually shit all over my car. The birds wait every morning for her to throw out the bread and they are very loud. Also note that she does this in the early hours of the morning, maybe around 5am. Yesterday i knocked on her door and asked if she could stop feeding the birds or at least feed them when my car isn't parked because of the reasons i mentioned above. also note she is around 60 years old. She then says that because she throws the bread on her grass, she doesnt have to listen to me and shuts the door. Today i decided to wake up early and scare away the birds while they were eating. I then picked up the bread and threw it in the bin. She comes out of her house and starts yelling at me saying i was trespassing on her property and threatening to call the police ( a threat she never carried out). I admit I shouldnt have gone on her grass and am now starting to feel bad for what i did. I would like to know what you guys think about it. AITA?	Not the A-hole	0	0	213.0	25.0	0.0	0.0
c1dfa4	2019-06-16 18:52:57	lawinabox	Aita for pressuring my mother not to disclose who she gets her information from.	"Sorry for formatting before hand I'm on mobile.

A bit of background, my younger brother W is a bit of a useless character. He refuses to get a regular paying job, doesn't contribute to the household, and has a rough temper. He has also been getting  numerous tickets in a short period of time.

Just now my younger sister M informed my mother and I that he just got a speeding ticket about 5 days ago. He has not paid off the last ticket yet even though he has claimed on multiple occasions to having the money. 

My mother freaked out since this can and most likely will make our car insurance go up. She texted him to get home now.

My sister was worried that she was going to be disclosed as the source since she has been the target of multiple outbursts by our brother. My mother also has a habit of letting it slip that M is the one that has all the information. 

My mom would not promise to keep that quiet. M asked her to say she figured it out from the insurance company but she would not promise. 

My mother and I work during the week and aren't home which leaves M alone at home and very vulnerable. M admittedly got very upset by this and was then yelled at by our mother for ""bitching her out"". 

I sided with M and was also then yelled at for the same thing. I did get her to promise to use the insurance as an excuse but she would not see why it should have been the only option. She said that she works hard and doesn't need her children bitching at her since she is an adult.

Am I or are we the assholes for insisting on the promise from our mother and ""guilt tripping"" her. I love my mom and don't want to stress her out more but I want to protect my sister from W's outbursts. I honestly believe W needs to leave in general but that's a different can of worms."	Not the A-hole	0	0	45.0	0.0	0.0	0.0
c1df5j	2019-06-16 18:52:37		Frustrating Communication on Fathers Day, Could Be Me.			0	1	0.0	0.0	0.0	0.0
c1demk	2019-06-16 18:51:24	BelieveInTadCooper	AITA for making my sister cry and then kicking her out of our(?) flat?	"My sister (28F) and I(31F) are very close and love each other dearly. We share a flat which is 5 minutes down the road from our parents' house. 

Growing up, both of us suffered from severe anxiety and depression which started in school and continued into college and beyond. Mine was far more visible, I threw more tantrums, had more breakdowns, and rebelled quite a bit. However, my parents are super-supportive and helped me get access to therapy, medication etc. and after years of consistent therapy, I was able to become independent, financially independent and move out of their house in order to live the life I want to lead. My sister on the other hand refused to go for therapy or see a psychiatrist - and her depression only continued to grow. 

Two years ago, when I moved into a bigger flat - my mother asked me whether I'd be ok to have my sister move in with me, because my parents felt that the independence and responsibilities would do my sister good. I agreed, and let my sister live with me. Since she doesn't earn as much as I do - I pay the bulk of rent and utilities and she pays what she can - which is about 15% of our total bills. 

This year, her depression got even worse to the extent that my parents intervened and asked her to move back in with them on the condition that she could return to our flat after she committed to therapy. Last week, she moved back in and when I asked her for her share of the bills - she got very upset and said she didn't have the money ... why am I springing this on her? she'll pay from next month... I got a little exasperated and told her she can either pay her share or she can move in when she can afford to. 

She said I'm not being supportive at a time when she really needs me burst into tears and left. AMITA for asking her to leave? I adore her and want her to get better. I could afford to pay for everything, and I know how much support I got from my parents at my lowest. But I feel like there's only this much support I am capable of giving her and she needs to figure the other stuff out with our parents. 

Some added context: It is very unusual in my country for unmarried kids to live apart from their parents. Even more so for girls. My parents are wonderfully supportive and liberal - but there are huge lifestyle differences between the life we the kids want to live and the one they lead. The implicit understanding has always been that if we want to do things our way, the least we can do, is to do it on our own dime - I gave my parents a lot of shit while living with them - which my sister does not (she is way more respectful of their rules). However when she stays with me, I feel like she gets extra freedom without actually having actually having to pay  for it and then I get resentful."	Not the A-hole	0	0	52.0	2.0	0.0	0.0
c1de5n	2019-06-16 18:50:15	Itsthrowawayintheusa	AITA for not trusting my husband.	"I love my husband very much, but I have a hard time trusting him. We've been married for about 6 years now and everything in our marriage is pretty okay. We have our ups and downs, but what marriage doesn't. My distrust started a couple of years back when he lied about one of his friends. Apparently there were some feelings that were there even while we were dating. (I asked him about it and he told me she was like a sibling to him). I found pictures and text messages after this that confirmed his feelings for her. 

She moved away and that was the end of that, and I tried to forget about it. One day I checked his messages and realized he was talking to one of his friends about me, and not in a good way. When I confronted him, he said he didn't mean it. Again, I tried to move on but the lies still bothered me. He hides his cell phone from me and changes his passwords constantly. I understand his need for privacy, but even trying to look at his camera roll for a picture is an issue. 

He recently hid a purchase he made for his coworker from me. 

I just feel like he's doing something behind my back. He says he loves me, but it's getting harder to believe."	Not the A-hole	0	0	0.0	0.0	0.0	0.0
c1ddsg	2019-06-16 18:49:21	LordAlexanderSwift	WIBTA if I don't call my dad for fathers day	"No throwaway because I don't mind who sees this also on mobile so forgive any format issues.

My father and I have never really been close, he divorced my mom when I was a baby and I saw him every other weekend until I was about 14 or 15 during which we would just kind of awkwardly sit around and watch TV because we are practically opposites with him liking sports and hunting and me preferring books and computers ect.

Around that time the visits just started being shorter and farther apart and he made no effort to see me more often and stopped showing up for birthdays ect. Cut to me being 22 and my first child being born, my wife and I invited him to come see us and our newborn at the hospital or at home after we left which he said he would but then never did. I went to his house with my child and visited twice during the next year and told him we still lived at the same place and our number was the same but he still made no effort to reach out. After inviting him to my kids birthday he once again said he would be there but didn't come and just said he got busy when I asked why he didn't show.

Then my second child was born and same thing as before invited but never came at this point I will admit I stopped putting effort into involving my dad in our lives and in the last two years I have only spoken to him over the phone on fathers day and this year I don't even feel like doing that. 

AITA reddit?"	Not the A-hole	0	0	48.0	0.0	0.0	0.0
c1ddcz	2019-06-16 18:48:15	godsknowledge	WIBTA if I call people out when they interrupt me while I'm talking?	"I've come to the realization that there are quite a lot of people that interrupt me while I'm talking.

It's as if they don't even want to listen. (After I've listened to them for quite some time).

&#x200B;

So I tried the following: I don't stop talking. I keep speaking as if they didn't just interrupt me. (Also increased my voice lately). That's when they stop, but it's often seen as negative, i.e. they feel disrespected or give me that angry/annoyed look. I don't even talk that much, but I'm fed up with always being interrupted.

&#x200B;

WIBTA if I call people out when they interrupt me? (Especially my boss. - I'll be gone in a month anyway)

I don't know if people are conscious about their behaviour."	Not the A-hole	0	0	166.0	262.0	0.0	0.0
c1dcst	2019-06-16 18:46:51		AITA for not caring about my mothers sensitive nose?	i have a humdifier/essential oils diffuser in my room because i have plants that need to be kept in high humidity and i just like the smell of them. my mom has a sensitive nose and i know this, but im tired of not being able to keep my room smelling like something nice because of this. she wont even let me wear certain perfumes because she doesnt like the smell. i live at home with her so i try to keep her happy, but i pay rent and should be able to do what i want in my own space. i keep my door shut and window open so the smell isnt too bad. she has since come into my room while i was at work and took my humidifiers (i have a larger one then a small one that doesnt usually get turned on) and now wont give them back. it was never an agreement that i couldnt have them when i started paying rent so im really pissed off that shed just take something of mine.		1	0	0.0	0.0	0.0	0.0
c1dcls	2019-06-16 18:46:22	pelloosh	AITA for feeling annoyed about a man commenting on my weight?			0	1	338.0	27.0	0.0	0.0
c1dbnw	2019-06-16 18:44:00		AITA ? My dad came to visit today and wanted to spend the day with me, but I refused.	"I don't really feel bad for him, but for my little brother. My dad abandoned us when me and my brothers were young. He moved far away from home and always made excuses to avoid visiting. I rarely saw him growing up. He then got married again and had another child, which is 10 now (I'm 21). He also left his second wife but still cares for the kid.

Anyways the thing is that I rarely spent time with my little brother since he also lives far away, and today when my father decided to visit he brought him. He (my little brother) was so happy to see me and my other brothers and was excited about spending the day with all us but I'm so angry at my dad that I just refused to go with them. I feel really bad for him because I know it's not his fault but my dad is a stranger to me."		1	0	0.0	0.0	0.0	0.0
c1db40	2019-06-16 18:42:41	UberGeekUtah	AITA: FIL refused my spare bottle of Insulin when his BG is over 600...	"My in-laws have been angry at me for more than 2 years... to the point that they flatly refuse to associate with their own daughter if I am anywhere around. I have tried to continue to be nice to them,  but every single time... they throw my gesture in my face and then claim to be the VICTIMS of some sort of abuse.

TODAY, not an hour ago, my wife informed me that her father is having trouble paying for his insulin. I am type 2 diabetic and using NPH 70/30 on a short-term basis (to give my pancreas a rest) and seldom have to take my full prescribed dose... so I have a full vial extra. I offered it to him.... he refused.

My wife cried on him and told him that he was being a jackass, and he finally agreed to accept it, on the condition that SHE BRING IT TO HIM, and that I not have anything to do with him getting it.

I said NO. I stated that he has two choices, either grow up and come get it, and put an end to the bullshit, or do without.

&#x200B;

AITA for this?"	Not enough info	0	0	745.0	17.0	0.0	0.0
c1daog	2019-06-16 18:41:42		AITA I (20F) don’t want my SO to refer to me as dude/man/bud *only* when we fight? Never calls me that otherwise.	"Hear me out. I don’t care about being called these things casually because I use them too. But whenever we’re in a fight that’s the *only* time he decides to call me these things. EG: “whatever you fucking say then, bud!”, “I don’t fucking care man”, “chill the fuck out dude” 

The thing is he doesn’t refer me to those names ever even though I wouldn’t care if he did, and I don’t know why but it’s being associated in my head as more of a sarcastic attack and I tell him every time it blows over to not refer me to those things just when we’re fighting because it makes me feel weird. And I take it as condescending/demeaning. he takes it out of context and says “really? You are upset over the word dude? I call people dude all the time” 

No. I don’t mind being called dude. But *only* calling me that when you’re mad at me feels... weird. Yesterday over something silly I was like “oh come on man!” And he stopped and said “are you serious? You’re not allowed to call me that since I can’t call you that” and it really irked me because I have said it so many times that I don’t CARE if he calls me that but don’t call me it ONLY when we’re upset with each other. I don’t know. He could be calling me idiot or bitch so I guess it is a step up. I’ll take my judgement. This really isn’t affecting my life that bad, it’s a small conflict. it’s not like we’re fighting so much that I’m getting called bud every night (lmao)"		1	0	0.0	0.0	0.0	0.0
c1da66	2019-06-16 18:40:27	al_the_killer_	AITA - for not wanting to celebrate Father's day today	"My father in law passed away recently and he is due to be buried on Friday.

It's obviously a difficult time for my partner, and she asked If I would mind if we didn't do father's Day this year, (we have a 12 year old), I said yes, of course, I wasn't planning to make a big deal of it anyway. this has not been an issue, we spent today making final arrangements for her dad's funeral (picking pictures, and helping write the eulogy)

The problem started just before lunch today, my mother in a completely tone deaf way sent me a text message that simply read ""remember to phone your dad and wish him happy father's Day"", 

I have a complex relationship with my own father, and my Father in laws passing has opened up some old wounds and resentments that have probably been bubbling away for several years.

I texted her back to say that it wasn't a good time and continued about my day, only to be sent the same message again several hours later, neither of these messages bothered to enquire how my partner and my son are holding up.

I haven't replied... Yet, because every message I've written has been dropping with anger and sarcasm.

There have been a couple of other things that both my mother and other members of my family have done recently that have pissed me off, so this is just the icing on a very shitty cake.

Am I the asshole for not wanting to celebrate father's Day when my partner, my son and Hell, even I am hurting today?

*Edit some grammer issues"	Not the A-hole	0	0	45.0	1.0	0.0	0.0
c1da00	2019-06-16 18:40:05	PineapplePrincess27	WIBTA if I sold something for more than I paid for it?	"I’m pretty into fish keeping and I always browse Facebook marketplace for great deals on fish tanks. About a week ago I found a deal I couldn’t pass up (fish tank, stand, some accessories) for $45. I ended up using the stand for a fish tank I had already and the other things have been just sitting in my closet and I feel like somebody could be making use of these items while I won’t be,since I live in an apartment and I have a good amount of tanks set up as it is. 
I’d like to sell the tank + all the accessories it came with, $10 worth of coupons for fish stuff, a new filter cartridge, and 1/2 a bag of aquarium sand I bought for my other tanks but didn’t use fully for $50. 
Buying all of these items new would cost at LEAST $100 but I can’t stop feeling like I cheated the guy I bought it from out of his money. WIBTA if I did this?

I’d also like to add that it took 3 hours of cleaning to get the tank and accessories presentable because they were covered in slime from sitting in this dude’s garage submersed in water for who knows how long and I feel like getting a fully cleaned product is worth a little extra cash."	Not the A-hole	0	0	69.0	11.0	0.0	0.0
c1d9p8	2019-06-16 18:39:19	cn1_one	AITA down voting dank memes			0	1	6.0	4.0	0.0	0.0
