c1agow	2019-06-16 14:27:27		AITA for not rejecting my husband’s cultural tradition for kids?	"Parts of Eastern Europe have a tradition on 5th December where they bring in a “devil” to the children if they’ve done something naughty (hint:not cleaning your room, so all kids). The costumes are scary and they tell them they’ll “take them to hell” if they don’t behave. In some instances they even put them in a sack and pretend to take them to hell. I’d advise watching the video to get the full picture. Skip to 1:40ish. 

Then an angel comes and gives them presents but I’ve been watching some YouTube videos. The comments seem to think it’s funny (parents) but I think it’s pretty cruel. Maybe even a bit traumatic. 
 
My husband had it happen to him every year until he was 8 and thinks it’s a “nice tradition”. He’s adamant we will start with our child when she’s 3. I’m also adamant that we will NOT be doing that to our little one. 

https://youtu.be/lRsGZ2vzFBY

I think these girls look way too upset for this to be fun and the “devil” is far too scary. 

AITA?"		1	0	0.0	0.0	0.0	0.0
c1afhg	2019-06-16 14:24:25	jhungle	AITA For Becoming Friends With a Bullied Person and Now Wanting them Out of My Life?	"Please read this to understand this whole context fully. 

This person was someone in my grade who I always saw being alone and picked on. I want to clarify this person had no disabilities or any type of mental issues. One day they had to ride my bus and I decided to be a kind soul and let them sit by me. I shared a cookie I had bought from the school store and we became friends. I never really took into thought why this person had no friends or was being picked on, but I soon realized why. 

This person never left me alone. They never respected personal space and always made everything about themselves. If I brought up a personal issue of mine they would immediately make themselves sound as if they had my issue worse. And when I stoped talking to them about personal issues they got mad and kept telling me things like, “But were best friends, you should trust me with anything, because I trust you.” And would then proceed to make me feel bad about it. 

The friendship even ruined my mental health a bit. I know, sounds over dramatic, but they didn’t understand the word phrase “personal space” at all. 

When I got sick and tired of it I tried telling the person how they were making me feel, and then the person would soon realize what I was trying to say and would just walk off in anger. They never would listen to me! I even told them to just stop sitting with me at lunch and they would get mad at that and yell at me for it always. 

I’m still really their only friend, and it makes me feel bad to ty and abandon them, but I just can’t take it anymore. 

So, AITA for trying to get rid of this person in my life?

Edit: I want to thank everyone so far and future commenters because you support is very helpful! Thank y’all again helpful redditors!"	Not the A-hole	0	0	18.0	13.0	0.0	0.0
c1af4h	2019-06-16 14:23:30	iindsay	AITA for not wanting to visit my dad?	"My mom passed away when I was 15 and my dad hasn't remarried. I grew up in the midwest but moved to the east coast for college 16 years ago. 10 years ago, my dad moved to a western state. I don't know anybody in his state except for him and his girlfriend. I think due to the fact that he was widowed at a relatively young age, he has become overly attached to me and my brother. I think it's even worse with me because my brother is engaged and I'm single AF and don't have any justifiable reason (in his mind) to withdraw. 

In the past, my dad has visited me a couple times a year in my city (which is also a very popular tourist destination) but I don't have any great desire to go to his (also a cool city, but I don't know anybody there). He doesn't see me not knowing anybody there as a problem because he wants to spend every goddamn waking hour with me. It's suffocating. We don't have the best relationship due to his suffocating me, but he sees it as me being cold and nasty. He doesn't get it and is isn't interested in getting it. 

I'm a teacher and so I have the summers mostly off. I've already planned a trip to French Polynesia for mid-late July and a trip to Canada for late August just before school starts again. I have a month free before my first trip, but I'd really just like to chill out at home and relax. I don't want to go to visit my dad but he's really pushing for it. I haven't explicitly stated ""I don't want to go"" because I know that would kill him, but have mentioned wanting to stay here while I'm not traveling and chill out. He just keeps saying over and over ""I hope you can come"". 

So reddit, AITA? It's either I go and find myself half enjoying my time but half miserable and suffocated, or I hurt his feelings and give myself time to breathe. I'd prefer the latter, but he is the only dad I have etc."	Asshole	0	0	292.0	56.0	0.0	0.0
c1ada3	2019-06-16 14:18:49		AMITA for telling my father I appreciate him even if it doesn't seem like it on a card?			0	1	0.0	0.0	0.0	0.0
c1abob	2019-06-16 14:14:48	CShezza07	AITA For sarcastically mocking this girl i have a crush on about what she said to me about her body?	"She told me she doesn’t like her body and hates when people stare at her/it. She has a nice body i think and gets a lot of attention from other guys, we are just friends and she is in my class. She is into black dudes and I’m a white guy. I know this and accepted it. 

She is speaking to some other dude i saw on instagram and I’m not gonna lie I’m lowkey a bit jealous. But it is what it is.

Today she posted on instagram some photos of her body and her zooming in on her breasts, and Obviously the dude she’s speaking to has liked it and everything so i see what she’s doing, i sent her a message sarcastically mocking her saying ‘i hate when people stare at my body’ etc. 

She got irked by this and starting coming up with excuses saying they were accidental photos and she never said half the stuff i was teasing her about

AITA for commenting? Should i of left it?"	Asshole	0	0	415.0	470.0	0.0	0.0
c1abo9	2019-06-16 14:14:47	dreamsdreamsdreams	AITA for not calling my mother's husband, who she met and married when I was in my 30s, my stepfather?	"My mother met someone and remarried when I was in my early 30s and already married with a family myself. I don't feel comfortable calling him my stepfather considering he didn't really do any ""fathering"". He occasionally tries to act ""fatherlike"" but it's uncomfortable, like when I show up for a holiday and he says, Oh good, you're finally here. You can wash dishes"" and tries to send me to the kitchen to scrub pots and pans or yelling at me when I walk out of a room when my mother is screaming at me (it's best to give her space to calm down rather than engage). Frankly, I dislike the man and don't really want him to be ""my father"", but my friends have told that it's rude to call him ""my mom's husband"". Thoughts?"	Not the A-hole	0	0	0.0	5.0	0.0	0.0
c1abnp	2019-06-16 14:14:45		UPDATE aita for telling my wife I will divorce her if she has an abortion.			0	1	0.0	0.0	0.0	0.0
c1abnl	2019-06-16 14:14:44		UPDATE aita for telling my wife I will divorce her if she has an abortion.			0	1	0.0	0.0	0.0	0.0
c1a8zj	2019-06-16 14:07:18	Nightshad319	AITA for dating someone I’ve just met over my best friend?			0	1	98.0	41.0	0.0	0.0
c1a8rl	2019-06-16 14:06:40	sglolita	AITA for not saying Happy Fathers Day to my stepfather?	he’s been in my life since i was 10 but we’ve never gotten along. i tried to get along with him up until i was 13 when i saw him talk shit about me in a groupchat to his gamer friends calling me a ‘brat’ and a ‘lil bitch’. don’t like the way he treats my mom either and since i’m now 20 and im rarely at my moms house i don’t see him as much. mom asked me if i was going to say happy fathers day to him but i told her i didnt want to.. she said i was being mean and it would make more peace in her house but i really don’t see a point in praising someone who was never a parent to me.  i mean he lived off my mom til he got a security job when i was 17. anyways, AITA?	Not the A-hole	0	0	45.0	25.0	0.0	0.0
c1a7s7	2019-06-16 14:03:41		AITA for changing my Netflix password to stop my Ex's brother using it?	"While me and my ex were together I logged into Netflix on her home TV so we could watch stuff on a night in or whatever, and I never logged out so during our relationship her little brother (he's 17, I'm 19, my ex was 19) would use it while I wasn't around. He didn't ask permission or anything but I didn't really expect him to since it was just Netflix and I obviously don't mind him using it so I just made nothing of it. Also worth noting I got along with her brother, we weren't best buds or anything but he seemed like a decent guy.

Me and my ex broke up on good terms just before university and that was that. I log into Netflix for the first time in 3 months after we broke up and I see a BUNCH of shows for me to 'continue watching' even though it obviously wasn't me, it was her brother watching them. More than anything I found it kind of weird so without thinking much of it I logged him out and changed the password. Upon further consideration I feel like this may have been an overreaction but I'm not too sure. What is Reddit's opinion, AITA?"	Not the A-hole	0	0	0.0	0.0	0.0	0.0
c1a7h1	2019-06-16 14:02:49		AITA for wanting a share of my grandfathers inheritance	"The money and the house got passed down to my mother, and a lot of it. I got kicked out on my 16th birthday, it was an extremely dysfunctional household, so I’m glad I got out of there. She has been an extremely selfish person her whole life. Giving the least to her children, we would go hungry, she would scream at us for taking food out of the cupboard. We barely had any clothes and she would take us to school in her Mercedes with a really ripped bag and holes in our shoes. When she kicked me out she kicked me out with a few bin liners filled with my clothes, no money or a phone to contact anybody. The reason she did this won’t me mentioned but I’ve spoken to friends about it and they’re shocked at how she reacted. Safe to say I hold some resentment I’m working through.

When I moved out she had already inherited the house and the money. We didn’t talk for a year and then got back in touch and started building our relationship again. 

I had a conversation with her a while ago about my grandfathers will. I asked her why she wouldn’t let me see it, she refuses to let anyone see it. I was a part of his life and I’m sure he would have passed down some of his livelihood to his two grandchildren. He was a professor and I find it hard to believe he didn’t write anything out for us. She started manipulating her way out of it, crying and talking about how it’s her money and her house. I said that either way you’ve been neglectful to us our whole lives, you haven’t supported us at all, we were in his lives too. While you were living it up in all the glory of a huge house and nice cars, paying for your boyfriends flights over to UK and buying him designer belts and bags, we had to cope with being kicked (she’s kicked most of us out for the stupidest reasons) out and living in grotty hostels for years of our lives until we were old enough to rent a flat. We watched as she showered him with gifts while we were struggling. For fuck sake she won’t even pay for her kids to go to any event she isn’t involved in and she gives them a haircut once a month. 

So I told her she’s neglectful, I said I wanted to see the will. I want to see the documents, I have a right to see the will. She went on to try and dodge what I asked. I pushed the subject and she then suddenly shifted her perspective. She said she’d pay for my driving lessons if I wanted. She said she’d be more supportive. That hasn’t happened. 

Jump to now, these feeling are resurfacing because she is now showering her new husband with our grandads money and still refuses to show us the will. 

AITA if I want to see the will. AITA if I want a share of it?"	Not the A-hole	1	0	0.0	0.0	0.0	0.0
c1a6r0	2019-06-16 14:00:55	AdventurousBlock0	AITA for blaming my best friend for her string of bad relationships? She’s intent on making the WORST relationship choices and I had enough.	"I’ll call my friend Beth (fake name). Beth is 21, and we’ve been friends since elementary school. We were always inseparable, and even know, we’re each other’s closest friends. Also for context, I’m a 21 year old bisexual male.

So when Beth was 16, she got into this “relationship” with this 22-year old trash dude, I’ll call Chad (16 is legal in my state, but I know, super creepy). He would encourage/pressure her to skip school, introduced her to smoking (cigarettes and weed), introduced her to alcohol. Don’t get me wrong; we were 16 and she might’ve found all those things anyways. But to say this creep was NOT a good influence on her would be an understatement. They broke up after a year because he cheated on her with his ex. This devastated Beth, but she eventually got over it.

Her next (serious) relationship was when she was 20 and dated this 17-year old high school junior. They moved in because he had a bad home life after like 3 months, but broke up after another 9 months (this was last week), because she was dating a teenager with the mindset of a 13-year old, and he was cheating on her pretty much the entire relationship. 

She was devastated about the break-up. especially after he revealed he was with all of these other girls from his school (presumably to hurt her). Her personality has changed; she’s turning into one of those “men ain’t shit” feminists. My boyfriend just left for a research program, and she’s pretty much non-stop saying things like “he’s going to cheat on you”, “all men do”.

Finally, after her last “you really think a gay man at a new environment will stay faithful? You’re naive” comment, I told her that unlike her, I can actually pick decent guys to be in relationships with. Just because she’s intent on choosing literally the worst, trashiest, deadbeats she becomes attracted to doesn’t mean other relationships can’t work out, and that if she wants a relationship to actually work out, she should start by having standards, first.

She didn’t argue or anything; just broke down in tears and left. I kinda feel bad because I know I was kind of harsh. But I do think there’s actual merit in my words. She needs to pick somebody she’s compatible with, has common interests with, and work well together with; not just some random guy that just expressed an interest in her. I really do feel like she’s putting herself in these situations. AITA for pointing it out?"	Not the A-hole	0	0	0.0	0.0	0.0	0.0
c1a6mq	2019-06-16 14:00:37	gonna_murdermycousin	WIBTA if I ask my mom to kick my cousin out to go live with her abusive mom?			0	1	0.0	0.0	0.0	0.0
c1a5zh	2019-06-16 13:58:50		WIBTA If I am mad at my husband on Father's day?	"To save time and your sanity, I will not go into detail about why I am mad. Long story short, yesterday was our daughters birthday and he basically forgot many important things in multiple different occasions, but nothing he wanted, only things I or our daughter needed. He also didn't discuss with me before promising his parents they can have our daughter for 4 DAYS STRAIGHT. We haven't been away from her for longer than one night in her whole life, and she turned two. 

I wanted to give him a relaxing Father's day, but honestly I'm still pretty pissed and I don't know if I can just pretend to be nice and happy for the sake of a holiday and forget about everything. WIBTA if I ruined Father's day for him by being (reasonably) pissed?"		1	0	0.0	0.0	0.0	0.0
c1a49f	2019-06-16 13:53:49		AITA for thinking karma got my sister in law	"About 6 yrs ago mum had cancer, I asked brother for support. SIL says they can't help as her parents are alive, she has a child (4 yrs older than mine, but you know...)
3 years ago dad was finally diagnosed with dementia, again I ask for support & get similar answer from her.
Not many visits to my/brothers parents even after dad dies & mum struggles. 2.5 years ago & both parents have passed away.
Today, big fb post to her dad about how wonderful he has been & is now suffering from ""that cruel disease, dementia."" Although I'd never say it to her or brother's faces, I am a little glad that karma has come to her (although at the same time I know how awful dementia can be, seeing it in several people and wouldn't wish it on anyone).
So, AITA for feeling a littke smug about this?"		1	0	0.0	0.0	0.0	0.0
c1a3vg	2019-06-16 13:52:41		AITA if i refuse to wish my dad happy father’s day	"To me I don’t consider my dad as a “dad dad”. He was kind of never there for us; sure he was working a lot and paying the bills which I appreciate but I don’t have any form of emotional connection with that man at all. I see him maybe once a week and even then we don’t talk. I have tried for a while but we don’t agree on a lot of things and I just find it hard all around to talk to him so I eventually stopped trying. Suffice to say he doesn’t really try either. 

On this father’s day, AITA if i don’t wish him because i don’t acknowledge him as my father?"		1	0	0.0	0.0	0.0	0.0
c1a3me	2019-06-16 13:52:01		AITA for leaving a group of friends behind after they annoyed myself and my other friend all day?			0	1	0.0	0.0	0.0	0.0
c1a1q0	2019-06-16 13:46:14		AITA for ruining fathers day accidentally?	"Me and my dad do not have the greatest relationship.I do not share his hobbies and he is always pushing me to play football because of my big stature even though I have no interest in the sport.

We were at golden corral.We were having a great time.After a while I got some icecream.I wanted so more but I felt a little embarrassed going back up there as there was only one lady up there who had to do a lot and she was never at the icecream counter and had to stop what she was doing to scoop me some icecream.I didnt want to be annoying so I asked my brother to get me some icecream.He said no and I was annoyed as it was such a small task and he was being a jerk bot doing it.

We started arguing and my dad just told him to do it but then he started lecturing me about not being shy and playing football.I said I did not want a lecture and that pissed him off.Had we not been in the restaurant I think he would have lunged at me.He ranted to mom the whole way home and now everybody is mad at me for ""ruining fathers day"" even though I elex my dad was completely unreasonable."	Everyone Sucks	0	0	0.0	0.0	0.0	0.0
c1a0hz	2019-06-16 13:42:35	youhavebeenindicted	AITA for leaving my cousin on his birthday?	"My cousin who I never hang out with turned 25 and invited me out to a night drinking with his friends.

He tells me he's invited plenty of people, and says there will be at least 20 - 30 people at pre drinks which is being held at one of his friends place nearby.

I arrive and there's maybe 6 people there, one of the 5 close friends he invited actually arrived. No biggie, it sucks his good mates didn't turn up but I'm glad I'm there for him because I think having no one turn up on your birthday is rough enough.

We end up going out to a bar, I offer to buy him a drink and I get us 4 drinks. He buys me one drink and asks for the money it cost him. I paid the $50 fare for the uber to get him, and his two friends out, with zero acknowledgement. I wasn't looking for compensation, just gratitude, but it's his birthday, so I didn't get too beat up about it.

It's 1 AM and he comes up to me as I'm still talking to the girl I've met and says him and his two other friends are going somewhere else down the road, and I say that I'm gonna stay here with the girl, because she was giving me signs she wanted to take me back to hers. I said Ill let him know what happens in the next 15 mins as the place was closing soon.

She asks me back to hers and I text him saying I was gonna go back with her, he responds with a text saying that was cool.

I wake up, it's mid morning, and I see my phone is at 5% battery. I call him and he doesn't answer. I text him asking if he's awake and could possibly pick me up because my phone was about to die, and gave him the address. He lives maybe 20 mins from the place, and I figured it would be worth asking incase my phone died in the process of getting an uber, leaving me stranded as I'd left her house already.

No response, so I called an uber again and as he pulled up the phone died. $80 later being gridlocked in traffic for what was supposed to be a 20 min drive, I arrive at his house. He's been awake for hours. He's happy to see me and we talk about the night, I tell him I went home with someone (first time I've literally ever had a one night stand) and he shows no praise, fair enough.

I later find out he has told literally all his friends (even the ones who didn't show up) that I ditched him on his birthday despite literally being the only one who went, paid for almost everything and saw the night out with him until 1 AM, and they all gave me a hard time for it. Am I an asshole for leaving him with his actual friends to go home with a girl? or should I have stayed, despite being expected to fund the entire night because it was his birthday?

**TLDR: I went home with a girl on my cousins 25th birthday at 1AM after paying for the uber there, buying him drinks all night and being one of two friends who actually went out with him despite inviting all his close mates, am I an asshole or was I supposed to go home with him instead of the girl as he only stayed out for maybe another hour?**"	Not the A-hole	0	0	861.0	72.0	0.0	0.0
c1a08h	2019-06-16 13:41:45		AITA for leaving behind a group of friends at an event after they annoyed me and my other friends into not wanting to be around them?			0	1	0.0	0.0	0.0	0.0
c19zl2	2019-06-16 13:39:39	krissylynn19	AITA for posting on FB that people should not be asking for medical advice on facebook?			0	1	0.0	0.0	0.0	0.0
c19zi7	2019-06-16 13:39:24		AITA for using a Spotify account after breaking up?	"My BF bought me the account while we were together. We broke up about 6 months ago and I'm continuing to use the account. I don't know if he knows he's still paying for it since I've blocked him.

Am I the asshole for not telling him or not changing the payment details?"		1	0	0.0	0.0	0.0	0.0
c19zhz	2019-06-16 13:39:23		AITA for choosing not to travel to be with my dad on Father's Day due to weather?	"Last weekend my dad told me that he was planning a Father's Day celebration with his side of the family and that I should think about coming in. My parents are divorced and I decided to stay with my mother this summer as I am home from college. Her and my father live in different states and the drive would be around 4 hours. I had originally planned to come in on the Friday of Father's Day weekend and leave on Monday.  

I'd been having some car issues recently and believed that my battery was low. We had scheduled an appointment earlier in the week to get a new one and it just so happened to be on Saturday. So, I had told my father there would be a change of plans and that I would come in that afternoon instead, no problem. I got the new battery and prepped to leave. Prior to my departure, I learned that the state I pass through was getting blasted with rain for the remainder of the day. I decided err on the side of caution and told him that I would be coming in first thing Sunday (Father's Day) morning.

This morning, I woke up after some not-so-good sleep (don't know why) and prepped to leave. I decided to check the weather once more as this part of the country has been getting rocked by bad weather for the last month. I noticed that for a good portion of the trip I would be, once again, driving into and following a large storm. While I would have loved to see my father, I chose to stay back. Due to the poor sleep I had gotten last night, I felt that my decision making would not have been as sharp and my gut was telling me it was not worth the risk. 

The phone call I just made to him was a tough one as he verbally expressed his disappointment. I paced around this morning trying to weigh the pros and cons of the situation as this was a tough moral quandary for me to navigate. AITA for not feeling comfortable driving in bad weather?"	No A-holes here	1	0	0.0	0.0	0.0	0.0
c19zb4	2019-06-16 13:38:45		AITA for cutting off my sons father for good			0	1	0.0	0.0	0.0	0.0
