c1gc61	2019-06-16 23:15:44	KimJongIllyasova	"AITA For Sending a ""Edgey / Memey"" text from my friend's phone to his family member?"	"**The Incident:** So 'David' and I are hanging out one night at his place along with another friend on the night of his mother's birthday. There's a buncha (mostly elder) people over downstairs celebrating her bday, and we are upstairs hanging out. His relationship with his parents is a little distant, so we assume he kind of just wants to be upstairs. David is still being aloof, kinda weird, and just overall getting under our nerves. We try to call him out on it but he's still being weird. I'm irked by his coldness so I kind of try and do something to get a reaction out of him. An *edgy joke* of sorts that we always make. His phone is unlocked and I send a message to his brother ""I don't care about Mom!"" and that's that. A pretty stupid text, that at the moment I thought was troll-y and continued our ""edgy"" humor.

But, eventually his brother walks in looking for him saying ""Why would you send that message? That's so mean."" And David is confused, because he doesn't have his phone.... immediately I'm scared. Fuuuuck.... this message that I meant as a troll/joke didn't really work and honestly wasn't even all that funny - but I didn't mean it with malice. Now David is pissed and convincing his brother. He asks all the people in the room who had his phone, but nobody (including myself out of being scared in the moment) says anything. He asks me, I lie and say no and leave his place... Soon enough, couple days later, he kind of figures out it was me and I don't admit to anything - I don't say I did it nor do I deny it, kind of lying by omission... shitty I know. 

But, after being pressed on it, I tell him it WAS me over a long text message & a hand-delivered letter where I absolutely poured my heart out telling him how sorry I was & insensitive it was to him.

**Present:** WELL, it's been 3 months and he hasn't read my apology, nor gotten back to me, & he told another mutual friend of ours that he ""has no intention of reading the letter/msg."" What do I do? I truly love this friend, and Im sorry for being so insensitive & mailed him an apology + gift - yet it's been a long time and nothing... What do I do I guess AND AITA?   


--> TLDR suffices tbh


----


**TLDR**: Have a friend I make ""edgy"" and ""dark"" jokes with. At his house, during mom's bday, his phone is unlocked & i take it and send ""I dont care about Mom!"" msg as a joke to his little brother. He's upset, I'm scared/anxious to admit I did it so I leave & lie by omission. He finds out it's me, I tell him I'm sorry I sent it and say it was not malicious just a horrible/insensitive (see: *edgy*) joke. Weeks pass and I send him a very lengthy apology text, mail him a gift, and also send him a very long heartfelt letter how sorry I am, how much our friendship means and that I'm basically bad for doing that. --- It's been 3 months and no response from him - I heard from our mutual friend that he ""doesn't want to read the letter."" I'm pretty bummed... AITA? ^^also: what do I do now? ^^^thanks"	Asshole	0	0	371.0	239.0	0.0	0.0
c1gbro	2019-06-16 23:14:38	Throwaw421	AITA for getting an abortion when I knew it would hurt my boyfriend?	"I became unintentionally pregnant a few months ago, once I told my boyfriend he was over the moon once he got over the initial shock. I felt like a fucking monster when I interrupted him in the middle of his happy babbling about buying baby stuff and telling his parents, I told him I wasn't sure if I wanted to keep it and the mood quickly did a 180 from there. He sat me down and told me that it was up to me to decide what to do about the baby because I was one the carrying it and he'd support me no matter what. While sweet it somehow managed to make me feel even worse.

We both agreed early in our relationship that we wanted children when we got our lives sorted out and were financially stable, but my boyfriend simply adores children and is always at his happiest when playing with his niece and infant nephew. So he clearly wouldn't mind having children a bit earlier and I feel like a shitty girlfriend for depriving him of that.

I spent a full week thinking it over but in the end I decided to get an abortion. We're both only 21 and still studying in university. Along with that while we're both financially responsible we still only barely get by on our rent, working part time and going to university full time wouldn't leave us with enough time and money to properly raise a child together.

I told him my decision and while he clearly had a hurt look on his face he agreed with my decision and said it would be the smart thing to do. Two weeks later I had the the abortion. There was a *lot* of mutual crying and we both took a few days off to cope with it. My boyfriend -sweetheart that he is- tries not to get upset around me, knowing how guilty it makes me feel. But it's obvious from silent phases he's become prone to and the fact that's been distancing himself away from his niece and nephew that he's not coping well with it.

I've tested the waters to see if he's willing to go to my therapy sessions with me but he's insisted that there's no need. Which clearly isn't the case considering how miserable he is with the whole thing. He's slowly getting back to his old optimistic self as time passes, but the lingering regret is still clearly there and I feel like shit because of it."	No A-holes here	0	0	1.0	1.0	0.0	0.0
c1gbm3	2019-06-16 23:14:16		AITA for suddenly ghosting my friends of four years?	"I’m a very shy person, but freshman year of high school I made two friends, who I continued to be friends with until the last month of HS.

They have a lot of other friends who they’ve known since childhood (very social, drugs and relationships type people) while they were basically my only ones, so I felt like I never really fit in the group, but I was just happy that I actually managed to make friends.

One of the girls from their friend group started hanging out with the three of us at lunch, but for some reason she hated me. She always called me a hoe because of my clots, and often made fun of my personality (usually backhandedly) since I’m quiet and “weird” I guess. Always while my friends were around. 

I do OMAD to maintain my body shape and so I skip lunch most of the time, but occasionally (once a week?) they would offer me food that they didn’t want, which I would take sometimes. Whenever the mean girl would offer me food she would throw it at me, which I would laugh at to ease the tension (which I also did with her insults) and take the food since i was always hungry. To this day I don’t understand why she was so rude to me though? She had a boyfriend and is more conventionally attractive, and has more friends, so I’m just assuming she acted like that because I let her. My family is rich (which a lot of people at school talked about since there’s rumors about me having maids and living in a mansion) while she’s not though.

Anyways one day they all ditched me at lunch, and when I found them the mean girl wouldn’t let me sit down with them and refused to move her stuff which was blocking the chairs, and started berating me like she usually does and my friends just sat there quietly, but instead of laughing like usual I just said that I was leaving. And that was the last time I talked to any of them.

I had class with one of my friends and she kept trying to apologize to me for weeks but I ignored her. I blocked their numbers. I avoided them completely and hung out in the bathroom or the library at lunch. My acquaintances who know that I was really good friends with them though have all said I was the asshole for ghosting them because “they weren’t the ones being rude, it was the mean girl”. I feel like I was getting bullied though, my description can’t capture the way it made me feel. 

My mom is also concerned and saying I was wrong (even though I never told her why we stopped being friends) because I burned bridges with my middle school friends as well (so it looks bad), but I don’t want to be around people who don’t stick up for me and continue to be friends with someone who is cruel for no reason? But AITA for ghosting them instead of trying to maintain our long friendship?"		1	0	0.0	0.0	0.0	0.0
c1gah7	2019-06-16 23:11:13	Cursed_Shampoo	WIBTA if I tell my Moms friend that my sister had lice?	"I (16) want to tell my Moms friend that my little sister (8) had lice because she was over without knowing when my sister had it.

Afterwards I asked my mom if she told her because that seems like a logical thing to do, and my Mom said no. I then found out that my sister had been out for about 3 hours (I was asleep) with her and her daughter. And my mom already knew she had lice before sending her. Now, I waited 2 days to bring it up again, and I asked if she had told her friend yet, which prompts my littlw sister to run into the room screaming that she doesn't want anyone to know about it, to which my Mom said she wasn't going to tell anyone and that she has NOT told her friend. I feel like they definitely need to know this, and I want to tell them myself now. WIBTA if I did such?"	Not the A-hole	0	0	21.0	11.0	0.0	0.0
c1g7zm	2019-06-16 23:04:04		"AITA For Sending a ""Edgey / Memey"" text from my friend's phone to his family member?"			0	1	0.0	0.0	0.0	0.0
c1g7uu	2019-06-16 23:03:43		Villager problem			0	1	0.0	0.0	0.0	0.0
c1g7pp	2019-06-16 23:03:18	katrinian	Returning shit your ex has left behind			0	1	0.0	0.0	0.0	0.0
c1g78v	2019-06-16 23:02:00	whydoiexist_162718	Aita for making a friend get out of my car after she insulted me and my other friend.	"(Fake names obviously)
Me and 3 of my friends were going to eat and watch a movie together, it's a yearly tradition that we do this whenever we get out of high school for summer. We were at the restaurant when my friend, Ally, seen her ex-boyfriend with his new girlfriend, she had really liked him and he cheated on her so she cannot stand the sight of him, we're eating and Ally's ex comes up to us and tells Ally that it's good to see her, they, more like he, talked for 10 minutes and he went to pay his check, she's visibly pissed because of him talking to her, we finish up and I pay the check, we make it inside my car and I tell her sorry about how she had to talk to him, she makes a comment about how he ruined her night, we're halfway to the theater when her and my friend start arguing for some reason, idk what had happened because, I had music on and it makes it so I can barely hear a thing from the back seats, Ally starts yelling at my friend, Adam, beside her and she makes a comment about his weight, I have turned the music down by this point and me and next to me were saying, that was uncalled for, I asked why she yelled at him, she said something along the line that he wouldn't drop the subject about her ex, she called him fat-ass in the sentence so I didn't care at that time what he did, I tell her just to STFU if you're gonna talk you your friend like that, she then insulted me by making fun of my mom. I then told her to get TF out of my car, she started apologizing, I was so mad I didn't care, I just told her to gtfo again, she did and I made sure she called someone to come get her before we left. So, AITA?

Edit 1: what Adam was saying to her was an apology and what he would've done in the situation. This went down yesterday too so I am still getting information, too.

Edit 2: She has acted this way before but for lesser things."	Not the A-hole	0	0	113.0	28.0	0.0	0.0
c1g76d	2019-06-16 23:01:49	bassguy07	AITA, Potential home invasion OR me being a heartless douche.	So, I was sitting at home earlier playing fifa and there was a knock at the door and I looked and there was a white dude sitting in the chair by the door with his hood up. I looked through the window and there was a black dude standing there also with his hood up, bearing in mind it wasn’t raining. I got a weird vibe so I picked up the bat by the door and when I answered this sketchy ass guy asked me if I had any money I was like ”nah bro”, trying to keep it casual. Then he asked me for a cigarette and stood a litttle closer so I kinda pulled the bat a little closer and said “no”and these two guys kinda eyed me up and saw that I was holding a Louisville slugger and left. Should I be sketched out? Should I have reported it to the cops as suspicious? Were they casing the joint? I’m at work now and unsure if I’m gonna come back and my had been burgled. Also, I thought I would mention ethnicities because although I am not a racist I did get sketched out at the sight of a black guy with his hood up standing at my door in the middle of the day. But then again there was also a white guy there so AITA and also subconsciously racist or am I just naturally fearful and a bit of a wimp?	Not the A-hole	0	0	4.0	2.0	0.0	0.0
c1g727	2019-06-16 23:01:30	baddaddyo101	AITA for not wanting my son.	"
Brief overview: my ex and I had a horrible falling out, she accused me of domestic violence and took my son away from me. I fought tooth and nail to be award joint legal/physical custody. She made the process harder by marrying into money and law enforcement, but in the end I got what I wanted. The problem began when she forced our son to call him “dad”, which I was fine with, but I started not being included in appointments, school events/ emergency contact lists as his father, it was his stepdad. Meanwhile, my ex brainwashed our son to think SD is more important than myself because of money. My son is 8 now and he doesn’t care about me and frankly treats me bad. 

The problem: part of our agreement is that we get him for respected parent holidays ie mothers/Father’s Day. On my school day he told me he was working on a Father’s Day gift for me. He went to his moms for her days and he was returned to me today with no gift. Now, it’s not about receiving a gift, but when he saw me I got no happy Father’s Day, instead I was greeted with a “I forgot to make you a gift”. I asked him what happened I thought you worked on one in school. He replied claiming he made nothing, which was a lie. I confronted about his lie, which he denied twice before admitting he gave it to his dad (SD). Again, it’s not about the gift it’s about the lie. This isn’t the first time he’s lied to me and I’ve talked to him about how bad lying is. I’m not going deny, my feelings are hurt, mostly because he feels like he has to lie to me and that he prefers SD to me because of the lies his mom is telling about myself. He’s told me he doesn’t love me/ not suppose to love me because his mom threatens to take her love away from him; and has to love SD or no gifts/vacations. 

I’ve given so much for him financially, emotionally and physically. I have given so many opportunities up, and I’ve tried so many different ways to understand his thought process and to be honest and truthful to him, but still nothing back. I’m at that point that I’m no longer happy because he always looks miserable around me and he doesn’t appreciate anything I give him because to him it’s always a comparison (SD/mom got him something better). And as much as it pains me to say, I regret fighting this hard for him. People say it’ll get easier, but it’s not. AITA for wanting to give up the fight.

EDIT/UPDATE: Honestly I didn’t expect this post to get this much traction. I want to thank everyone who commented, who took the time to read what I wrote, that what you wrote didn’t go unnoticed. I apologise I can’t respond to everyone since this was so overwhelming. 

I just want to express that i read every comment, I understand and accept the judgement given to me. I do want to clear a few things up. First and most importantly, I tell my son everyday I have him, every time I see him and every phone conversation I get with him that I love him. Second is that I should have expressed this was a feeling and not actually going through with it. Third, the domestic violence was on me not her, I had witnesses who testified on my behalf and it went to court. Lastly, my son is in therapy, he has a court appointed one, a personal one and he has a weekly meeting with his school counsellor.

Again, thank you for sharing your thoughts, i know and understand this is a controversial and sensitive topic. I appreciate all of those who gave advice and suggestions in what I could do to help my son, better our relationship, my mental state and legally (amongst other things). Thank you to those who shared their personal experiences, both parents (step-parents) and children of divorce. Hearing experiences made me realise I’m not alone, that people go through this too, that me feeling anything remotely negative is fine, it comes down to acting on it. Like many of you said the best I can do now is make sure he understands I’m there and will always be there for him no matter what, I know it’s going to be a long hard battle, but he is my son and worth every second of it. I guess it took a few strangers to make me realise that."	Everyone Sucks	0	0	0.0	0.0	0.0	0.0
c1g6tj	2019-06-16 23:00:54	C_L_A_U_S	AITA for not calling my step-father for fathers day?	So my mom is giving me shit for not calling my step-father for fathers day. Long story short he's kinda an asshole( his own daughter hasn't seen or talked to him in over 3 years) He's borderline abusive, always fighting with my mom or my sister, I don't see him as a father figure. The only reason I am glad he is around is because I guess my mom is happy when they're not fighting because no one else is left to stay with her (sister is in college, I moved out). I don't feel bad about not calling him because he's rarely ever done anything for me, and he isn't even a good father to his own daughter, or my sister	Not the A-hole	0	0	173.0	33.0	0.0	0.0
c1g6nd	2019-06-16 23:00:27	hcdfddd	AITAH for refusing to take photos of my wife??	"My wife, 29F, and I 30M, have been together for nearly a decade. She recently started a new Instagram, where she posts photos of her latest outfits, and current trends. That’s fine with me, but she’s constantly asking me to take photos of her so she can post them. This is a weekly thing.. and it’s really starting to annoy me. The most frustrating part is her complaining and telling me how bad of a photographer I am. She’s constantly telling me that the angles are bad, that I have no vision, and how can I not see how to take a good photo. Why is she asking me to take photos of her if I’m such a shitty photographer?? She knows that I no longer want to be her photographer, and that it bothers me when she is constantly asking me to take pictures when we are out, and I’m just trying to enjoy myself and spend time together.  Lately, she’s been being really sneaky about it by asking if I want to go to a bar, or somewhere to spend time together.. but I know she’s only asking because she wants me to take photos of her latest outfit. This really bothers me because she’s knows what she’s doing..I’m not stupid, and know the photos are the real reason she’s asking me to go somewhere..Today we went to have a nice lunch together, and I thought we were just gonna be hanging out. We hadn’t spoken all weekend due to an unrelated argument... As we are walking along, guess what? **Surprise, “can you take photos of my shoes?” It really upset me because we haven’t spoken all weekend, and I thought it was nice to spend Father’s Day together having some drinks and enjoying each other’s company. 

She made a snark comment about me being upset because she asked me to photograph her... yea I’m upset.. I don’t want to have a photo shoot. That’s not why I came here. We haven’t spoken all weekend, and now you want me to take more photos of you?? It got heated, and we are currently not speaking. 

Am I the ass hole??"	Not the A-hole	0	0	0.0	1.0	0.0	0.0
c1g6hv	2019-06-16 23:00:02	throwawayjpntripbnb	AITA for asking my now ex-boyfriend to pay for half of my Airbnb fees?	"My ex and I dated for 6 years, 2 of which at the end were long distance because I moved to Canada for a new job and he remained in Tokyo (where I also lived for the first 4 years). We would take turns visiting each other, about once every six months during this time, and our goal was for him to move to Canada sometime this year or next year to be with me.

Well long story short, two months ago I booked tickets and got time off to visit him for two weeks in July. Got plane tickets, planned trips to various places in Japan, booked hotels and whatnot. Two weeks ago I found out he was cheating on me with someone from his work. The only reason I even found out was because I was/am friendly with one of his coworkers, who thought it was a good idea to tell me. This had apparently been going on for 6-8 months.

I was absolutely fucking devastated but broke up with him. Still processing it, to be honest. He showed absolutely no indication that he'd do anything like this.

Now the problem is that I have nowhere to stay for my trip next month, since I was supposed to be staying at his place. My plane tickets are non-refundable, and so are all of our hotel bookings. I looked up Airbnbs and found that a two-week stay at a decent place in Tokyo costs about $1000. It would be less but it's soon so I guess it's more expensive.

I called him, explaining that I was gonna go on the trips we planned by myself, and that I wanted him to pay for half the Airbnb fees, since I hadn't budgeted for him cheating on me.

He's refusing, saying I'm being petty and vengeful and that there are other options: cancelling my plane tickets/hotel bookings (I could but they're non-refundable and it's a waste), staying at a hostel (cheaper than $1000 I guess, but I wasn't planning on staying in a hostel, I was planning on being in an apartment), etc.

He makes quite a lot of money and isn't struggling financially in any way, so I think it's reasonable of me to ask him to do this, especially as for ME this all is a LOT of money. He said now that we're not dating he has no obligation to pay for anything for me, and the fact that I'm asking makes me look like a crazy vengeful gold-digger. My friends are also divided on whether or not this is something I should be asking for.

I guess I just want to know if I am being unreasonable? I guess I could cancel the trip altogether but I don't wanna let him ruin my vacation like that. Am I the asshole here?

**TL;DR**: Was supposed to visit boyfriend in Tokyo for 2 weeks, find out he's cheating on me, need to get an Airbnb now that we've broken up. He thinks I'm a ""gold-digging asshole"" for asking for half the Airbnb fees, but I think it's reasonable."	Everyone Sucks	0	0	0.0	0.0	0.0	0.0
c1g5mj	2019-06-16 22:57:34	vicpoo	AITA for leaving 5 minutes later then a safe estimation	"I told my mom I would start to leave at around 3:30. At 3:30 she told me to leave I told her in a minute to finish up my game. At around 3:34 I started to go and left at 3:35 my mom is pissed because I left 5 minutes later than I said I would. The place I was going to would only take 10 minutes to walk, and I was going to arrive at 4. So AITA?

Edit: she said that she will pick me up 10 minutes late because I left 5 min late."	Not the A-hole	0	0	295.0	60.0	0.0	0.0
c1g3y6	2019-06-16 22:53:02	throwawaymedstude900	AITA for refusing to drive?	I am a medical student. One of my rotations is at a private physician's office that is nearby and also accessible via public transportation. When picking the rotation we were told that we had to report 2-3 days/week at this office and if asked, we could go to his other offices. I have recently leased a car for my actual rotations (mandatory) coming up, but I can barely afford that as it is and have to often ask my parents for help. His other offices are a minimum of 80 miles each way. Both the physician and his staff often try to pressure myself and my colleagues into going to these offices full well knowing the gas and mileage on our cars will be a huge financial strain. We have tried to explain this to him several times and it seems this is a recurring issue each month our students rotate with him. He also has undergraduate students who participate in these rotation, but they are paid for the time and he uses them as examples as to what we should be doing. He often mentions carpooling when we bring up the issue of gas and mileage, however we were not expected by our administration to attend these offices in the first place. AITA for simply not going despite his pressure and reprimands?	Not the A-hole	0	0	0.0	0.0	0.0	0.0
c1g3t0	2019-06-16 22:52:37	Origin_6	AITA for my (perhaps problematic) choice of song in our workplace development activity?			0	1	0.0	0.0	0.0	0.0
