c1izzt	2019-06-17 03:58:34	CheatedandPettym	AITA for ruining a girl’s relationship when I don’t know the guy?	"About two-three weeks ago I was swiping through tinder when I got a superlike. I read her bio (because who uses superlikes?) and it said something along the lines of:

“I’m taken. Looking for something discrete and NSA.”

Given that bio and the fact none of her pics had her face showing, I naturally assumed her boyfriend had no idea she is cheating on him. I’ve been cheated on in the past so this really irked me more than it should have. 

I liked her back with the sole intention of letting her boyfriend know what she was doing. We hooked up a few times before I finally found out who she was dating by Facebook stalking her. 

Basically sent the guy a long message explaining the situation along with screenshots of all her texts. Girl in question textbombs me calling me every name in the book. 

I told my friend this tonight and she was honestly disgusted by my actions. Really surprised me, but I guess maybe my judgement is skewed because of being cheated on in the past. AITA?"	Asshole	0	0	0.0	0.0	0.0	0.0
c1izzn	2019-06-17 03:58:34		AITA for wanting to be by myself on a family vacation?			0	1	0.0	0.0	0.0	0.0
c1izvy	2019-06-17 03:58:12		AITA for calling out a neighbour with a racist dog?			0	1	0.0	0.0	0.0	0.0
c1iyyy	2019-06-17 03:55:29		Am I the asshole for turning down a girl purely because I don’t find her attractive and instead trying to get with her friend?			0	1	0.0	0.0	0.0	0.0
c1iy9r	2019-06-17 03:53:12		WIBTA if I left products on random shelves in big stores when I realized I didn’t need them	"My dad told me people are paid to put products on their correct shelf, so we once in awhile we can put something we don’t need on a random shelf. I only do this if I change my mind when I’m checking out and I tell the cashier, but I’m too afraid of being yelled at, which is why I haven’t followed his advice

Would I be the asshole?"		1	0	0.0	0.0	0.0	0.0
c1ixzm	2019-06-17 03:52:14	emzclaire	AITA? Random guy kissed me at a pub and I didn't tell his girlfriend.			0	1	475.0	71.0	0.0	0.0
c1ixz4	2019-06-17 03:52:11		AITA for wanting to be by myself on a family vacation?			0	1	0.0	0.0	0.0	0.0
c1ixu5	2019-06-17 03:51:43	_Astronomix_	Help please: AITA?			0	1	163.0	10.0	0.0	0.0
c1iwan	2019-06-17 03:46:47	amsage3	AITA for not sleeping in the basement during a tornado warning?	"Last night when I came to bed my wife was up, frenetically  getting dressed and gathering up some blankets, pillows and stuff.  She told me we were under a tornado warning and that I needed to gather our three year old daughter up and bring her down to the basement.  Around this time, the tornado sirens started blaring.

My wife is  extremely sensitive to storms.  She gets very worried and anxious, and has confided in me that she loses sleep during nighttime storms, worrying about all kinds of disaster scenarios.  I don't shame her for these feelings, but I generally don't pander or validate them.

I got our daughter down to the basement without waking her up and we started looking at the storm tracker.  The tornado warning was in effect from 11 to 11:30.  It was now 11:15,  and the sirens had stopped.  Our house was *barely* within the confines of the warning, and it didn't seem like we were in that much danger; just caution.  Our basement has a loveseat and couch.  My wife was on the couch with our son, my daughter was on the loveseat and I made a decision; I wasn't going to be able to sleep on the floor, and headed back upstairs.

My  wife didn't seem to object to my decision.  As I kissed her goodnight, I made a joke to try and lighten the mood.  I said ""if I get blown away and you find my body, remember I want to be cremated.""

This morning, there were seemingly no repercussions.  We had plans for father's day with my mom and dad, and headed  over to their house.  Not long after getting there and my mom, out of nowhere, goes ""so you wanna be  cremated, huh?""  The comment clicked immediately, and I knew I was in trouble.  All three of them started telling me how irresponsible, selfish and insensitive I was.  My wife couldn't believe I'd leave her to try and sleep alone in the basement with fears of me blowing away in a tornado  racing through her mind.  They couldn't believe I'd risk  leaving my children fatherless just to avoid sleeping on the floor.  My dad, who I recently started working with, couldn't believe that I'd risk this new venture we've started.

At this point, I'll point out that our area was recently ravaged by an F4 tornado.  It was awful, and a lot of the damage is visible right off a highway, so we're all driving by it frequently.  It's fresh in our minds and I will admit it's chilling to observe.

In any case, the argument that ensued was drawn out and ugly.  Of course I got accused of ""ruining"" father's day.  At this moment I still don't feel like IATA, but I still might be being overly defensive, which I have a tendency to be.  AITA?"	Asshole	0	0	1883.0	484.0	0.0	0.0
c1ivjx	2019-06-17 03:44:28	Alsfsewervsv	AITA for taking my fiancé's side even though I thought he was wrong?	" A little background, my fiancé's brother (we'll call him Eric) was my best friend in college, and still continues to be my best friend. He set my actually set my fiancé and I up. A month ago he broke up with his long term girlfriend and told my fiancé and I that he is gay. Well my MIL was throwing a barbecue for Father's Day Today, and Eric wanted to bring his new boyfriend.  My fiancé told him not to because he hasn't come out yet, and he thought it would be better to come out and then bring the boyfriend around. Eric got really upset and said he was going to bring his new boyfriend anyways. I honestly did not see a problem with this. My MIL and FIL love their children unconditionally, and I thought it might be a little awkward but if everyone would have an SO there, I thought Eric should have his boyfriend too. I didn't tell my Fiancé this. We went to the barbecue today and sure enough Eric brought his boyfriend. My fiancé told Eric not to introduce his boyfriend as his boyfriend at this party and just as a friend. They got into an argument and Eric left with his boyfriend and nearly crying. I've felt really bad, and when we were leaving I told my fiancé to let Eric just be himself. He explained that he was telling this to Eric for his protection and that his mother can be homophobic and he was trying to protect Eric from that. 

&#x200B;

Eric called me twenty minutes ago and told me that my fiancé is an asshole among other stuff, I told him not to talk about his brother that way and he hung up the phone. Am I the asshole?"	Asshole	0	0	0.0	0.0	0.0	0.0
c1iv6x	2019-06-17 03:43:14	DorgeFarlin	Asking non patrons of Popeyes to give up their seat so I can eat my tray of food ?			0	1	616.0	255.0	0.0	0.0
c1iunf	2019-06-17 03:41:21	OwenWilsonsWOWw	AITA for not throwing out the k cups immediately after using them? Or them for posting about it?	"I work at a large radio station company in a big city and all the sudden a few different personalities have been posting videos on social of their “pet peeves” showcasing k cups left inside the keurig after use.

They’re radio personalities and have large social followings that all debate and react to this which feels odd/targeted.

I think it’s a making a mountain out of a mole hill situation. Other people usually leave their k cups in their too and I just throw them out before I put mine in without a second thought.

Update: I am sorry for not stating this first but I really just forgot, the K cups are scorching hot right after being used and do cool down after the initial cup brewing. Small factor that makes me think throwing out others after they cooled is a better option even."	Everyone Sucks	0	0	35.0	4.0	0.0	0.0
c1iuhg	2019-06-17 03:40:50		AITA if I leave products in random isles of supermarkets when I realize I don’t need them	"My dad told me people are paid to put products on their correct shelf, so we once in awhile we can put something we don’t need on a random shelf. I only do this if I change my mind when I’m checking out, but I’m too afraid of being yelled at, which is why I haven’t followed his advice

Would I be the asshole?"		1	0	0.0	0.0	0.0	0.0
c1iubl	2019-06-17 03:40:17		AITA for wanting to leave?			0	1	0.0	0.0	0.0	0.0
c1iu4j	2019-06-17 03:39:34	__shadowwalker__	"WIBTA if I refused to see or talk to my ""best friend"" for a couple weeks because she's judging me for crying over a dog's death?"			0	1	1958.0	521.0	0.0	0.0
c1itjq	2019-06-17 03:37:41		AITA For Telling My Mother To Stop Interrupting Me?	"Hullo.

I was arguing with my mother over a topic that wasn't dreadfully important and as we were arguing she would keep interrupting me mid justification to the point I was making.

I've had a problem with being interrupted in arguments because it makes me think that the other person isn't actually listening to what it is you are saying, which is frustrating when you are genuinely listening to the other person's points.

Anyways, she was interrupting me and I said something of ""You keep on interrupting me. Stop interrupting me so I can finish my thoughts."" 

Anyways, she got kinda heated at that and begrudgingly let me finish my thoughts on the matter. But I could tell she was heated about it. 

Later, I asked her if she was mad at me and she said that she felt like I had been condescending to her by telling her to stop interrupting me. I apologized that I made her feel that way and said that it certainly wasn't my intention . She said that in arguments that the way to do it is as soon as you disagree with something you interrupt at that point because she won't remember everything she disagrees with. I said that you let the person finish their thought and then rebut.

So was I being a dickwad for telling my mother to stop interrupting me? I just would like to know if I'm the one being off base here.

Regardless, I do not think my mother was being a jerk."		1	0	0.0	0.0	0.0	0.0
c1it71	2019-06-17 03:36:36		AITA for being mad at my siblings for not telling me about our sperm donor father and going out to meet him without me every few months?	"Hey you guys I’m on mobile so if there are obvious typos or grammar mistakes. 

So recently I found out that my mom used a sperm donor, and that my sister has been in contact with him for the past year.

 I found out when my mom decided to tell me on the way to my cousins baby shower after talking about absent fathers (lmao). Anyways I turned 22 this month and she felt that she was “finally ready to tell me and my twin sister” and not to tell my younger brother, who’s 2 years younger than me. But when I asked my sister if she was told, she said that she knew since she was 18 and that she told my younger brother and my cousins a year ago. She didn’t tell me because we had been in a very long fight about her long term  (manipulative and gaslighting) boyfriend for so long that she didn’t want to talk about something so “heavy”. Then she claimed that she didn’t want to tell me because I might contact our “ biological father”. 

- The sperm donor’s sister contacted her a year ago wondering how she was related to us and got my sister in contact with the sperm donor and she and my little brother have been meeting up every few months to catch up so I guess it’s okay when my sister contacts him :-/

-She then explained that she told my cousins and younger brother at different times to keep it a secret from each other.

-My mom knows that my sister meets with the sperm donor every few months but doesn’t know that literally the whole family knows about the sperm donor.

Would I be the the asshole for asking my mom why I was left out on meeting my biological father. I also feel like I should explain to her that my sister has told everyone already."	Not the A-hole	1	0	0.0	0.0	0.0	0.0
c1isla	2019-06-17 03:34:38	nyyoh	AITA for not telling a friend her husband was having an affair with her best friend?	"Background: I've been friends with the husband for 8 or 9 years (and had a friends with benefits situation for awhile before he met his wife) and met his wife through him about 5 years ago. But we worked together after that and I was a bridesmaid in their wedding. We aren't really close and I'm definitely more his friend that hers. 
The two of them have a 3 year old little girl they're going to be sharing custody of. They separated but were living together until recently. I teach an exercise class that her husband goes to sometimes and her best friend started coming too. I found out because of the class, awhile ago before they decided to divorce/move out, that they were dating and I didn't tell the wife. I never covered for them although I did tell her they had class once when she asked (which was true). She found out about them after she moved out and then found out a month later that I had known. 
She's still trying to be friends with them from what I understand but told her husband I should lose her number and never talk to her again. Before she found out I had reached out to her and told her to keep in touch and that she wasn't losing me in the divorce.
I can understand her being upset with me for not telling her but I didn't feel like it was my business. Plus, I am closer with him and I didn't want to hurt her. But she's acting like I did was worse than her husband and best friend.
Aita for not telling her what I knew?

Edit to try to clarify relationships/timeline:

Let's call husband and wife Bob and Amy and Amy's best friend Lisa.
I've known Bob for 8ish years.
He met Amy and thus I met Amy 5ish years ago.
Bob and I are better friends than Amy and I, but we're close enough I was a bridesmaid in their wedding. 
Bob and Amy separated but agreed not to date. Bob and Lisa started having an affair.
I found out. 
Bob and Amy decided they were going to get divorced and she moved out.
Then she found out about the ongoing affair and that I knew.
Lisa and Bob are moving in together and will have Amy/Bob's daughter half the time. 
Amy is still trying to be friends with them (I'm assuming for her daughter's sake) but is pissed I didn't tell her about the affair."	Not the A-hole	0	0	0.0	0.0	0.0	0.0
c1isfc	2019-06-17 03:34:11		AITA for this fight with my mom?			0	1	0.0	0.0	0.0	0.0
c1irmu	2019-06-17 03:31:39		AITA for telling my teenage niece to say Happy Father’s Day to her estranged drug addicted father?	I’m 26, my niece is 14. We are VERY close, but she lives four hours away. I bring her to my house four times a year, and we text on a weekly basis. She hasn’t seen her dad (my meth addicted brother) in two years. I just text her right now, asked her how she’s doing, the usual. My mom wanted me to give her her dads new number in case she wanted to text him Happy Father’s Day. We did NOT tell her she had to; we leave that up to her. It’s all her decision. Wether or not she wants to see him or communicate with him, we do NOT force it, we ask her herself, and leave the decision up to her because we believe she’s old enough now to make that decision on her own. An hour ago I text her “here’s your dad David’s new number, in case you want to text him Happy Father’s Day. Also tell Michael that I said happy Father’s Day, and tell him I said that you for being such a good stepdad to my niece” and I put some heart emoji’s. She hasn’t text back yet. I feel *very* guilty, but my mom is the one who encouraged me to give her her dads new number. AITA for this? I feel like shit	Asshole	1	0	0.0	0.0	0.0	0.0
c1iqx0	2019-06-17 03:29:23		AITA for wanting to leave, WIBTA for following through with it?			0	1	0.0	0.0	0.0	0.0
c1iqud	2019-06-17 03:29:08	KingVersacetrash	AITA for ghosting someone who I made it clear to that I didn't want a relationship?	"Basically, im just recovering from the break up I had with my first real love and I'm coming back to myself again.
I've been messing around with my female friends but they know its nothing more then sex.
Now I'm more out and about in the world and while I am open to dating, that's just it. 
I'm open to dating. Not long term commitment,  not a full blown relationship. 
Just small dates like going to concerts, movies, chilling on the weekends and slowly go from there if I like her.

My friend introduced me to this girl who was a friend of his girlfriend.
 immediately I felt attracted to and i can tell she immediately liked me back once we started talking.
She told me about her exes and how bad her last relationship was and I felt a little turnt off. 
Not because she's a bad person or anything.
From how she was talking to me i can tell if anything happened between us, she's looking for a serious relationship and I'm not.
I figured I'd make my intentions known now and I told her I'm not really looking for a girlfriend. I honestly just want someone I can chill with, establish a friendship and maybe sex if she's interested and if I like her we'll go from there and she seemed like she was ok with that and asked me if I wanted to see a movie to which I agreed.
Fast forward. 
We been hanging out for two weeks when she texted me on last week how did I feel about her.
I knew what she meant and although I liked her, I  wasn't interested in dating so I friendzoned her.
I responded honestly 
""I think you're a great person, and I wish I could offer you more but, im just not ready for a serious relationship which I believe you want. Unfortunately, I can't give that to you. I would still like to be friends but if not I understand and will respect your choice"".
She wrote back asking if she did something wrong and I told her
""No, its not you. Im just not ready for commitment right now"".
She then tells me she'll wait for me and that she wants a relationship with me and she'll wait as long as she has too. 
I asked her not to wait for me and she ignored me basically. 
So she's been texting me and I haven't responded to any of them.
I don't want her waiting for me.
I want her to forget about me entirely.
My friends girlfriend called me tonight to say I was a dick for ghosting her friend who apparently has been crying to her about it but I made it clear that I didn't want her around waiting for me or anything like that. 
Excuse any grammar mistakes as I'm typing on a android, but am I wrong?"	Not the A-hole	0	0	127.0	14.0	0.0	0.0
c1iqgx	2019-06-17 03:28:03	alternativeacc4me	I stole my friends parents wedding ring			0	1	0.0	0.0	0.0	0.0
c1ipr9	2019-06-17 03:25:54	amsage3	AITA for electing to not sleep in the basement during a tornado warning?			0	1	1883.0	484.0	0.0	0.0
c1iphc	2019-06-17 03:25:06		AITA For not catering to my husband on fathers day?	"Dont get me wrong if I could,I would have, but I'm the only one working in the home right now. I did 12 hours the night before, 5pm to 5am, on four hours of sleep. I felt bad when I was at work because I didnt realize that it was fathers day the next day, I didnt get him what I had planned so I asked my coworker to get him a couple expensive joints they are our favorite and I dont get them often because they are pricey. 
I get home, I stay up to feed my daughter at 8am we go to bed at 9ish, she wakes up at noon and I'm calling to my husband to take her, he is still asleep. He gets up and says its fathers day you aren't going to step up? I'm fighting to stay awake so I just lay there holding my daughter not saying anything. He gets out of bed pissed off cursing me how I'm selfish and how he let me have a nice mothers day etc. 
I wake up 8 hours later and he is pissed at me still saying I'm selfish some more for sleeping all day. Also that I was inconsiderate for taking a 12 hour shift on his day. He smoked all 3 joints I got him, 45 dollars worth in hours, which makes me upset because I thought he would at least save one to smoke with me on my day off. 
I did have something planned for ""fathers day"" but I was going to surprise him on my day off to celebrate it."	Everyone Sucks	1	0	0.0	0.0	0.0	0.0
c1ip3k	2019-06-17 03:23:59	yourfavouritetwice	AITA for telling my aunt that i dont consider her my aunt?	"A little background. 
I'm sure you all know today is Father's Day. I went to my dad's house with my mom (they are not together) because he told her he had a puppy to give in adoption and to come to pick it up. She said okay since she already had found the puppy a home (where my dad lives the dogs are in the street, in poor conditions and usually the ones who have a home, the owners throw them away when they are not longer young). So far so good right? Well when we got there the puppy had ""dissapeared"". According to my parents, my ""aunt"" saw the post in facebook about the dog in adoption and she stole it from my dad and give it to the owners (we didnt know it had owners already). My mum was afraid of asking her, my dad didnt say anything, so i stepped in and asked her. She said she didnt know anything about it (but she knew who the owners were and the puppy couldnt have escaped just by himself). Well i didnt say anything more at that point, until when we were a little far away she started telling (kinda screaming) my mum that ""she had already a lot of pets and that she didnt need more"" Yes, we have lots of pets but she doesnt have anything to do with it. I got angry and i told her to mind her own bussiness. She replied that i was rude. I said ""yes i am!"". My father then said ""respect your aunt"" and i screamed ""i dont consider her my aunt!"".
We've never really had an aunt-niece relationship. We maybe talk for like 5 minutes in a year.  I dont know if what i did was wrong so Reddit, Am I The Asshole?"	Asshole	0	0	1129.0	500.0	0.0	0.0
c1iox5	2019-06-17 03:23:21	Bluq16	AITA for lying to my gf about my depression?			0	1	61.0	1.0	0.0	0.0
c1iomy	2019-06-17 03:22:30	Jellybean567890	AITA for asking my boyfriend to get home from work and lay in bed with me for an hour or so?			0	1	0.0	0.0	0.0	0.0
c1iol2	2019-06-17 03:22:20	bigstone22	AITA 8 minute countdown	"Here is the back story:

There is this girl I work with let’s call her Ashley. Ashley and I had a bit of a fling in my early months on the job. 

A lot of the time we spent together she would do nothing but gossip about other employees behind their backs. In the office she would be smiling and laughing with the same people.

I had a feeling she was talking about me behind my back. I heard a lot of rumors circulating about myself that were half truths. A half truth is always a lie. 

One day one of my co workers let me know that Ashley was saying things behind my back but smiling to my face. 

I was already getting to the point that I didn’t want to be around her anymore, I was realizing she was fake. So after I heard she was talking about me I blocked her number and cut all contact that I possibly could. 

Now the plot:

Saturday night my friend and roommate were drinking having a good time after a long week of 12-14 hour shifts. There is a new girl in the office and she is pretty cool so I invited her to come over for drinks.

When she gets to my house I see she has her brother and Ashley with her. At first I was cool, I was doing my own thing drinking and listening to music. After about 10 to 20 minutes I just couldn’t stand Ashley’s presence in my house. 

Ashley didn’t even say hello while walking into my house. I told her I didn’t want to be around her, and had already explained why. Idk why she decided to invite herself(according to the new girl in the office). 

I look down at my watch and saw that is was 10:22 pm and decided to announce that everyone else can stay but she had 8 minutes to get her things together and leave(she brought a bag I guess expecting she was staying and expecting to receive free drinks). 

She pretty much starts crying and acting like I’m the bad guy, when I have text proof that she is fake, talking about people, and latching on to friend groups after everyone stops talking to her. 

I made her wait outside for her ride. 

Am I the asshole?

Edit: 

we are 20’s in age

I told her via text weeks prior I didn’t want to talk to her or be around her

The new girl is not her friend, they live in the same complex because we live in condo type rep housing. So when the new girl was coming over, Ashley invited herself. The new girl didn’t know I didn’t like Ashley.

Slander isn’t cool, I work hard from my name.

Any further info I may have missed please ask before bashing me ✊🏽

2nd edit:

I told the new girl to just walk in when she is here, there for Ashley walked in with them. I was on the back patio and was not present when they arrived."	Everyone Sucks	0	0	0.0	4.0	0.0	0.0
