id	created_ts	author	title	body	flair	was_deleted	was_removed
c0124y	2019-06-13 03:59:24	BLitzKriege37	AITA:taken my sisters chromebook,plan to put it back			0	1
c011ce	2019-06-13 03:56:54		AITA for playing Hungry Shark in my uncle's house when he was bitten by an actual shark while surfing a year ago.	"I know this seems stupid, but many people got really upset over this. Just to clear things up, Hungry Shark is a mobile game where you are a shark, and the goal is to eat as much as possible and survive (actually a cool game, check it out).

So it all began around two hours ago, when I plopped down on the couch excited because I was close to unlocking a new shark. I didn't realize that people would be upset by me playing a game that essentially mocks my my uncle's injury at the flippers of the shark, because I was thinking about the new shark I was able to unlock. 

When my aunt saw my shark character eat a person, she got really upset and took my phone away, and my family supported her. I was called insensitive by my mother, and was given a lecture about how I should be more mindful of my surroundings and think about what I am going to do before I do it. I tried to explain to them that my intention was not to mock my uncle's injury, but they were not having it. 

I do understand why it could be seen as insensitive, and I kinda do feel bad. 

So reddit, am I the asshole?"	Asshole	1	0
c010l1	2019-06-13 03:54:39		AITA for stopping a woman in traffic and screaming at her?	"So I was walking home from an appointment today and I was waiting by a crossing for the light to go green. The light goes green and I start crossing. 

Out of the corner of my eye I suddenly see this car turning the corner (even though I know they have a tee light) and the woman inside the car is clearly looking down at he phone while turning. I stop in shock, and she motions at me apologetically and tries to keep driving. 

 I walk in front of her car, putting my hand out motioning her to stay stopped. I come around to her door and motion for her to wind her window down. Once she does this, I shout at her “get the fuck off your phone” and walk off. 

I don’t regret what I did but I did want to know if what I did makes me an asshole in your eyes. 

Some points for me being an asshole:

• I did hold up traffic for a bit

• I really did scream at her and tried to shock her

Some points against me being an asshole:

• she needed to be shocked so that she can learn that she needs to not be on her fucking phone while she’s driving 

• she could have hit me 

So, am I the asshole in this situation?"	Asshole	1	0
c00zyj	2019-06-13 03:52:40		AITA for being upset with how my girlfriend handled weekend plans?			0	1
c00ztt	2019-06-13 03:52:15		AITA for telling my brother off at dinner for him being misogynistic?			0	1
c00zg1	2019-06-13 03:51:04		WIBTA if I say I don’t want to see my girlfriend’s friend anymore?			0	1
c00zdm	2019-06-13 03:50:52		AITA for ignoring my brother	"Context: English isn’t my native language. I’m 19[M] 4 inches taller than him and 20 pounds on him, he is 23, plays video games all day, doesn’t do anything around the house, and doesn’t have a job. Basically living for free. 

A couple of weeks ago we got into a fight. It started because I went into his room to grab some low cal chocolate because I am dieting. He didn’t like that I went into his room which is okay and I said it was for a second. I grabbed my chocolate and left. I then realized that I forgot to grab my phone and this time knocked and told him that I forgot to grab my phone. He got annoyed and sprayed bug spray in my face. I got really mad and threw the chocolate wrapper in his face. Yes I know I should’ve reacted differently but it was in the heat of the moment. We squared up and he kicked me in the crotch and then barricaded himself in his room. I was hot af at this point and muscled my way into his room, but I wasn’t going to hurt him, just pin him down. I haven’t spoke to him since. My parents obviously want us to make up but I refuse because whenever I’m around him he acts so immature and it becomes contagious. For example, I wanted to help get his life together and asked him to go workout with me. After my workout he started making fun of the faces I was making during my workout and said I was making gay noises while lifting. He then makes fun of my lifestyle and tells I will never lose my weight. I told my parents once he becomes a more mature person, he can come talk to me. AITA for ignoring him? (If I am the asshole lmk because I am trying to improve myself physically, emotionally, and mentally). Thank you"		1	0
c00zcy	2019-06-13 03:50:47		AITA for being mad almost girlfriend for talking to other people instead of me multiple evenings?	"Me and my friend group went to one of the people in the group summer house. While here the girls whom I'm almost dating (we are so close 2 people can be without dating) evoyds me and says 5 words to me during 2 days. 
AITA for being mad at her for this and wanting an apology and explanation for this behavior?"		1	0
c00z0l	2019-06-13 03:49:43		WIBTA for reporting my neighbor to strata because she keeps parking in the visitor spot overnight?	"Hear me out here. I’m a really laid back neighbor. I genuinely do not give a shit what my neighbours do, or about any of the ridiculous strata rules in my complex. (Example, white curtains only, only white or black planters, no smoking on your balcony etc etc) the rules say that residents are not supposed to park in visitor spots. 

But for the past two weeks this woman who lives in my complex has been using the visitor spot between our houses just to park an extra car. (She has a street facing unit like mine, and there is parking out there, but sometimes full.) she also has a garage; but I think they have two vehicles. 

I wasn’t bothered the first few times she did it, because hey - sometimes it’s late and you don’t want to park a block away from your house. But often times the visitor spots in my complex are full because of residents parking there, and my guests have to park blocks away and walk to get to my house. (Example my MIL who has just had a knee replacement.) 

I don’t want to be an asshole neighbor who Narks on my neighbor, but also - wtf man, have manners.

WIBTA for reporting her? She would be fined. Should I talk to her first? I feel awkward about it."	Not the A-hole	1	0
c00yep	2019-06-13 03:47:54	BLitzKriege37	taken my sisters cromebook,plan to pt it back			0	1
c00y9a	2019-06-13 03:47:29	DelftBluest	AITA for not wanting to sell my $4,500 bike (not motorcycle) that I don’t use enough?	"I am a mom with a kickass electric bike that can fit my two kids and two smallish dogs and get us up our 20% grade, and with good enough brakes to safely get back down. The size is universal enough for both my husband and I to ride it. My oldest kid (9) is getting a bit big, but my youngest (4) can’t even ride a bike yet so it is still perfect for her.  I only use it in the summer, and maybe only a couple of commutes to work/daycare a month (plus a few short neighborhood rides to meet friends at the pool at the top of the hill with towels and floaties). But when I do use it, the kids and I have a blast. It is the best “thing” I ever bought, and I researched the heck out of it before buying. Nicest thing I own. Husband of ten years said I don’t use it enough to justify keeping such an overpriced toy that is only depreciating in value. He said he never asks for anything and it isn’t fair that I have this super expensive thing that I don’t even use. I have this bike, a dog that was almost a divorce to get (but he now loves and even insisted on a second dog), and am getting a kitchen remodel this summer, so I do feel greedy next to him. In my defense, I don’t do diamonds or Gucci or other expensive “girl” stuff, and we are happy to have a smaller home. I’m not normally this materialistic.

The last few years he’s tried to sell it, even posting it on Craigslist and forwarding me emails from parents desperate to have my awesome bike and be the talk of the daycare. One time he made up a story about a dad with disabled kids to convince me.  He dangled a trip to Hawaii one year if I would sell it. We went to Hawaii but I talked him into letting me keep it a little longer.  We always fight about it and he guilts me and bribes me and won’t drop it. It is 8’ long and takes up a chunk of garage space, but we can still park two cars in there.  This year we are finally remodeling our kitchen (which I’ve patiently researched and designed and waited on for ten years because he doesn’t like to be pushed) and he thinks the bike needs to go this year so we can put the money toward a fancier built-in fridge. He makes way more money than me, but we both work full time. We do not need the money from selling it, but sure, it wouldn’t hurt. It might be of more practical use or bring even more joy to some other parent(s).  He said he is “sacrificing $50,000 for a kitchen, so I should sacrifice something too.” I reluctantly agreed and said we should wait to talk to a friend in the neighborhood who is interested but currently traveling, but he secretly posted it on Craigslist both locally and in cities up to four hours away... He’s forwarding me emails from people who want it already, and now I’m having second thoughts. I’m hurt he posted it without asking (again)... After weeks of rain he just fixed the brakes a few days ago and we won’t even get to use it for one week if we sell it this weekend to someone who is asking. AITA for still wanting to keep it after agreeing?"	Not the A-hole	0	0
c00wtn	2019-06-13 03:43:05		AITA for talking to a friend while in a relationship?			0	1
c00wad	2019-06-13 03:41:19	713984265	AITA for ignoring notes left on my car?	"So about a year ago I started a new job and the office is in the center of a little borough/town. All the parking in the town is metered parking in 'residential' areas. I put it in quotes because there's houses and businesses mixed in, but they're streets basically off the main road of the town.

Anyway, I have a special permit given to employees of businesses that lets us park at the meters for free. Someone has been leaving notes on my car for different shit like every other week. These notes have been for different things, but basically center around 3-4 different things:

* Parking too far away from the meter (street parking, I always park so that my car is about a foot away from the car behind me)

* Parking too close to the meter (I tried to adhere to the other note and parked right up next to the meter and left a solid 5 foot gap between me and the car behind me).

* Parking too far away from the curb.

* Parking too close to the curb.

* Parking too early in the morning with a car that's too loud.

* Sitting in my car with the engine running (got this note today which inspired this post, and I plan on ignoring entirely).

So, for reference, I drive a stage 1 WRX. This is basically what my car sounds like: https://youtu.be/mz2x-oreuxA?t=57. While I'll admit it's louder than an average car, I don't think it's excessively loud.

I talked to coworkers about the parking notes and they say they've all gotten them and I should just ignore them. The noise notes are unique to me though.

I bought a switch this weekend and was sitting in my car yesterday with the air on (car running) playing it during lunch. After about 30 minutes the car alarm of the car in front of me started going off. I just ignored it 'cause that's what you do with car alarms.

Today I had a phone interview, so I went in my car to take it, and again the car alarm in front of me started going off after around 30 minutes. When I left work there was a note on my car about how idling my car is too loud and it's disturbing everyone.

Anyway, since I just bought this switch I'd like to continue playing it during my lunch break and realistically I'm not going to sit in the office and play it. People constantly need me at work so if I'm physically in the office I'll have to stop what I'm doing to do work which is why I try to got my car.

AITI / WIBTA if I still sit in my car and ignore this note. If the person came out and spoke to me I'd stop doing it, but constantly leaving notes and setting off the car alarm honestly just annoys me. Like if you're home just come talk to me, don't wait until I leave FOLLOW ME TO WORK, and then threaten to call my boss. Like wtf?

Note I got today for reference:
https://i.imgur.com/g1weByG.jpg

tldr, been getting stupid notes left on my car for months. Tried adhering to them but got new notes basically asking for the opposite so now I'm just ignoring them. It's literally between 12:15 and 1:30 in the afternoon depending on when I take lunch. I think that's a reasonable time to sit in my car..."	Everyone Sucks	0	0
c00vz6	2019-06-13 03:40:24	nnh09	WIBTA for turning down a job I accepted two weeks in advance because another job benefits me more?	Hi all, I am currently debating what to do and am struggling with feeling like an ass. I accepted Job 1 back in April for a summer teaching position that lasts 5 weeks. In May, I was hired to work full time in the fall by Job 2, and they also offered me to work the summer too. I told them I had an outstanding commitment, but the more I think about it, I feel like I should take Job 2 for the summer.  If I work for Job 1, I would be without health benefits for around 4 months, or have to pay out of pocket ($1,200) total to keep them. Job 2 would give me full benefits. Job 1 is also only part time, whereas Job 2 is full time, giving me about $5,000 more for the summer. I am always very loyal to my word, and can't help feel terrible even though I am screwing myself out of a ton of money (and benefits) by keeping it.	Not the A-hole	0	0
c00vea	2019-06-13 03:38:36		AITA for charging my sister to have my iPad?	"I have an iPad 6th gen with Apple Pencil. $400 something plus tax when it first came out.

Used it occasionally to doodle, but I don't do that much anymore. Wish I had just gotten a cheap Wacom or Huion.

Wanted to sell it on hardwareswap for $250 (iPad is $200 on eBay and Pencil is $50), but my sister wanted it.

She doesn't have money rn, so I let her have it and she can pay me back later.

But should I be charging my own sister for my old electronics? I mean my Dad bought my old tech off of me, but...

Sold it because I wanted Trilian.

EDIT: Yes I bought it with my own money."		0	0
c00ua8	2019-06-13 03:35:16	MonkeysMogul	WIBTA for not attending my mum's wedding?	"Backstory: Ten years ago, my dad died because of health issues. A year after that I met my now wife (I'm Female). My mum was really unstable after my dad died. She would yell at me and hit me. When she found out about my new girlfriend, she lost it. She kicked me out of her house and I lived in my car for about sixteen weeks. She called me one night and said she was sorry for everything. I was a young teenager living on my own, so I told her it okay. I really wanted to finish high school but didn't have the money to pay for it. So by living with my mum, she would pay for my high school education. I got a job because I didn't know if she would kick me out again. My girlfriend helped me with everything. If it wasn't for her I wouldn't be here. 

After I finished college, I ask my girlfriend to marry me. She said yes, I was 25 at the time. I told my mum and prepared for the worse. All she said was that she didn't agree with the idea of me getting married to a girl but she would come because of the fact that it was important to me. I was very happy that she was coming. She had RSVP to the wedding invitation.  I wore a jumpsuit that looked like a dress to make her happy. I was going to wear black but chose off grey to make her happy. I had food that she liked, just to see her smile. 

When the day of the wedding came, she didn't show up. It was heartbreaking to see an empty chair. My girlfriend knew I was upset and ask if I wanted the wedding to start later. I said no and put on a brave face. On the night of the Wedding, she (mum) called. She said a terrible person and that she hated me. I broke down and cried, my wife took the phone off me and hang up. She brought me something to eat and cuddled me.

 Three years later, my mum called me and said she was sorry. She said that she was going through a rough patch. She showed me papers that showed that she in the hospital because of mental health issues. I said okay and our relationship has been much better. She would bring food over and offered to take me shopping. She has been more open to my wife and everything so far has been going smoothly. 

If she acts up again, I will cut her out of my life.  Now my mum is getting married. I never saw her so happy. She asked me to come to the wedding. On one hand, I want her to feel the pain she caused me. On the other, our relationship is much better than it was. 

So WIBTA if I don't attend my mum's wedding?"	Not the A-hole	0	0
c00si7	2019-06-13 03:29:59	sicknastyjr2009	AITA for thinking Wrecking Ball from Overwatch is a main tank and disagreeing with my girlfriend?			0	1
c00r5d	2019-06-13 03:26:05	Kosuuu	AITA for joking about how a friend of mine has ditched our friend group for other friends entirely?	"Ok, so I have a group of friends on discord mixed with old highschool friends and internet friends. On said discord we generally talk a lot and play games together and are generally super close friends, we have other groups we talk to but since we're close friends we usually just go back and forth with each friend group. Playing games and talking with each group whenever we feel like it. So in my situation, one of my high school friends (who now goes to my college) met some new friends in college and essentially has stopped talking to me and other friends. Getting other friends isn't a big deal but going months without any communication is kinda weird when we are on the same campus for the next 4 or so years? So friends and I eventually make attempts to hang out with and catch up with this friend, we'll call him Chang. It seems no matter what we want to do Chang is too busy for everything. Chang cancels plans on the day of (hours or minutes before said plans). This has happened well over 5 plans or so, it has become a pattern. And the issue is, if he does not want to go on the plans, he could just refuse? Chang now gets into the discord call every couple of months or so to ask a dull, awkward small talk question just to get an answer then talk to his roommate or housemate while still in discord or explain how sad he is that he's busy all the time and cant hang out with us and misses the time spent with us. The kicker is, I see on his Instagram story that he hangs out with friends literally all the time. So I and other people in his old friend group have now started joking about how he doesn't talk to us anymore. I've changed the discord icon to a picture of Chang and changed the server name to ""Chang fan club"" joking that he never comes back to talk to us. This joke did not amuse Chang and he was apparently hurt I did so. Chang seems to be hurt by every joke made about how he doesn't talk to us anymore, yet even in recent times, he has been busy for plans made with him in mind. The jokes are jokes alone, sure they poke fun at the situation but it's only to hopefully have him come back and talk to us. Admittedly I feel bad if his feelings are actually hurt over these jokes, but I usually don't comment because I am still salty about the issue and don't wanna say something that would spark conflict. Am I the asshole for making fun of and joking about the situation and hurting his feelings?"	Everyone Sucks	0	0
c00q1h	2019-06-13 03:22:50	Monyetmontagne	Respect in the kitchen			0	1
c00py5	2019-06-13 03:22:36		AITA for talking about race in a room full of (mostly) white people?			0	1
c00nph	2019-06-13 03:16:08	punkassunicorn	WIBTA if I skip my cousins wedding?	"I would like to preface this by saying that I suffer from mental illnesses which I do have a service dog for and while I do my best to not let them interfere with my life I recognize I still have my limitations. My parents however do not.

My cousin is having a marriage this summer which requires out of country travel. Which wouldnt be too big of an issue except that the last time I had traveled to visit them it had only been for four days and by the end of it I was beginning to have fainting spells because I was too anxious to eat or sleep. It took three days of recovery once I got home before I was able to work again.

I agreed to attend the wedding, it's a big deal for my cousin, but I said I would only be able to go for a week. That's the amount of time I asked off from my job, and that's as far as I trust myself to be able to handle it.

My mother booked the trip because I can't afford tickets but she booked it for two weeks. I do not trust myself to handle two weeks. Especially considering that after only four days I was starting to black out. I told her I agreed to a one week trip and that I do not want to be there the full two weeks. I've reached a point in the conversation where I just want to say either I'm rescheduling my flight or I'm just not going at all.

I'd hate to miss it. I've already missed a lot of big events due to my mental issues and I feel like my family is starting to hate me because of it.

I really dont think I can just suck it up and deal for that long though. Would I be the asshole if I cancel because of this?"	Not the A-hole	0	0
c00nc3	2019-06-13 03:15:17	xxmaddie	AITA for giving my friend a ouija board?	"I'm still very confused so help me out.

So yesterday was my friend's birthday. I've known him for some time and he's a good guy. In the past few months my friend tried online dating and also got help of his friends to try to set him up with a date. But then all except for one ghosted him. So it was a running joke that he always gets ghosted. 

So yesterday for his birthday, I gave him a Ouija board as a joke to ""bring the ghosted people back"". I thought it was pretty funny and didn't think much about it. But then when he opened the gift  he was furious. He was saying things like ouija boards aren't a joke and these things shouldn't be joked with. And how me giving him this gift will make make him repel more people since the ghosts will latch on to him and I am cursing him with this gift. He was pretty pissed and visibly upset that I gave him this ouija board. I didn't understand and I told him that I didn't get why he was upset over this gift. He wasn't the healing crystal or essential oil therapy person but this reaction just caught me off guard.

He left yesterday cussing and complaining it's going to be a pain to get rid of this board.

&#x200B;

So am i the asshole for giving my friend a ouija board to my friend? or is my friend clearly over-reacting and taking his anger on me?"	Asshole	0	0
c00n1c	2019-06-13 03:14:21		AITA for withdrawing from friends and family.			0	1
c00mw1	2019-06-13 03:13:55		AITA For Liking My Ex After He Mentally Hurt Me?	"I hope this is a heartwarming and lots of info.

So I was a new student this year at my school. I saw an *adorable* guy who was a little bit taller then me but we got closer and dated from October 28th to around December 16th I think. We were both clingy as this was my first ""Boyfriend"" and his first Girlfriend who cared (A). We were that couple that was inseparable even though we were in different classes. Teachers knew students dated and it was okay with them as along as you didn't kiss or ""anything"" during school. I vented to him after school.

One Friday he seemed distant. I was picked up by my dad and surprised with a doggo (Doge). I with playing with Doge around 8pm and I got a text.
""We are polar opposites. We can't be together
 It isnt working."" His text read. I remember all the tears I cried. Like anyone else I texted the WHOLE friend group (5 People) but this one girl who is a witch.

Anyway, know you know the backstory, the tea. A few weeks or months past (I was lost after the breakup) and he says he has a secret girlfriend. I wanted to go Yandere on this chick. N0B0DY TOUCHES SENPAIIIIII. So a few days after I learn if was the witch, he said some of the stuff I vented about to his friends, the next grade, and my fake best friend. Then he kissed her. Then she said she never liked him.

She spread the rumors to other schools I think. 

A: I actually liked him and helped him feel better."		1	0
