id	created_ts	author	title	body	flair	was_deleted	was_removed
bzr7av	2019-06-12 13:25:29		AITA for my reaction to being judged for wearing make up?	"My(23F) fiancé(28M) and I have been together 4 years, engaged for just over 5 months with a wedding planned for early next year.

We both strongly and openly support feminism and women’s rights, etc. and it is something that I really value in our relationship. 

Over the course of our relationship I’ve gone from wearing a full face of make up daily to wearing a moderately full face of make up 2 or 3 times a week, usually for a part time job. We’ve had countless conversations about the pressure that is put on women to wear make up and the stigma those who don’t wear it face. I have often expressed that I don’t want to feel like I HAVE to wear it, but rather it’s an option for when I want to have fun with it. 

So yesterday, we were getting ready to go for lunch at the restaurant where I work part time and usually wear make up. I didn’t work that day but said I was going to put on make up because I always wear it there. My fiancé visibly got annoyed and said he wished I wouldn’t. 

This started a large argument, his side being that I should be “stronger” and not fall victim to societies pressure to wear make up, my side being that as a man who has never experienced the pressure of stigma, him judging me for it is unfair. Of course during the argument I got very visibly angry, not yelling but being argumentative and confrontational definitely. 

Near the end of the argument, that never really got resolved, he voiced his concern that my reaction to his opinion was harsh and although he didn’t say it, would make me the asshole in this. 

So, AITA for my reaction/in this argument?

TL;DR: fiancé thinks I should be stronger than to
give into societal norms, I think he should stay in lane. AITA?"	Not the A-hole	1	0
bzr6r0	2019-06-12 13:24:04	pineapplepancakes_	WIBTA for taking my ex to small claims court?	"Ex (32M) & I (28F) dated last year for \~ 8 months. It was good at first, exclusive straight away. He talked about past mental health issues but insisted he was now well  
 It wasn’t a good relationship. I found out he was still on Tinder despite us being exclusive, he gaslit me regularly & was emotionally abusive, but blamed it all on his mental health

 5 months in was his birthday & I said I’d treat us to a weekend away. I wanted to book a b&b, but he was unhappy & said a hotel would be better. I told him I couldn't afford this, & he said he’d pay for half. When it came round, he'd forgotten something that weekend & couldn’t go. I moved the booking for a charge. He did this 4 times. Total cost went up from £200 to £240

 We had a rough break up, which included him having a breakdown and was admitted to a private clinic.

 Because of his mental state, I left it 4 months before contacting about the money. I sent a nice gentle message asking if he planned on paying me back sometime. He said he would, but his finances were unstable & didn't know when it would be. He’s not poor, but was in the middle of selling a house so I accepted this

 I texted every 2 months saying hey hope you’re ok, any update?. He’d say no, but soon. After my siblings said it was ridiculous & that I should put my foot down, I sent a more firm message. I asked for an update & he said at the end of the month. I sent a texted explaining that it was getting a bit silly now, and that instalments would be fine, but that we needed to make a plan, as he was being too vague. I said that if there was nothing more definite in the next few months, I’d have to think about small claims court.

 He got upset, told me he’d have an update for me at the end of the month & that was the best he could do. He got very defensive & said that he didn't have to pay me back, he could’ve blocked me, but didn't, & was going to pay me back not because he had to, but because he was choosing to & that I had to wait. I told him I had proof of him agreeing to pay, proof of him causing the booking to be moved & if he refused I would take him to court. I wasn't rude, I said it in the most neutral way I could. He got extremely upset & told me I was being aggressive, threatening & attacking. He eventually told me to check my bank account, & I saw that he'd sent me £20. I asked if this would be monthly & he said yes, but was very rude. I don't have much faith that he will stick to this.

 £140 may not seem like much, but I was made redundant last year, was unemployed for 5 months & have debts to pay off. I also know I'm at fault for ignoring all the red flags, I wish I hadn’t

 I don't want to make his life harder, that's why I've waited so long to do anything. But I just feel he's still taking advantage of me even now"	Not the A-hole	0	0
bzr674	2019-06-12 13:22:37		AITA for asking for ketchup at a drive through?	So, I consider myself to be a good human. ( at least I try to be).I literally make an effort to be “kind” and “nice” etc. I’m a fucking server in Vegas...I’ve never finished college. I say “pls and thank you” I grit my teeth and bear it. My take out order is wrong? “It’s okay... I’ll still eat it, “ My steak is undercooked? “It’s okay... I’ll eat it.” I’m a freaking pushover. I get cut in every line, I hold doors for people and rarely get a “thank you....” Yet my significant other is a complete pushover and he literally got angry because I ordered a stupid ass sausage and cheese McGriddle (while drunk) and asked for ketchup. How am I the asshole? Please help me explain. Maybe I’m just not understanding his point of view. We also ate at a restaurant the night before,we received a plate we didn’t order. I told them it was fine to charge us and we would eat it if it didn’t belong to anyone. He also berated me about that, saying “ you were kind of rude, if you said it nicer she would have let us keep it”.  (We saw the server drop it to the people next to us who ACTUALLY ordered it)  Am I over reacting? Am I really an asshole?		1	0
bzr5we	2019-06-12 13:21:52	whineywifey	AITA For nagging my partner about getting work done			0	1
bzr5on	2019-06-12 13:21:18	Kamikazemum	WIBTA if I called CPS on a friend?			0	1
bzr55i	2019-06-12 13:20:02	_Vulpine__	AITA for calling my Mother Toxic			0	1
bzr4k8	2019-06-12 13:18:26	cow-boy_be-bop	WIBTA for accepting a very generous gift?	"I work in a store where, we provide a service and have to go up to a counter to greet customers to take their orders. It’s a small department (3/4 employees). There is one customer who always wanted (26/f)me to help him (70s/M). I’ve been at this store almost 6 years, and he’s requested me for atleast the last 3. Hes probably been a customer for 20 years.

I don’t think anything weird of this because we all have our “regular customers”. As the years go by we are friendly with each other. He has always bought gifts around holidays for the entire store to share. (Cookies at Christmas, candy at Halloween, etc). A year or 2 ago, he started adding little extra gifts just for me. He always talks to me for longer than most customer, about his life and things going on in the world and I don’t cut him off because it’s my job to be nice to our customers. It’s usually just me listening and reacting to what he says, not me telling personal stuff about myself.

Fast forward to last August, I got engaged. He comes in and sees the ring on my finger, and the usual 20 min conversation was a 2. I didn’t think much of it because there are times he’s been in a rush. 3 months go by and he hasn’t been back in. He finally comes in and asks to speak with me privately. He confesses his love for me and how he’s never met anyone like me in his life, and how he thought we had something and how he thought I was single. Overall very overwhelming conversation because it wasn’t on my radar AT ALL. I didn’t tell anyone at work about this because I didn’t want weird vibes and figured I could handle this myself by still helping him but occasionally avoiding him and letting others help him. His visits have been shorter, and obviously a little weird but he hasn’t stopped being a regular customer.

Yesterday he came in before I got to work and asked for me and my coworkers told him I would be in later. So he came back later, dropped off work to do and gave me a card and left. It made me anxious so I didn’t want to open it at work. I brought it home and told my fiancé about it and that I hadn’t opened it because I was anxious. So we open it together at home and there is a large sum of money in the envelope.

So that brings me to my current situation. I’m not sure what to do about this money, it would obviously help tremendously, weddings are EXPENSIVE. But I don’t know if I can rightly accept this, or if I should seek advice from someone higher up in the company (I’m manager of my department but there is a store manager over me).

TLDR: have regular customer who is friendly with me, over twice my age. Think he’s just nice old man. I get engaged to my boyfriend and the customer confesses their love for me. Customer still comes to store and right before my wedding gave me large sum of money. Thinking about keeping it because it would help, but I feel anxious about accepting something so large."	Asshole	0	0
bzr485	2019-06-12 13:17:35		Am I the ass for not engaging with my girlfriend after she woke up from a post-work nap?			0	1
bzr36z	2019-06-12 13:14:56		AITA for not telling a girl that I saw her drop one of her belongings as I drove past?	"I know I probably am TA for this but would like a little outside perspective.   


There is a girl (probably mid/late 20s) that sells stuff on the beach down the road from my house. Most mornings when I drive to work I see her on the road either walking or waiting for someone I guess. I haven't had many interactions with her but all of them have been negative.   


The first time I met her was on the beach about 6 months ago when I was walking our puppy. Our puppy is the happiest, friendliest dog and LOVES to meet new people. For some reason she took a real dislike to this lady and cowered behind my daughter. This is the only person I've met that she's had this reaction to and we've met hundreds of people walking on the beach. Subsequent meetings of this lady have consisted of her being really pushy and her trying to sell me her crap and not taking no for an answer and puppy cowering away every time. I am not sure if my judgment of her has been clouded by puppy's reaction to her but I do believe that dogs have more heightened senses than we do. I just seem to have the same irrational dislike of her as my dog does.   


This morning as I was driving to work, I saw her ahead of me walking down the road laden with bags (as usual). I saw something fall but couldn't see what it was. As I drove past, I saw she'd dropped what looked like a piece of cloth (looked like that Indian cloth with the small mirrors sewn in). She was just walking and I didn't stop and tell her that she'd dropped something. AITA for not stopping?"		1	0
bzr31z	2019-06-12 13:14:32	Clicker8371	"AITA for answers my wife's ""friend's"" questions that....ended her affair prematurely?"			0	1
bzr2j6	2019-06-12 13:13:07	meggles90	AITA for being upset about my ex unexpectedly leaving me stranded with our kids?	"A little backstory, my ex husband and I split custody of our kids. We live about 10min apart so we alternate weeks with the kids.

Ex husbands new fiance (A) is pregnant and in her last month, I have told him that if he needs help with our 3 kids when she goes into labor, I would help as the nearest L&D is at a hospital 30min from here.

Last night he called around 10pm asking if he could drop the kids off because she thought she was in labor so I agreed after he said he would keep in touch with me about making a plan to pick them up today.

My car has a water pump issue and is still leaking and not currently able to be driven at this point. Our oldest walks to school from my house and can take the bus back to dads but our 4yo daughter is not in school and our 5yo is in half day prek. It is a 40min walk to his school and with it being his last week, I really don't want him missing days. 

I had plans to go up and talk to a manager friend about a part time job at a store close by this morning but with the walk to my sons school, it'll be too much in the sun for my daughter. My husband has an appointment at a dealership to hopefully get a new car before he starts his new job next week. This is something I can't go help with now because it's when I would be walking home from dropping my son off at school.

I'm upset because this wasn't supposed to be an all day affair. A was sent home after being told to go back next week to be induced because it's a bit too early (she's 3 weeks from her due date). Ex went to work this morning after getting her home. I never received an update on what was happening and he never bothered to tell me he had work.

If she was in the hospital being induced and such, his mom would be on her way here from her home (1 1/2 hr drive) to pick up the kids and be around to help him out on his time as he should have the kids right now and I wouldn't mind as much.

He hasn't bothered to apologize, doesn't see this as a problem, and now I feel like I'm being childish and getting upset about nothing.

Edit: My offer to help was in place for emergencies as his mom lives far and to account for travel time. The only update i received was this morning saying she is to go back next week to be induced. I have no idea if she was in active labor or what prompted them to go to the hospital."	Not the A-hole	0	0
bzr2d6	2019-06-12 13:12:44	pineapplepancakes_	WIBTA for taking my ex to small claims court?			0	1
bzr1l4	2019-06-12 13:10:44	PopTartCommercial	I consider myself to be a good human. ( at least I try to be) But am I really an asshole?			0	1
bzr0h7	2019-06-12 13:07:51	biggestpiece	AITA for serving myself the biggest piece of meat?	"My boyfriend and I have been together for about 2 1/2 years. We live together as of recently (4 monthsish) and we get along pretty well. We have a lot of separate hobbies, and one of mine is hiking. I wouldn't call myself a ""peak bagger"" but I do like to add mountain summits to my hikes when I can. BF doesn't enjoy hiking more than occasionally so he rarely comes along. 

For reference, I am a 5'3"" 150lb woman. He is a 5'7 170lb guy. 

On Sunday I went for a long, strenuous hike with my friends. If you're familiar, it's 13er James Peak in CO. It was a 9 mile, 3,000ft elevation gain hike (from where we started). I had a fun time and went home and did my usual workout (short run, weights, some light yoga) after. Suffice to say, I was pretty hungry by dinner time. I made dinner, which was grilled chicken with lots of grilled veg, some pasta salad as a side. When it came time to eat, because of my big day, I grabbed the bigger piece of chicken. We're talking a 5oz piece versus a 7oz piece. 

BF got upset about this when he saw my plate versus hit place, and he made a pretty big deal out of it. He told me that there's no reason for me to serve myself such a big piece of meat, he's the guy and he should have it. I told him that I'd hiked and done my workout that day, and that he puttered around the house and went for a short (5 mile) run. 

He told me that growing up, he was always taught that the man got the biggest piece of meat because men need more to sustain themselves in general. I said that I agreed, but again, I'd climbed a mountain that day and burned much more than he did. He told me I should accept the good calorie deficit, or load up on the pasta salad and veggies instead. 

We've been arguing about this for days and he tagged some friends in and asked his parents (who said to keep them out of it, lol). So far people are split, some believe even if he didn't do much that day it's just weird for a woman to actively try to eat more than her boyfriend. I think that's stupid and outdated and comes from a time when men tended to do more physical labor in general. 

AITA? Is this just really dumb?"	Not the A-hole	0	0
bzr075	2019-06-12 13:07:08		WIBTA for not letting my girlfriend watch A Star is Born, or spoiling it for her beforehand?	"Spoilers for the movie I guess.

A Star is Born came to theaters around the same time as my girlfriend’s brother took his life.  Now apparently (I haven’t seen the movie yet either), Bradley Cooper’s character takes his life at the end of the movie and it’s a pretty grim and emotional ending.

My gf has had several people tell her that maybe it’s best to not watch the movie yet, and my parents who she’s close with have hinted at it also.

The most recent time someone mentioned to her to hold off on watching it, she asked me why everyone kept telling her to do so. I feel bad because it’s evidently a terrific movie. We love watching movies together and she wants to see it.

She is an emotional, but strong woman in general, but I feel like this type of ending will hit her pretty hard. Completely understandable given her life events the last 8 months.

She really wants to see this movie though. It’s not a question of if, but when. She loves the song “Shallow,” and loves music and movies in general.

So would I be the asshole for letting her watch the movie without spoiling it for her first?  I feel like I could be the asshole for letting her watch something that could be emotionally troubling without giving her a heads up, especially when several of her peers have warned her, as I mentioned.

Or, should I spoil it so she might be emotionally prepared, even if it means, well, spoiling the the ending to a movie. And would I be the asshole for doing this?

I’m stuck. I can’t stop her from watching the movie if she wants, and she has mentioned several times that she wants to."		1	0
bzqz59	2019-06-12 13:04:33		"AITA for telling the truth to my wife's ""friend"" the day I kicked her out."	"**Short version:**  Wife just left for a 'separation' and immediately started talking to a guy she had an emotional affair with 6 months ago.  Says it's not about him, but it's as clear as day.  I texted him, and she has completely villainized me with things that were untrue.  He asks me if these things were true, I say no and explain the situation.  He says he can fix it and goes on to call her and 'end' things with her. 

 If she was just dating someone afterwards, I could live with it.  I would feel psychotic if I messaged her new boyfriend or whatever.   But for it to be the person that caused this massive rift in my marriage then and now...I'm not going to let that go.  Many people would do worse things, right?  **Am I the asshole** for ending my wife's chances at dating a guy she started an affair with while we were married?  

she came back and now wants to think about getting back together, I don't know my answer to that yet."		1	0
bzqywk	2019-06-12 13:03:58	myfriendcriedAITA	AITA for making my friend cry?	"Hey Reddit, this is a throwaway so downvote it to hell if you so please. 
 
Today and through parts of yesterday I had a fight with my best friend. It started when I was going to an art camp (not overnight) and lost my t-shirt. Now, this would’ve been a big enough deal being the night before we were dying them, but the worse part was how the instructor bought the shirts with her own money. I had a horrible panic attack thinking that everyone was going to hate me and think I was lazy and unorganized. I texted my friend who’s mom drove us to camp (because carpool) and said I couldn’t go. Nothing more,  nothing to pry for, right?

My friend is wondering why I can’t come and after deflecting the question for a while I finally cave and tell her. I told her if I went that day I’d have another panic attack and it would be less pretty in front of everyone. She berates me, tells me I’m being dramatic, and tells me she will still show up at my house without telling her mom (my parents told me to text my friend so they wouldn’t have to text her mom at 10:00 at night and would be upset with me when I said my friend refused to listen).

I wake up the next morning with a plethora of texts from her saying that I was only thinking about myself and I made her cry because she had to go alone. She said she didn’t want me to be like other friends she left for being dramatic which sounded reasonable. Here’s some background: this is the only time I’ve ever had a bad panic attack around her. I told her that I felt like while she may have been trying to help me, she was only fueling my feeling of being out of control of the situation. I said that she knew it wasn’t like me to be “dramatic” like this and I hoped that she would’ve actually tried to be a good friend but instead she ostracized me, made me feel stressed and out of control, and generally upset me. She also threatened me if I were to talk about this to any other girl in our friend group.

I said that we should move past this and that I was sorry. I said that the only reason I was upset was because I felt like she WASN’T sorry for making me feel like that. I told her I was open to listen to how she felt, but instead she said “I don’t want to hear about how you feel” and blocked me. AITA here? Should I throw the whole friend away?"	Everyone Sucks	0	0
bzqyvz	2019-06-12 13:03:55		AITA for accepting a way too generous wedding gift?			0	1
bzqy95	2019-06-12 13:02:19		WIBTA for taking my ex to small claims court?			0	1
bzqwx9	2019-06-12 12:59:07		AITA for calling my stepmoms apartment and requesting her lease?			0	1
bzqwj9	2019-06-12 12:58:03	HunterShiells	AITA for giving my girlfriend money?	"So a few days ago my girlfriend go denied from a student loan, she then couldn’t afford to go to college. She emailed them and they said that she couldn’t pay, they then said pay 1600 now and the rest later which was great. I thought that I would give her the 1600 as I would receive it back in a few days when her money from her resp comes in, in 5-10 days. I know that she will pay be back that money no problem, the issue is that I’m 18 but my parents still have control over my bank account so they can see this money coming in and out. I just got off the phone with my mom yelling at my that it is not my money to give even though it came out of my savings account. They did give me 1000 for a laptop for college but that is still in there. My parents are now pissed at me for giving my money to my girlfriend to help her get into a school of her dreams. I know I will get this money back. We have been dating for 2 years now. 

AITA for giving her money?

Edit: I have 1500 left in the savings account."	Not the A-hole	0	0
bzqwd9	2019-06-12 12:57:33	mb83	WIBTA if I fired our cleaning service because I don’t like the attitude I got from the owner?	"I realize this is a very first world problem, so maybe I’m just being petty.   

We use a cleaning service on a bi-weekly basis. They do an adequate job cleaning. They’ll do what you ask, but nothing above and beyond. The price is fine, a little on the cheaper end, which is why we keep them. The owner doesn’t do the cleaning - she has employees who do that. The owner handles the bookings. They day before your scheduled service, they send you an email with the time window.   

Yesterday I got the email with the time, but that time ended up not working for us. In the past, I’ve tried to reschedule, but they’re very rigid about the days so I just decided to cancel.   

The owner sent me a note back admonishing me for canceling so late. She said that because I cancelled late, they had other jobs they had to turn down. She also noted that in the past I tried to reschedule so why didn’t I do that now, and that people plan their day around the time they’re arriving (which is fair, but they frequently end up arriving an hour or more early with no notice).   

In all, it felt like I was getting a kind of rude email from someone I pay to do a service for me. This is only the second time I’ve canceled in a year.    

I understand that she is running a business, but if she doesn’t want people to cancel they day before, shouldn’t she send out the schedule farther in advance. I don’t see why it’s incumbent on me to provide more notice than she provides. It’s a schedule and service based business, so I think they need to have flexibility. It honestly kind of ticked me off, so I’m thinking about cancelling all together and finding a different cleaning service.   

I just don’t want to be overreacting. English is not this woman’s first language, so perhaps the tone was a little lost in translation?  

WIBTA?"	Not the A-hole	0	0
