id	created_ts	author	title	body	flair	was_deleted	was_removed
bzttym	2019-06-12 17:09:53		WIBTA if I ask my girlfriend why she never mentions me?	"Hear me out because I know how needy the title makes me sound. 

My girlfriend and I have been dating for around a year at this point. Recently we decided to move in together and I’m super excited about it. However, recently I’ve learned a lot that makes me think my girlfriend is almost embarrassed of me, and I’m not sure if I’m overreacting or justified.

We recently hung out with her best friends from where she’s from and they started asking about her move coming up. I was excited to hear what she had to tell them. In the few minutes that she was talking it was very apparent that they had no idea that the apartment she was moving into would be for us. She hadn’t told her best friends that we were moving in together, but rather moving in solo. A little strange but she then told me she didn’t want it getting out to her coworkers. Weird but okay. 

Another instance was that we went to the park and her coworker was there. This is a person that she spends every day with and considers a close friend. She knows his whole family and has met them on multiple occasions. I even met them before. We saw him at the park and he said he didn’t even know my name. Weird considering we had met before, but also strange that he didn’t even know my name considering that my GF works next to him every day and they talk about their families.

Another instance was that a coworker asked her out on a date. Harmless because she obviously said no, but she told me she didn’t even mention me. She just basically said she didn’t want to go out with him and why did he think he even had a shot with her. I’m not one to like when anyone brings out the “I have a GF/BF” card too quickly, but in cases where someone blatantly asks you out, wouldn’t a “I have a SO, no thanks!” Be appropriate?

It just seems to me like she’s embarrassed to bring me up, and I’m not really sure why. I don’t know if I’m competent overreacting, so WIBTA if I confront her about this?"		1	0
bztt79	2019-06-12 17:08:08	DickturdHasArrived	WIBTA if I section off my nice mugs from my cousin?	"I know is insanely minuscule in comparison to what is usually on this sub, so anyone that would care to weigh in would be greatly appreciated. 

&#x200B;

I have a mug collection I've been growing for several years. I get them from weird stores, storage units I buy in auction, garage sales, I even go paint mugs at the pottery place sometimes. Basically, I like mugs. We actually had to move all my mugs to their own cabinet because the collection is growing at a good rate (my friends and family also buy me mugs.) I know it's a silly thing to collect, but whatever, we're all silly in our own ways. 

&#x200B;

Back in January my cousin came to live with my fiance and I while she got back on her feet and saved up to go back home. (We live across the country from all our family, and her troubles and clean up of such took her our way. So when she expressed distress about having a hard time saving up, we invited her in, no money wanted from her. Just want her to flourish.) In the time she's been here she's ruined 3 mugs, one of which was my favorite travel mug, and a limited edition. That one really bummed me out. This morning while unloading the dishwasher, I pulled out a thermal mug that my friends mother gave me before I moved away. It had been ruined. I was talking to my friend about it and said I might just go get some cheap ones from Goodwill and put the ones I like away. I love my cousin, but my mugs have also gone missing her room, and she'll let milk mold in them. My friend told me that was kind of an asshole move because I told my cousin what's mine is hers when she moved in, and now I'm reneging over something as dumb as mugs. 

&#x200B;

I feel like she's right on a certain level, and I don't want to be an asshole. Part of why I love my mug collection is because we use them when I have friends over, and it's a good way to know which is your drink. I also don't mind the handwashing of them afterwards. But in the same breath, I've asked her to please be more mindful. I don't want my collection to slowly dwindle because of someone else being careless. Which also makes me feel like an asshole but not one at the same time for trying to set boundaries. 

&#x200B;

So WIBTA if I section off my nice mugs from my cousin?"	Not the A-hole	0	0
bzts94	2019-06-12 17:05:59	jenndro	AITA for not wanting to go my cousin's wedding?	"Hi everyone, I hope I explain my story right, I'm the worst at explaining things, but here goes..

Hi, my family is pretty small, all I really have is my family (2 sisters/both parents) and my 3 cousins and their parents. We're all like two years apart from each other, or around the same age. We aren't close as we used to be with our cousins when we were younger, except our oldest cousin (Say her name is Annie). I only see them maybe 6 times a year, we do celebrate holidays/birthdays together. So Annie (now 26), is getting married in September, in Las Vegas. (We all live in California) I seriously don't really know anything about her, she stayed with us for 1 month in summer, back when I was in 7th grade. (I'm 23 now.) That's the most time I've ever spent with her my whole life. She's always been more into hanging out with her friends, so we've actually never hung out. We've hung out more her two younger brothers. Whenever there were birthday parties, she always invited her friends and hung out with them, never with us. I think Annie and I have been the ""closest"" since my older two sisters are very tomboy'ish and weren't into girly things like Annie was. So the few times we talked, it was usually about boys, makeup, and fashion, whatever girly things. So Annie moved out at 18, and was gone from my aunt's house for years. She also never really reached out to us or talked to us, we would only see her like a few times a year for holidays. She recently got a house and invited us for Christmas at her house last year. And like always, she had friends (they were long-time family friends, so we at least knew them) over and giving them the most attention. She was treating us very kindly though, making sure we were eating and drinking. But most of her jokes and conversations were directed to the friends. She also invited me in February(just me, not my sisters) along with her mom to go with her to bachelorette party in June, it happened last week. I did not go, because around March she texted me saying something about if I wasn't okay with going since her mom still hasn't gotten the days off, or something, I just had this weird feeling she didn't want me to go, I didn't fight it. So I venmo'd her some money and said ""Shots on me, have fun!"" and she totally ignored it. It may have been cause her other friends were venmo'ing her, so maybe she missed it. Also whenever I comment (like a comment on a selfie that she looks great) on anything on her social media, she always ignores it. Maybe I'm just annoying though. So I don't know if I should waste money on a plane tickets/hotel for her wedding in September. But she's also the only family I kind of have and I don't want to be a jerk.. so AITA for even thinking about not going, everyone in my family is going.

&#x200B;

Thanks for reading!"	No A-holes here	0	0
bztqqk	2019-06-12 17:02:27	lionelcheahkaien	AITA for making this joke?			0	1
bztpx5	2019-06-12 17:00:40		AITA for not wanting to rely on others to get places?	"I'm an abult dealing with mental health issues, and part of it is not knowing how to drive in an area where taking the bus is often seen as a horrible failure of character. 

It's worth mentioning that my mom has a history of being really verbally abusive, and I've been going to therapy for a while because if it. It's for the most part gotten getter between us but I still feel a bit of tension from it. For a long time I've developed a learned helplessness from her words, and it doesn't help that whenever I talk about going somewhere now she jumps to offer rides. Like even though I'm fine and I've been fine taking public it feels like she still doesn't accept or trust that I can be responsible enough to do things on my own.

For example if my family has plans mom usually starts getting freaked out about giving me a ride and making sure it's all timed properly. 

*""To get there at 5 I have to be done with my hair appointment at 4 then I can run back to the house- oh, but that'll take a while. I know! I can have your sister drive me to the appointment in my car, then she can pick you up after work and pick me up too!""*

Ect. ect. ect. It gets really overly complicated.

Thing is I can just take public transit and everyone can deal with themselves, but as soon as I suggest it she treats it like it's simply not an option. 

Mom: ""The trolley doesn't got that far.""
Me: ""I know, but the bus does.""
Mom: ""but that won't work! you can dirty your outfit.""
Me: ""I've never once ruined an outfit on the bus. It's not as dirty as you think.""
Mom: ""You never know though!""

We'll go back and forth and she shoots down anything I say. When I do put my foot down and tell her I'm doing it my way she acts really hurt.

I just want to feel a small bit of independance. Whenever I try to spread my wings it feels like I'm being held back by her insistance. 

AITA for refusing her help?"	Not the A-hole	1	0
bztpum	2019-06-12 17:00:33	ThorgarIV	AITA for making a compliment to the subject of a pic my GF sent me?	"My GF sent me a pic of a woman holding a jewel she liked in one of her hands, a huge portion of the pic was also taken by her thighs. Obviously, her intention was to show me a jewel she liked and after giving my opinion about the jewel I also appreciated the thighs thinking it was her in the pic. While the thighs actually looked like hers the hand was definetly different to hers but I didn't pay attention to that when I sent the message, I only noticed later.

&#x200B;

So, she got pissed off because I appreciated someone else's body and even more because I saw her body many times and (according to her) I'm supposed to recognize her body and in particular her legs among others. 

I didn't agree with her idea and to prove my point I sent her some pictures of men legs similar to mine (particulars between the knee and the ankle) so she had to figure out which one was mine, she failed the test and said the test was rigged because I didn't show enough details.

&#x200B;

She's hurt and wants me to apologize but I don't feel like it because I don't feel guilty, in my mind I was appreciating her legs.

&#x200B;

AITA?"	Everyone Sucks	0	0
bztoq2	2019-06-12 16:57:59		AITA for telling my co-workers I'd never marry someone like them	"Beginning of the shift, we're all just hanging around. Me (early 30s M) and a group of women (mid-20s to mid-50s) are talking and the subject of how much money I'm saving comes up (I'm a single dude living a minimalist lifestyle).

Tina (mid-40s): If you're so stingy no girl will wanna marry you.

Me: Well that's too bad. (sarcastic)

Jen (mid-20s): Did you hear that? It's like he doesn't even care. I'd personally never marry you unless I got 40K diamond ring.

Me: Would you marry me if I got you a 40K cubic zirconia ring? (joking)

Jen: No! It has the be the real thing!

Me: Then what about a 4K diamond ring? (joking)

Jen: You're just a cheapskate.

Me: If a girl only marries me because I bought her a 40K diamond ring, then she's marrying me for the wrong reasons and I don't want her.

Jen: You're just gonna be a lonely virgin for the rest of your life.

Me: If the alternative is marrying you, I'm fine with that.

Sasha (mid-50s): Well my husband got me this wedding band, and here's the ring (begins to show off her jewellery).

(I take that as my chance to leave and turn away, but before I can get away...)

Kei (early-30s): Hey 'BarelyMarried', how much would you spend on a ring for me?

Me: I'm looking to marry a partner, not go shopping for a sugarbaby. If they're not happy with a 5K ring, they're not worthy of a 50K one.

Jen: Are you calling me a gold-digger?

Me: I said I won't marry a girl if she'll only marry me for a 40K ring. You're the one calling yourself a gold-digger. (I walk away)

**Guess who has a meeting with HR next Monday?**

AITA for telling my co-worker that I'd never marry someone like them?"	Not the A-hole	0	0
bztmbh	2019-06-12 16:52:29	monkey_sage	WIBTA if I declined a request to be at a friend's Bachelor Party?	"A friend of mine is getting married and I am thrilled about it. One of his good friends invited me to his bachelor party. The party involves a lot of beer with the venues being a brewery for beer tasting, dinner at a place centered around its beer, and then movie watching with more beer.

The thing is... I don't drink and I fear that I will be a real drag on the fun if I'm the only one not drinking and I worry that there may be pressure for me to drink while I'm out and I don't really want to have to explain why all day.

So I'm thinking of declining but my friend specifically asked for me to be there. Would I be the asshole if I didn't go to this party?"	No A-holes here	0	0
bztlal	2019-06-12 16:50:20	a00107987	WIBTA if I tell my best friend not to get a dog?	"  

For context, I should start by giving a little background information. T has been my best friend for the last 20 years, at this point, we're more like sisters than we are friends. T has had a pretty hard life as she struggled with anorexia, bulimia, depression and PTSD following her mom's death.

&#x200B;

In 2017, my boyfriend and I shared a townhouse with T & D, their cat and their 2 bunnies. 6 months after we moved in together, T & D split. After their split, T told me that she had to give away her two bunnies and then a few months later her cat passed away unexpectedly. It was a really hard time for her. Eventually her and D managed to patch things up and within the following months of reconciling, T and D adopted a new cat, moved, and shortly there after she became pregnant. 

&#x200B;

Now lets fast forward to this Saturday evening that just passed while we were at T’s house. It had been no secret that T was struggling with postpartum depression, we had talked about it since the birth of my nephew, but she brought it up while I was over. We sat and talked about it for awhile when she said something about how the time her and D split, was the worst her depression had ever been. I made a comment along the lines of ""Well, it doesn't help that you had to get rid of the bunnies and your cat passed away too"" in which she replied ""Yeah - about that"". T then went on to explain that her depression had gotten so bad at one point that she completely neglected the rabbits, causing them to die from starvation and/or dehydration. She said she felt so bad and was so embarrassed that she lied to me about rehoming them. She said that she also knew her cat was dying but that she couldn't bring herself to admit it and was hoping that she would just die without anyone noticing. I was shocked to say the least but told her that I understood where she was coming from. Later that evening, however, T went on to say that she wishes she never got their newest cat because she's overwhelmed with taking care of the baby. No more than a few minutes later she overhears D and my boyfriend talking about dogs. T chimes in and says that she wants a dog. I tell her that it's a lot more work than she realizes and that having a baby, a cat and a dog would too much for her, and she simply tells me that she's not worried about that because she can manage – contradicting herself from earlier.  

&#x200B;

So that brings me to ask, WIBTA if I tell her not to get a dog? She's been talking about it since we went over and is very serious about it. She says it'll be a form of therapy for her, however, judging from her track record with previous pets and her unwillingness to seek professional help for her mental health, I don't it'll help her one bit. My boyfriend agrees with me but thinks that if I say anything I'll hurt her feelings as she's a very sensitive person. I want to give her a reality check but I'm scared that if I do, I'll end up being a giant asshole."	Not the A-hole	0	0
bztjtw	2019-06-12 16:47:06	screwdriverebimboca	AITA for asking my girlfriend why she's wearing makeup?	"Last week me and my girlfriend went out with my friends to eat pizza, when I first saw her that day, I thought she was beautiful and said: ""Why are you wearing makeup?"" Because I didn't think she would dress up for such a casual meeting.
Today she messages me saying she's sad because I questioned her about wearing makeup and I tried to explain to her that I didn't mean to question her, I just wanted to express my surprise, and that turned into a snowball and we are discussing for 4h straight.
So AITA?"	Asshole	0	0
bztjmt	2019-06-12 16:46:37	griffinsfreakedbean	WIBTA if I covered my doorknob in glitter to keep my sister out?	"My younger sister (13) hates glitter. If anything has even one piece of glitter on it she'll refuse to even touch it and be super uncomfortable until it's removed from her sight. 

She also has a habit of going into my room when I'm not home and taking or using my stuff without permission. Of course I've asked her to stop and she hasn't - you know how siblings are. I've asked about getting a lock and gotten a hard no.

I found some craft tape at the store that's basically regular tape but with glitter on the non-sticky side. WIBTA if I covered my doorknob with it to keep her out of my room?"	Not the A-hole	0	0
bztjdy	2019-06-12 16:46:06		AITA for thinking that my best friend should talk to me more often?	"So I don’t want to get to personal, but I try the best to explain my situation without mentioning any sensitive stuff.

So my best friend is female, I’m male, we know each other since we are 4 years old and always understood each other without any complains.

It’s nearly a year ago since stuff went downhill between us. One close member of her family died during the time, who was also a neighbor of mine who she visited nearly every second weekend since our childhood. It also became a thing between both  of us to meet each other during the time she spent the days with her family member. In the week in which this particular member passed away, she was also send to the hospital due to a condition with her lungs, who everyone thought that this was allergic reaction without any huge explanation. Well I turned out quite recently that it was lung cancer. She spend a whole month in the hospital trying to get rid of a tumor. I was visiting her a couple of times, also texting her nearly daily, but nether got a decent message back from her. I know that she suffered a lot this year, but it feels like she purposely avoiding me due to our shared history... (sorry for the typos, English is not my main language)"	Asshole	1	0
bztimp	2019-06-12 16:44:32	thenewyorkgod	WIBTA if I lied to my family about saying a special prayer for my father who just passed even though I don’t plan on doing it?	In the orthodox Jewish faith, a son has an obligation to say a special prayer in temple three times a day for an entire year. They believe that the persons soul is in limbo and can only get into heaven if this is done. My father passed recently and my family, who knows I am no longer religious , keeps asking me to confirm 100% that I will do this three times a day for the next year because they fear for his soul. I assured them that I would and it had put them at peace. But once I leave in a few days to go back home I won’t continue. I am not religious and do not believe any of that. Was it okay to lie to them to make them sleep better knowing his soul is protected?	Not the A-hole	0	0
bztgj7	2019-06-12 16:40:02		AITA: Playoff Tickets	"My cousin works at a company, he has a peer who was selling tickets. I asked for 1, I received it, and went to the game.

Its been about a week, and the guy hasn't hit me up for money, never provided information on how to get him money when he sent the ticket to me. I even reached out to him to see if I could snag another ticket for a friend, but he just forwarded my email to his account rep.  


So this may look bad on my cousin because I haven't paid yet. (Also my cousin is kind of a doucher, so I am not as worried about his work relationships... long backstory) BUT it shouldn't be my job to remind people that I need to pay them back. In principle, I think I'm in the wrong... but also why would I say something.  


So I must ask... AITA"	Asshole	1	0
bztgfb	2019-06-12 16:39:46	throwaway___2187	AITA?			0	1
bztg3n	2019-06-12 16:39:02	dressinbrass	WIBTA if I post family photos from an event that shows my sister as she actually looks?	"Background: My sister and I aren't close and my family and I are slightly estranged (although more from my side than theirs). She's active on social media, especially Twitter, but I've noticed recently she only posts photos of herself that are more than 5 years old. That includes photos of me with her (ie, on my birthday). She also aggressively untags photos on Facebook she may appear in.

We saw her over the weekend for a birthday for one of my kids and she looks to have gained a significant amount of weight in the last two years. I love taking photos at family gatherings and my mom is requesting I post all the ones that aren't of my kid.

My wife and I are debating if I should post the few photos with her in them, knowing how Facebook's auto-tagging works, etc. Given her careful curation of photos and appearances on FB, Twitter and IG, I can tell she's struggling with self-image, so I feel bad (as much as I don't get along with her).

EDIT: I don't want to post them, my mom and dad are requesting I post all the photos."	No A-holes here	0	0
bztfxv	2019-06-12 16:38:39	hermanswife	AITA for trying to accommodate my mentally ill sister at the expense of my family? Or did I do the best I could in a very challenging situation?	"Using a throwaway account because it's probably safer after all that went down. 

My sister is extremely mentally ill, but at least according to a family therapist that we've gone to as adults, she is not so mentally ill as to not know what she's doing and in my opinion she is a massive spoiled brat and attention seeker. She claims to be unable to function on her own and through our mom's guilt we have basically ""passed her around"" from house to house for the last 7 years. For reference my sister is 42, I am 28 and there are 3 adult kids between us. Sister is oldest, I am the youngest. I also have a 6 year old and a 3 year and am happily married. 

It was my ""turn"" to take my sister in after she was forcibly ejected from her apartment for essentially being a hoarder and causing extreme health issues for her neighbors. So I sat down with the therapist, my mom and my sister and explained that she could live with us until she got things worked out with public assistance but there would be ground rules about her cleanliness, her food consumption and her tone and volume of voice. 

Well it lasted exactly one day. I went to Trader Joes the first day she was here,  half for our family and half for her. She managed to eat about $150 worth of groceries in the first day. She also basically left a trail of garbage between the kitchen pantry and her room (I mean this literally, for example she would peel the wrapper off a peanut butter cup while walking and leave it on the floor). My husband absolutely came unglued at her and screamed in her room that either she ""picked her fucking shit up or she had to go."" At that time I didn't appreciate the way my husband was talking to her in ""her"" space and he and I got in a huge fight over it. 

Things didn't get any better and I actually think my sister was using my defense of her to ""show my husband"" how she could get away with whatever she wanted because she went into my daughters room and got out all her toys and ""played"" with them and refused to clean up the mess. This weekend I finally had enough and we took her (basically kicking and screaming) to a hotel where we paid for a week (in cash) for her to get out of our house. 

My husband is so furious at me because not only do we have a disaster of a mess (probably to include pee and poop) in our guest bedroom but we are out about $600 to get her out of our house.

In my defense, I knew my sister would be bad when I invited her to stay with us but I didn't know it would be ""that bad"" that fast. Was I the asshole for allowing her to stay and do I need to make it up to my husband or does he need to understand that while my sister is a ""challenge"" she is family and I did what I thought was the right thing?

any help with judgement would be greatly appreciated?"	Asshole	0	0
