id	created_ts	author	title	body	flair	was_deleted	was_removed
bzxh6z	2019-06-12 22:07:56	throwraway18	"AITA for singing along with the word ""negro"" in a song?"	"I'm not black. Long story short, my friends and I all were singing in the car together. One of the songs (Beyonce's Formation, if anyone's wondering :) ) had the word ""negro"" come up in the song, and I know all the words so I sang it. My friend who is black got super mad and called me out in front of the rest of my friends for saying it. I quickly apologized, but she was still pretty angry and went on a rant to me about racial slurs and historical racism. Obviously, I didn't mean to offend anyone by singing it—I don't say the word in conversation and only sang along to it because it was in the song. I also never use the n-word (song lyrics or otherwise) or other racial slurs, even as a joke. I'm also a racial minority so I've felt some of the effects of racism and would never want to impose them on others. Still, my friend obviously thinks I'm TA so AITA?"	Not the A-hole	0	0
bzxghq	2019-06-12 22:06:10		AITA	"I'm on mobile so dont hate me
Oh and I added some stories at the bottom to show how I start things but I never finish because I cant ""hang""



M: me  j: my oldest sister a: my younger sister k: my other sister



J and K went to the corner store and bought some provisions, when they returned A grabbed a bag of chips and and started to munch on them. She then saw a bag of taxis and this is where it all went downhill.



A: I wish I got the takis
M: why, you cant eat them with chamoy? (Its like a chili sauce kinda thing idk, google it)
A: yeah you can you just have to eat them quick.
M: that's kinda fat.


That was the end of the conversation. She then went to J and K's room and began to talk about our interaction. J has always been protective of A and began to yell at me for hurting her feelings. J storms into my mom's rooms and explains to her the issue at hand. 

J: m and a are fighting again. I dont know why M always starts these fights when she knows she cant finish them.
K: can you stop it already, this is why M always feels like crap, you laugh at the mean remarks that A says to m but you can't stand it when M does the same.
J: it's because A is actually funny.


Here is another ""fight"" that happened yesterday.
  I was stretching and my shirt was lifted up, you could see the stretchmarks that I have on my hips. 

A: ewwwwwwww those cats got you good. They scratched you everywhere.

M: shut up A you know damn well that you have stretch marks as well. 

A: no I don't. 
She lifted up her shirt and you could clearly see 3 bright red  stretch marks forming on her skin. J heard me and told me to leave her alone and that she was growing, and  everyone gets them. I was baffled. 

Here's a quick one. A was mad last week and decided to hit me where it really hurt. 
J: shut up, you're stupid why dont you just ki- what did you think that I forgot? Go run to my parents and tell them what I just told you. 


I sat on the toilet for 2 hours and cried. My sister's think that I'm just being dramatic."		1	0
bzxfn8	2019-06-12 22:04:13	polymess3847237645	AITA for wanting my boyfriend to dump his other girlfriend?			0	1
bzxf46	2019-06-12 22:02:59	scholarshipthrow555	WIBTA if I went to a strip club for my bachelor party.	"I’m getting married in a few weeks and everyone from my work wants to take me out before. This would be a large group of both male and female coworkers. 

We had a conversation in past with my SO about it and while she said she would be ok with it as long as I didn’t hook up with anyone. This is the last thing from my mind I didn’t even plan on doing a bachelor party. I have a feeling she will be upset by this even though she said it would be fine. Some of my coworkers are telling me not to say anything to her unless she finds out. I do not like this idea I never keep anything from her and she will easily be able to tell if I was to try and hid it from her. 

With all that being said I do think I’d have fun and for me it’s more about celebrating with coworkers and friends more than anything else. 

So WIBTA if I went?"	Not the A-hole	0	0
bzxf1q	2019-06-12 22:02:48	ac19455	AITA for having bad BO on a plane?	"Long time lurker, made account specifically to post this.

So I’m in the Army, and I left post in a rush with some buddies after spending the day packing a connex. I wasn’t even thinking but I was sweating pretty hard and didn’t shower before throwing on civilian clothes.

When I boarded, the older lady next to me leaned over and told me I was rude for boarding a plane in this state. I immediate felt terrible and started apologizing profusely.

A bit later I was still feeling bad and decided to offer to by her and alcoholic drink as an apology. Big mistake...

She turned out to be Mormon and I guess I had stepped to far. She begins to shout me down full shouting mode at this point and several passengers started to shame me as well. I honestly don’t think it was just the alcohol suggestion, but it just pushed her over. She continued to berate me the whole flight and I of course left in a hurry once we landed.

I know this is an asshole situation on my part for putting this lady through four hours of my stink. But what should I have done after I was on the plane and had already screwed up? How should I have known she was Mormon and would get that mad? Did I deserve the shouting?

This has been messing me up the past day and a half. I hate to make other people uncomfortable and can’t stop beating myself up for it. Will definitely never leave post without a shower again.

Please help me understand my level of YTA. I feel bad for stinking, but honestly can’t tell if I deserved the harassment or not.

Edit: The other passengers weren’t really joining in on the diatribe. Just giving me dirty looks. Guess I didn’t make that clear."	Everyone Sucks	0	0
bzxevf	2019-06-12 22:02:27	BadVibesYo	AITA for refusing to help my addict mom pay her rent?	"So to start this off, I’m 19(M) and my mom is 40. I work full time in a restaurant kitchen and my mom hasn’t worked for the last 10 years. I’ve tried many times to convince her and even help her find a job but she doesn’t even want to put in the effort. For as long as I can remember she’s been addicted to various drugs ranging from cocaine to prescription pain killers. Because if this, I spent most of my child hood living with my grandparents who were alcoholics, so I never had a good life growing up. She’s had months of being sober but always ends up coming right back to it. Anyways, since I work full time I have saved up a lot of money and she knows this. She used to text me all the time asking to borrow money from me and at first I did it, but realized it was almost certainly going to drugs and I didn’t want to support her habit. Also, when you give her money once, it doesn’t stop. She keeps asking and the number gets bigger every time, so I put a stop to it and told her to not bother texting me if she’s just gonna ask for money. 

Here’s my issue. The other day after 6 months of not talking to me or showing any interest in my life. She texts me randomly asking for 300 dollars to help pay her rent, saying that I’m her son and I should help her out and that she’s desperate. I told her I can’t do it, as I have my own rent to pay to my roommate and my own expenses, school to save up for next year etc. I told her that as long as she and her boyfriend who she lives with are both unemployed and addicts, I will not give her money. She’s telling me that if I don’t give her the 300 dollars that she’ll be kicked out on the streets. She’s manipulated me many times in the past, but this time I won’t allow it. 

So tell me Reddit, AITA?"	Not the A-hole	0	0
bzxcgi	2019-06-12 21:56:44	kharghulkaka	AITA for giving people what they want?	Really new to reddit but I can scroll for days! I stumbled across the subreddit   r/roastme and I find it hilarious. I come up with some hilarious ones but end up deleting them because i feel they maybe to harsh and hurt the person. I bite my tongue and go for a more PG one but sometimes I wanna BURN THEM ALL! AITA?	Not the A-hole	0	0
bzxbnw	2019-06-12 21:54:52	startupthrowaway6	AITA For Leaving a startup who only pays enough for 1 meal a day?			0	1
bzxbgn	2019-06-12 21:54:22		AITA for being overly dependent on my SO?			0	1
bzxbcd	2019-06-12 21:54:05		AITA for thinking abortion should be illegal?			0	1
bzxay9	2019-06-12 21:53:05	Tek-Tion	AITA for blaming my father for letting my car get stolen?	"Sorry if my english is not good enough. It is not my native language.

For the Last two weeks, my father was using my car , his car broke and he was trying to get a New one because it was time for a change.
In the meantime i let him use Mine because i did not use it to go to work and during the Day he has to move around the city a lot.
To be clear i did not have insurance, it was old and cheap and it was the only thing i could afford because im paying for my studies, but it was my first car and i took care of him a lot  knowing that if someone would steal it, i would be left with nothing.
I never parked it on the street because i dont live in a safe neighborhood and the old cars are the easiest to steal, at least in my country.
So well, he used it and everytime he left it on the street with no supervision and yes, it got stolen.

Yes i know i should have had insurance and don't get me wrong i love my father more than anything in the World and i really care more about him that the money i lost but i can't help being mad at him and have  not even apologized. 

So the question is, am i the asshole for blaming him for his irresponsability knowing that i had no insurance, and it was my car not his?

Edit : i pay a secure carpark a block away from my house."	Not the A-hole	0	0
bzxaux	2019-06-12 21:52:49	ac19455	Had bad BO on a plane.			0	1
bzxalx	2019-06-12 21:52:11	EarlGreyEveryDay	WIBTA if I ditched my friends on our weekend girls’ trip to do something I’ve always wanted to do but none of them are willing to pay for?	"My friends and I have a tradition where we go away to a different location over the same weekend every summer. This year we’re going to my family’s cottage. Without being too specific, this cottage is in an area where there a ton of fun activities available. Originally, the reason I had suggested this location was so that we could do this one activity in particular that I have wanted to do since it was built a few years ago but have never done as it is only possible in the summer (we use the cottage during the winter and rent it during the summer). This year I organized the weekend far enough in advance to be sure that it wouldn’t be rented for the weekend that we are going up. 

In the process of planning the specifics of the trip, one friend in particular mentioned that she didn’t want to do this activity because it is too expensive ($100) she suggested another activity to do that is $50 and all my friends agreed to do that one instead. One of my friends, let’s call her Anne, would also like to do the activity that I want to do but doesn’t want to go against the friend group. I don’t see the issue with the two of us doing the activity without the rest of the group, but she suggested we go up a different time to do this activity so that they wouldn’t feel left out. I would be more resistant to doing this since it’s a 2 hour drive from where we live and we wouldn’t be able to stay over because the cottage is rented for the rest of the summer. I get that it’s her decision ultimately, but I don’t really want to budge on this. 

Sorry for being vague, I’d rather avoid being identified. Please let me know if anything is unclear and I’ll do my best to clarify. 

So reddit, WIBTA if I ditch my friends and do the thing I want to do?"	Not the A-hole	0	0
bzxaj4	2019-06-12 21:51:57	colinJESUS	AITA for being mad at my best friend for making out with my ex?	"16M here, so basically I dated this girl for like 2 months and we had an OK connection nothing special but I stil liked her. While we were ""togther"" my best friend starting to build a connection with this girl and before i knew it they were ""best friends"" we then broke up because I just didn't feel it anymore and i felt like i was just using her for her body. Fast forward like 3-4 weeks there is class trip we all went toghter to and i start hearing rumors about her starting to ""fall for him"" I then go to talk to her and we talk things out about how I felt and how she felt. I then ask her about the rumors and she goes ahead and says ""i would never sleep with my ex's best friend"". The day after i hear that they are sitting alone somewhere and I dont think to much about it. I go to check it out and I ask him how he feels and what he is going to do, he then says that he dosen't know and feels that it's weird and blah blah blah. Fast forward to the morning, (we sleep in the same room) I wake up to them making out in the bed next to me, i keep quiet and pretend to be asleep for like 10 minutes and they keep making out and start rubbing each other and shit. After she goes I pretend to wake up and ask him multiple times about her and what he felt and if they did anything. He lies over and over again, and then i tell him that I know everything. He then procceds to get annoyed and then just goes his way. 

AITA for being mad at them? I just feel super disgusted and super disrespected by them making out right next to me."	Everyone Sucks	0	0
bzxa99	2019-06-12 21:51:18		AITA for telling my little brother to grow the f*ck up?	"My little brother is 23, he has a job, and lives on his own. He is admittedly mature in many ways, so I want to give credit where credit is due.

But last night we were hanging out and I tried this new flavor salt on some popcorn.  It was supposed to be dill, but it came across as lemon to me. Thinking it was just weird/interesting, I asked my brother to try it.

At first he refused because he doesn't like dill, but I assured him that wasn't what it tasted like to me. So he tries it and just goes off. Like, 0 to 100 in no time flat. He's yelling and literally SPITTING in my living room! He tells me off, saying crazy shit about how I'm just like everyone else trying to make him do things he doesn't like.

I got angry right back and told him to grow the f*ck up, that that was just beyond unnecessary.  He gets upset, acting like a kicked puppy, and I start to feel like a jerk. Maybe, knowing he just doesnt like dill, I shouldn't have offered it to him? Maybe I should have tried to de escalate rather than telling him off? Idk.

So AITA here?"	Everyone Sucks	1	0
bzx9jt	2019-06-12 21:49:25		WIBTA if I give away my ex’s gift to me?			0	1
bzx9g9	2019-06-12 21:49:11	Waynethrowaway9737	AIMA for not saying a word when we all went out to eat?			0	1
bzx9do	2019-06-12 21:48:59	mozartspianokeys	AITA for not wanting to move to another state with my wife?	I’ll keep it short. My wife and I have been married for about a year and a half, and together for almost three. Today she texts me and asks if she were to get a job in another state, if I would follow. Now, i have a stable job that I love and make good money. Her job isnt as stable, as it is in the service industry, but she makes decent money. I told her that I would probably let her go on and take the job, and once i got my things in order, I would join her. Money has always been a big factor in everything I do, and I wouldnt want to move to a completely different state without having something set up before hand. Also, she came to study in the states so she is used to being away from her family. I have always been very close with my family and would be leaving everyone behind in this move. Again, this isnt an important factor, my biggest issue is the not having a stable source of income immediately upon arriving. Long story short, my wife got pissed because to her i wasnt “supporting her dreams.” When in reality, i want to shield her from the extra stress that moving without a job (for myself) would bring. The argument ended with her pretty much telling me that she might have to chase her dreams solo since i dont want to chase them with her. So, AITA?	Not the A-hole	0	0
bzx8xm	2019-06-12 21:47:57	CautiousIntern	WIBTA if I follow my dream			0	1
bzx8gb	2019-06-12 21:46:44		AITA for not wanting my boyfriend to get fat and watching porn? [iMessage pasted]			0	1
bzx877	2019-06-12 21:46:15	anon1234566543231	AITA for not telling my friend about his mum cheating?	"First time posting on reddit so I apologise if its bad. 

&#x200B;

Okay so to start this off, this was a few years back, at the time I was 13 and fresh in high school i believe, my friend (G) and I were decent friends not overly close. G's father was diagnosed with cancer and he was not getting any better and G's family knew the father was gonna pass away. One day I was sitting on the couch during spring break and my mums phone got a notification and she asked me to check it so I did, it was a text from G's mum of a nude photo and it had a text message with it that said something about the sex the night before (it was not meant to be sent to my mum it was an accident) and I asked my mum about it and we were both shocked, my mum went around to go talk to G's mum and I tagged along, after they had a conversation G's mum came out the front of her house to me and asked my not to say anything to G or anyone because he was already really upset because of his father being sick. Me not really understanding what was happening to full extent just agreed to not say anything. I have never said anything to anyone just kept it to myself but looking back on it I feel bad for not saying anything. I planned on telling him once after his dad had passed but he was an emotional wreck he was in therapy for depression, dropped out of school and started to use drugs so I thought I would have made it worse so I left it alone and to my understanding to this day he still doesnt know. That was a few years back and I don't speak to that family anymore because I moved countries. When I think back about it I do feel like an asshole so thought I would ask. 

&#x200B;

So AITA?"	Not the A-hole	0	0
bzx7x3	2019-06-12 21:45:38	WalkenJKRowling	AITA for not wanting to hang out with my best friend's boyfriend?			0	1
bzx49l	2019-06-12 21:36:59	csgo-is-trash	AITA for getting upset with my girlfriend over a situation with money?			0	1
bzx3wt	2019-06-12 21:36:13		WIBTA for breaking up with my SO based on the contents of their anonymous, public-facing blog?			0	1
bzx3v8	2019-06-12 21:36:08		AITA for being the opening at the end of the alimentary canal through which solid waste matter leaves the body?			0	1
bzx3ui	2019-06-12 21:36:05	MarcoNP	AITA for wanting to a friend with me for clubbing			0	1
bzx3my	2019-06-12 21:35:33	MadsPostingStuff	WIBTA if I kicked my sister off my Prime/Netflix accounts?			0	1
bzx3ls	2019-06-12 21:35:28		AITA: Not Reporting Girl Because Of Her Bday Cemetery Photoshoot	"This girl I know just hit a milestone bday and did this very bizarre birthday ""photoshoot"" in a cemetery. As far as I can tell, this photoshoot was literally done just to post on social media. The bday girl is wearing all black, raybans, and holding up these gold balloons while making (what I assume she thinks are) fierce poses in front of headstones. The entire post is hashtagged something like death to my youth. Very weird. Normally I'm a live and let live type (esp when it comes to social media posts), but this was just so...idk what the right word is. Disrespectful, maybe? I mean, I'd be pissed if I saw her posing next to my grandma's headstone with gold balloons. (She wasn't, I'm just trying to explain my initial reaction to the pics.) Anyway, I saw the post while I was in a car with my cousin and showed her the pics and said ""I'm going to unfriend her"" out loud. My cousin said I should ""do something more like report the photos to get them taken down."" I didn't. I mean, it's a really grim and not at all funny photoshoot that I don't understand in the least, but no one else seemed offended (actually, the comments were all very supportive, strangely enough). I guess I didn't report them because I couldn't really decide if this cemetery backdrop was offensive to just me or offensive in general? (Never ever thought I'd actually be confused about whether or not a photoshoot in a cemetery is okay, but here we are.) I went with just unfriending and not reporting. My cousin now thinks I'm TA because those are \*someone's\* family members that the bday girl is duckfacing next to even if they're not mine so I should try to get the pics removed. AITA?"		1	0
bzx3ju	2019-06-12 21:35:21	CautiousIntern	AITA for not following my dream career?			0	1
bzx2zi	2019-06-12 21:34:03	kharghulkaka	People ask for it on r/roastme			0	1
bzx2vx	2019-06-12 21:33:48		AITA For calling my classmate an hypocrite because she wants to be my friend now?	"Throwaway because my friends know Reddit. Also sorry for the English.

Also High school drama, I know.

Some backstory before we start.

Last year I transfer to a new school (11th grade I think in America) and I knew absolutely nobody.

Since I had 3 years left of high school I though it could be nice to make some friends but it was really hard since everyone already had a group.

There was this girl (A) who was new too so we immediately bonded.
The fact is that while she started making other friends with other people of my class, I didn’t made any.

After 2-3 months she started to glare at me every time I was with her, one day she told me I should sit somewhere else and “Not stick with her and try to make some friends of my own”. 

Maybe I was too clingy, I don’t really know, but I was alone for the rest of the year because I didn’t want to trouble her and I only knew her, plus I am a pretty shy person myself.

Fast forward to this year, I’ve started to get along better with my class and even though I wasn’t close with anyone I still get along with everybody.

Now last week we went all together (our class) to a Luna park.

In the last few weeks A started to go with me pretty much everywhere, I learned later that it was because she fought with her other friends.

Anyway we are at the park and she always sticked with me and asked me every time if she could sit with me.

She then complained about the fact that nobody was paying attention to her and that I was the only one who talked with her, and that the next year will probably be like this too because her friends left her and I am the only one left.

At this point it started to be really annoying because I wanted to enjoy the day and she was always complaining.

So I told her that last year she left me alone to go with her friends and now the fact that she wants me to be friends with her is pretty hypocritical.

She get offended and leave.

Words got out and now a lot of girls in my class hate me because they think I was too mean to her and that I am the asshole. For some context we are all 17-18 y/o.

So AITA?"	Not the A-hole	1	0
bzx2om	2019-06-12 21:33:20	Thicc-Throw-Away	WIBTAI I Got My Boss and Friend Fired for Reporting Them	"So I work for a pretty popular mermaid corporation and a pretty big policy that's strictly followed is that managers and assistant managers can't date anyone below them (mostly because they make the schedules and do everyone's pay roll). Recently I found out that my manager is letting her best friend who works in her store date the assistant manager of that same store. I wouldnt really care if they were chill about it but they also won't hire my boyfriend on the grounds of ""we can't date other people in the store"" and have also hired other managers significant others, friends, and family. Also the girl who's dating the assistant manager and who's best friends with the manager of the store is being fast tracked to be an assistant manager herself and had already almost outed herself on two occasions to our district manager. Should I just tell him and corporate or be salty about it?"	Not the A-hole	0	0
bzx2h2	2019-06-12 21:32:47		AITA for making my son have a panic attack			1	0
bzx28i	2019-06-12 21:32:10	axolotl4life	AITA for expecting people to keep their dog from pissing on my lawn?	It drives me nuts. It can kill the grass and it’s just rude imo. I have two dogs and they would love to piss in your yard, but they’re not allowed to walk on your property. I wish others had the same sentiment. But the majority of people I see just let their dogs run and piss freely in others’ yards; destroying the grass and bushes caught up in the leash. AITA and overly sensitive?	No A-holes here	0	0
