id	created_ts	author	title	body	flair	was_deleted	was_removed
c7kn1d	2019-06-30 22:39:05	stayzer0	AITA, or we, for not doing what SIL wants?	"My husband's (“J”) father hasn’t been a good dad. On J’s HS grad night, he was gifted a suitcase and told that his parents were divorcing. J joined the Marines about a year later, did his service, and when he got home his dad wrote him off and said to never ask for anything. J moved on. 

J had a serious health scare this spring that put him in the hospital for 2 months. Right before this, his dad had a fall and will be in a home for the rest of his life. SIL is DPOA. While J was in the hospital, his dad decided that he now ""loves"" his son and wants a relationship him. This pattern has always repeated throughout their lives; when it's convenient for dad it's all good. FIL is mentally aware of what he’s doing, it's classic narcissism.

Now that J is home, life is getting back to normal. Except shit with his dad. I agreed to talk as a proxy to my FIL to appease SIL's request that their dad was bugging her to talk with him. Fine, I can deal with texting and stuff. I have the messages on DND and respond when I have time. Well, now she demands J to go visit. In fact, she's saying he needs to ""step up"", but he never agreed to visits. 

J doesn't want to, he does not forgive his dad for the 20+ years of awful treatment, and I don't think he has too. His dad has had ample time to apologize for the shit he did and has refused. Just because he's in a home, that doesn't change. I feel like SIL is only looking at this from her side, as she was daddy's little girl, and never experienced the shit J did. Fuck, J has been home for only a month. Can we focus on our family and our health before we take on someone who is a jerk and will never change? I think she's more TA for trying to make this our problem so he doesn't move out west. That's really what this is about, because she didn't start flipping out until we got an email from his SW stating that maybe it would be better for him to transfer.

This has no benefit for J, it will only cause pain. Her reasoning is that J will lose his dad forever and never have the relationship repaired. Honestly, it probably won't ever be repaired and if J has come to terms with that, it's his right. He has to live with it, not her. Which is why I feel like the meddling is more for the fact that if their father is out where she is, she would then have to be the one with more obligation than she really wants. But she signed the paperwork, he warned her of the burden, and there's nothing we can do about that. Are we really the assholes?

Edited for CC- ask questions for clarity. There’s a lot more but I can’t add it."	Not the A-hole	0	0
c7kmhh	2019-06-30 22:37:42	adam885	AITA for giving a Uber driver five stars because how she was looking at me and reporting her to Uber ?			0	1
c7klym	2019-06-30 22:36:25	ew032297	Friend who hasn’t talked to me in months is mad she isn’t my maid of honor			0	1
c7klpo	2019-06-30 22:35:51		AITA for being upset that my friend cancelled on helping me move last minute?			0	1
c7klfb	2019-06-30 22:35:08	Dared_Llama48098	AITA For not wanting to be super close to my sibling who has bullied me for years?			0	1
c7kkxw	2019-06-30 22:33:53	yeboi2dank	AITE for making my mother and my step'father' (very much probably, needs an update) breakup			0	1
c7kkoz	2019-06-30 22:33:13	cantheman6	WIBTA If I dared my best friend's sister?	"DATED. I MEANT DATED

Mobile post so bad formatting is likely.

Some backstory. Me and my friend have known each other since we were born. He is a month older than I am and he has a sister who is 3 years younger than us. I've known her since she was less than a year old. His family and mine have also been friends for generations since we live in the same building for our summer house. We have known each other for all this time but we only really see each other for a month or so ever summer. My friends mother used to crush on my father back when they were younger as well but my dad never reciprocated feelings as he was best friend's with her brother as well. The whole situation is so similar it's genuinely scary.

Anyway this summer I can sense that my friends sister, let's call her Sarah, is clearly interested me. Now my friendship with my friend is much more important than a summer fling that in no way would last any longer than a month or so until I go back to college but I still don't know what to do. She constantly tries to show some affection and I can tell it is making my friend uncomfortable and my dad even noticed and pointed out the similarities in the whole situation but he ended that conversation saying that I would know how to handle it but I really don't which is why I'm here. Sarah used to be super annoying and I generally ignored her in the past and pushed her away as did her own brother. She has really had a glow up though and has changed her personality completely. I know that if this went any further that I would be in some deep shit with my best friend and it might be the end for us. Just to clarify if I did end up in a relationship with Sarah, this wouldn't involve any sex as that might be a bit too far. My main issue besides my friend taking it badly is that I also see Sarah as somewhat of a sister and I'm afraid it might be a bit weird considering I have known her since she was literally born, albeit I was 3 at the time. 

I know that I WBTA if I went ahead with Sarah but I have no idea how I can decline her without hurting her feelings. I just feel like this situation is gonna end with one of them being hurt by my actions and I fail to see a situation in which everyone is happy.

For context, me and my friend are both 21M, Sarah is 18F."	Not the A-hole	0	0
c7kjn5	2019-06-30 22:30:30	ragetrashermama	AITA for making my son dress differently because he was being imature			0	1
c7kjmq	2019-06-30 22:30:28	NextLevelDan	WIBTA if I told my girlfriend that she wears too much makeup sometimes?			0	1
c7kj1l	2019-06-30 22:28:57	Korcarz	AITA For ghosting my crush ?	"I have a crush on a girl in my collage, we know each other for about a year and about 2 weeks ago I told her how I fell and she told me the nicest way possible that she didn't fell the same, I accepted it and we continued as friends, but my fellings obviously didn't just vanished and she knew I still liked her, yesterday we were talking about her mom and I told her as a joke ""Say hello to my mother-in-law"", I expected she just to change the subject or laugh it away, but she said ""not even as a joke"", after I told her she didn't needed to say it like that she said ""nothing to declare"", after that I said, ""ok, nothing do declare either"" and started to ignore her in every way possible, and now she wants to reconnect pretending it never happened, but that did hurt and everything, and I'm not sure I want to get back in contact, because the more we talk more I fell about her, and she obviously doesn't want anything but AITA for ghosting her ?

Edit: We know each other very well and we have a different sense of humor so I don't think she was uncomfortable with the ""mother-in-law"" part"	Asshole	0	0
c7kixl	2019-06-30 22:28:38	itsalive420	AITA for calling a woman 'dude'?	"Gonna keep this short as it just happened about 45 minutes ago. It's Canada day tomorrow so we're having a party that will go until midnight or so because we're a bit older here and want to be able to hang with our families tomorrow.

I'll call friend 'Sally' and her girlfriend 'Mandy'

I started my party at my house about 3 hours before all of this went down. It was very much a ""invite your SOs and we'll have some beers"" sort of thing. So I got the BBQ started, grabbed a few pints for some people that were showing up and started to loosen up a bit. My friend whom I have known for the last 15 years shows up with her new girlfriend after about an hour and a half from when I started the party. There's about 15-20 people over now, drinks are flowing and BBQ is being eaten. I saw Sally and said hi like I usually do ""what's up dude, how's life?"" and she told me how they came back from some trip last week and it was cool and all that. She introduced me to her girlfriend and this is where it gets a little weird.

I say ""hey what's up dude?"" to Mandy very casually and she gives me a weird look and says ""...I'm not a *dude*"". So I quickly apologized and just said I call everyone that, even my wife. Sure enough 2 seconds later as if it was a sign, my wife comes over and says to me ""hey dude we need some more hot dogs"" and she quickly introduced herself and left. I turned to Mandy and again quickly apologized and told her I was sorry if it came across weird and that I hope I didn't hurt her feelings(this was heartfelt, it could not have come across as bitchy or as a jab I assure you) then I made myself scarce. I find out about 25 minutes later that she's telling anyone who will listen that I'm misidentifying her and not making her feel welcome by misgendering her. I walked up to her and told her it was not my intention to make her feel unwelcome, I apologized and explained I just call everyone dude and that it wasn't personal but then right after that Sally comes over and starts telling me what her girlfriend told everyone else and that she agrees with Mandy.

ONCE AGAIN I apologized and Sally and Mandy left in a huff leaving me flabbergasted and having about half my guests come to me and tell me she was overreacting and the other half agreeing with Mandy. About 1/4th of my guests have left my party already so this is very upsetting to me. 

She made her feelings very clear on what I said, I quickly apologized and explained it was not my intention to not make her feel welcome and I'm sorry if I hurt her feelings. I hoped we could just enjoy the night after but to be honest I think she overreacted and it really messed up my party because now the mood is down and I am missing about 6 or 7 people who showed up earlier. 50% agree with me and 50% don't so AITA?"	Not the A-hole	0	0
c7kilb	2019-06-30 22:27:50	Cocoachan12	AITA for staring at a wall during a date?	"I (19F) went out on a dinner date with a guy (24M). I’m pretty inexperienced when it comes to dating, so I was pretty nervous. While we were waiting for our food, the conversation between the two of us fell flat and I couldn’t think of any other topics to bring up.

I was always taught that it’s rude to just stare at someone without reason, so my eyes kind of just directed themselves towards the wall adjacent to our table during this period of awkward silence. It’s important to note that he didn’t try to start up a new conversation, either.

Then he told me, “You seem to be really interested in that wall...” with an annoyed tone. He seemed to be upset that I wasn’t talking to him but luckily, our food arrived and I began talking about the food, I guess.

When we were finishing up, the restaurant got louder and louder (it was a bar restaurant) and I couldn’t hear what he was saying. So I repeatedly asked, “What?” In a relatively loud voice and he sighed and told me that I was being annoying.

AITA? Is it my responsibility to plan some conversation topics before a date? And should I practice a softer voice?"	No A-holes here	0	0
c7kiem	2019-06-30 22:27:22		AITA for not doing what SIL wants?			0	1
c7khw1	2019-06-30 22:25:53	Talrand01	AITA for jabbing at a friend's insecurity because he wouldn't listen to me?	"So I have a friend that I play videogames with frequently. He's not bad at the games, but he does lose often. And when he does, he'll ask for a handicap. In Smash or any other fighting game for example, he'll throw his controller when he loses and get personally mad whenever anyone calls him out for being immature.

We were playing an open world game today, and I find out he's been cheating his way to the endgame and leaving us in the dust. I calmly say I don't want to play with someone cheating and leave. He texts me and gets extremely angry, saying I'm a righteous asshole for not wanting to play with him, and ignoring his offers to cut it out (because I was busy telling him why I'm not a fan of it). He begins to throw a pity party and says he wants to just play god and watch other people have a good time.

Because he was insistent on defending his cheating, I tell him that ""Cheating is bad. I think you'd learn that by now."" He cheated on his girlfriend a few months ago and it cost him his relationship. He called me a bad friend for bringing it up, and while I regret saying it, I truly believe it was the only way to cram it into his thick skull."	Not the A-hole	0	0
c7khv0	2019-06-30 22:25:48		AITA for not wanting to remain good friends anymore?			0	1
c7khmx	2019-06-30 22:25:12		Am I the asshole for expecting a even a tiny bit of responsibility from my housemate?			0	1
c7kh1q	2019-06-30 22:23:48	yeboi2dank	AITA for causing my mom and step'father' to (very much probably) break up			0	1
c7kgbg	2019-06-30 22:21:53		AITA for not letting an old man have my seat?	"This literally just happened a few hours ago and I'm typing this on my phone so apologies for any typos and grammatical errors. 

So I work at the mall and since today is the day before Canada Day, the mall is super busy. The mall is closed on Canada Day so people want to get their shopping done today. After working for 4 hours, I start my break and immediately leave the store I work in to find a place to sit and relax. I find a seat near one of the mall entrances and just chill while listening to music through my earphones. After about 5 minutes, an old man comes up to me and taps me on the shoulder and tells me that he wants to rest. At first I was confused and then I realized he wants me to give him my seat. I tell him I'm on break and that he can find somewhere else to sit since I'm tired as well. He gives me a mean look and leaves but other people were staring at me as well. I know that it's courteous to offer seniors a seat but he was kind of rude about it. Should I have just given him my seat?"		1	0
c7kfw3	2019-06-30 22:20:42	DakaKubu	AITA for commenting on a girl's order at a restaurant?	"Was out to eat with some friends at this local bar/grill type deal. There were a bunch of girls sitting at the table next to ours. The waitress came over to their table and handed this one skinny girl two large burgers, a bowl of soup, baked potato, and some ribs. I looked over my shoulder and jokingly said ""are you sure you dont need help finishing that?"" She didn't think it was funny and she started to cry. And I was like ""dude, I'm sorry it was just a joke."" I guess it only upset her more so they asked to change tables and all of my friends thought I was being an idiot. I was just making a joke AITA?"	Asshole	0	0
c7kfrf	2019-06-30 22:20:26	peeeps__	AITA for asking my husband to stay home	"So, I(22M) have lung cancer. I was diagnosed few months ago, and it’s been continuous “I told you so, you should’ve quit smoking” from everyone I know since that. Especially my husband (26) because of that we don’t have the best relationship right now, we’re both really stressed. 

It was his sister’s birthday and he planned to go. I was totally fine with it, but that night I was feeling really ill, he was already getting dressed, I asked him to stay, he was clearly extremely irritated but he still stayed, but I felt really guilty."	No A-holes here	0	0
c7kfal	2019-06-30 22:19:15	Throwagay12344	WIBTA if I reported a person for using her dead kid's account?	"I'm an avid player of a phone game which involves playing/interacting with other people. The rules of the game point out that you should not share accounts or multiaccount, and it is generally frowned upon even if not unheard of for people to multiaccount or help out their family members.

There's one lady whose kid liked playing the game. Said kid died over a year ago. Lady continues using kid's account even today - directly affecting other peoples' gameplaying. She doesn't hide it at all. If it were her using the account on special occasions (like kid's birthday) or if she was just completing a project or two in honor of dead kid, I would let it slip... but she just full-out uses it to gain advantages on the game. And whenever someone new to the scene asks about it, they'll get shunned because ""omg she's grieving, let her be"".

At this point I see it as her plainly cheating in the game and using dead kid as an excuse, because it has been so long. I feel like one year is plenty of time to wrap up loose projects. However, I don't have kids so I'm probably biased and cannot ever understand her point of view.

So: WIBTA if I reported her?

Edit: Additional info. Lady has her own account so she's using both accounts at the same time. Also, this game is socially interactive i.e. what lady does will affect my and others' gameplay.

Tl;dr lady uses dead kid's account for over a year to do what I view/rules state as cheating on phone game. WIBTA for reporting?"	Asshole	0	0
c7kf6c	2019-06-30 22:18:55	epsilon025	AITA for wanting to skip the graduation party I don't want?	"So, my parents have decided to throw me a graduation party for finishing high school.

The thing is, I don't want to have the party. My parents asked the band I'm in to perform, and are expecting me to have fun. The big issue is, there's no good reason for this party to exist. I was raised to seriously not care much about societal rituals (never went to church, communion, got to leave a wedding early {for a marching band festival I had to go for being a leader} with the bride and groom's consent). But apparently, not wanting a party is an asshole thing to do?

I don't want the money and gifts from people, and don't want to waste a day that I could be working or doing something useful.

I didn't have to go to prom, which I didn't care about anyways (the pressure to attend was from my friends and their parents), and didn't go to any dances, again because I didn't care/didn't want to.

So, am I the asshole? I expressed not wanting one for years, and also expressed the fact that I'm not a social person at all, but my parents still expect me to have fun and enjoy the party."	Not the A-hole	0	0
c7kf5f	2019-06-30 22:18:51	clairebear20	AITA for telling my neighbours that I'd beat the shit out of their cat?			0	1
c7keyi	2019-06-30 22:18:26	MuchGiraffe	WIBTA if I cut ties with an old friend	"Apologies if formatting is rough. I’m on mobile.

Background: We have been friends for 8 years and supported each other in school. We’re 22 & 23

Recently he went through a bad breakup and turned to alcohol. He drinks every day and it ruining his life. His parents have kicked him out the house and he sometimes sleeps rough when he doesn’t want to crash on a friend’s sofa. 

My boyfriend was moving out the city and asked all my friends to come for some drinks in a bar to say goodbye to them all. My friend showed up with his jaw in a different zip code from whatever drugs he had taken before showing up. Despite this, we had a good night and it was nice to see him. He made multiple comments about knowing he’s an alcoholic but when we mentioned options to him such as AA he shrugged it off and said that it’s his choice to drink and we can’t do anything.

We left him that night in a club with one of his friends who we bumped into and went home at about 3am as I work an office job and needed to go home.

I woke up that morning and sent him a message saying I was worried about him and how self aware he was of his situation but him not caring. 

He replied two hours later saying he just woke up in London (we live a 6 hour drive or 2 hour train ride from there) with no memory of how he got there and how he was worried he wouldn’t get home for work and would get fired because he didn’t have enough money to get home. 

I looked up train times, found the cheapest train that would get him home and rang him to say I would buy the ticket and email it to him. He just laughed at me, told me he wouldn’t take it and to stop trying to act like his mum (who he hates). I got frustrated and told him he needed to start taking responsibility for his actions and to take the ticket, come back home and go to work so he wouldn’t get fired. He laughed, said he found a bike that’s unlocked and took it then was just cycling around London on the phone to me while I told him he can’t just act this way. It ended with me telling him that if he wanted to ticket to call me back but i couldn’t spend anymore time trying to convince him as I was at work. He was extremely rude and told me to fuck off.

I went back to work. I didn’t check my phone again for a few hours as I had already wasted 45 minutes on the phone but it was on loud and no calls came through. When I next checked I had texts saying ‘please don’t be mad at me, you’re my rock’, ‘I’m sorry I upset you’, ‘please say something, even if you are angry’ and ‘fine, be like this. I’m done trying.’

Another friend of mine text me saying he got the train home and went to work. 

I can’t help someone who isn’t willing to help themselves but I also fully understand why he acts this way. I feel like I’d be failing him if I cut ties but he’s changed from his alcohol consumption and is consistently rude and it’s starting to affect me.

WIBTA if I cut him out my life?"	Not the A-hole	0	0
c7keeg	2019-06-30 22:17:02	Shawn_Spenstar	AITA for refusing to say grace at a family dinner?	So for a little backstory I'm 32 I've been atheist since I was about 12 and have despised organized religion for about as long. My family besides me are all Christian's with my grandma being a very religious Christian woman. So every other week or so me, my brother, my sister and her husband and kids, my grandma and uncle all go over to my parents house for a family dinner. Before dinner my grandma always makes a big deal of saying grace, I sit their quitly and respectfully but don't say grace along with them. At the last dinner my grandma pulled me aside and asked me to say grace with them because my nephew's see me sitting there not saying grace and then according to her think it's cool not to say grace. I told her respectfully that I won't say grace, if my sister wants to raise her boys Christian that is absolutely her choice and I won't say anything negative about their religion around them but I'm also not going to help indoctrinate my nephew's into a religion I despise. Que grandma tearing up and my family saying I'm an asshole why can't I just say grace etc. Now imo I did nothing wrong, they have their beliefs I don't agree with them but I respect them and their right to have them. If the shoe was on the other foot and I invited them to a dinner at my house I would never ask my grandma not to say grace so I am I the asshole here?	Not the A-hole	0	0
c7kdoz	2019-06-30 22:15:14		WIBTA for telling my girlfriend that she wears too much makeup sometimes?			0	1
c7kdeg	2019-06-30 22:14:32		WIBTA if I just called the cops on my pot-smoking neighbors, without taking any other steps toward getting them to stop making my AC unit unusable?	"I have always been pretty chill with weed use and such and really don’t mind being around it at party’s or when in outside, but 3 weeks ago some new residents moved into the apartment next door to the one I am squatting at and literally every time it turn on the AC (Texas summer, AC should be a human right down here) I literally just smell weed. Out apartment’s AC vents are connected so it comes in that way, but also they have taken to smoking right next to the intake vent too. It has gotten to the point where I just avoid going home or having guests over because the apartment is so pungent.

I would just tell them to please stop, but I am a girl in her early 20s who lives alone right now  and has had reason not to trust men in the past, and they are 3 men in their late 20s. So that is def not going to happen.

I also don’t think I can go to the apartment office and report them because I’m a squatter. I’m just staying in the apartment for a few months while my friend and her roommates are elsewhere for the summer. So I’m not on the lease, and my living here technically violates the lease because there is some rule about number of occupants or something so I don’t think I can go to management.

Which I feel like only leaves me with me tipping the cops. Problem is though that I don’t really think the cops would care about something like this, and also I feel like I would be an asshole for doing it because it’s only pot, and I’m not even supposed to be living here right now and I’ve smoked in my time too so it’s not even like I would be calling for something I’m innocent of? I would just be calling because its really starting to piss me off which I don’t think is a good enough reason to get law enforcement involved."	Asshole	1	0
c7kd5d	2019-06-30 22:13:56	stayzer0	AITA, or we, for not doing was SIL wants?			0	1
c7kb1p	2019-06-30 22:08:45		AITA: I don't know if I can forgive my parents			0	1
