id	created_ts	author	title	body	flair	was_deleted	was_removed
c7e611	2019-06-30 13:51:20	kappakingdon	AITA: Not going to Temple with parents	"Hi I’m 20 years old so I’ve started and am going through the phases of making adamant decisions about what I believe in and follow.

My parents are Hindu and although are not adamantly devoted to the religion, tend to go to the temple sometimes to pray to gods, etc. I have made it quite clear to them that I am non religious and they respect my boundaries and my decisions.

However today when my parents asked me to come to the temple with them, I politely declined and informed my mother that I am non religious and wouldn’t want to ruin their time. By all means I am not anti-Hindu or anything, I just have no attachment to the religion.
 My mom seemed a little distressed upon my declining and my parents went without me, but I have this guilt eating away at me.

AITA?"	No A-holes here	0	0
c7e4ch	2019-06-30 13:48:41	CocaineIsMyGame	AITA For not wanting to hang out with my cousin?	"Alright I usually hang out with my cousin when she doesn’t have school to go so we usually go outside to chill and walk around. I don’t mind doing that with her but she tends to get loud and act like she doesn’t have any self control. There were a few times she had rudely told someone to stop looking at her. (She’s 16 btw.)  I have told her multiple times to at least to be a little quiet because when she gets loud, people stare at us with judging faces and honestly it makes me feel embarrassed about hanging out with her.  I know at that age, some kids don’t have any filter when they talk/act but I just wish she take in some consideration to how I feel when I’m outside with her.

Update: she tried to rob the store that’s around me. Saying that I won’t get in because she’s stealing. But me being with her will make it seem like I’m stealing too. I told her that I don’t want her to do that because I don’t want to ban from this store because of something she did. She won’t care if she if she gets banned because she live on the other side of the city but for me. I’m trying to teach her to do good things so she won’t have to deal with her mom getting at her ass for the dumb stuff she do. I honestly feel bad if I cut contacts with her because it doesn’t seem like she’s gonna ever think about my concerns about her and her wellbeing."	Not the A-hole	0	0
c7dyya	2019-06-30 13:39:34	peachcobblerxx	AITA I asked a random lady and her child to get out of the last mobility scooter that I really needed?			0	1
c7dywv	2019-06-30 13:39:31	UnwantedHairCut	AITA for being mad that, without asking, my mum cut my daughter's hair. It was her first ever hair cut.	"We dropped her off as my mum baby sits every other Sunday night, which is something we are really grateful for.

We had a conversation about how her hair is a bit long in the front, but my wife has picked out a nice hair dressers for her first haircut.

When I got home my mum just texted me saying that she's ""lopped the ends of her fringe"", ""hope you're not mad"". As soon as I seemed shocked and a bit upset about it, she's gone very defensive and said it's not a big deal.

She's taken an inch of her fringe and basically chosen the hairstyle for our daughter. Not the one we give her.

Her reason for cutting it was that is was driving her (my mum) mad. My daughter's hair did need cutting, but it wasn't horrendous or anything. We just clip her hair (edit: a hair-clip, we don't cut it. Sorry!) if it looks like it's bothering her.

AITA?

&#x200B;

EDIT: Thank you everyone for the feedback. I feel more sad than I do angry. The last message my mum sent me was ""you should have done it"". Boo-urns :("	Not the A-hole	0	0
c7dxom	2019-06-30 13:37:42		AITA if I strangle my cat to death			0	1
c7dxl2	2019-06-30 13:37:34		AITA arguement with long distance girlfriend	"So I have a long distance girlfriend. She lives in Japan and I live in Korea. She told me she will come to my home country in Australia next year in July. Korea isn't an option for her and neither is Japan for me. I told her that's too long and asked if she would consider coming earlier since we won't be able to see each other AT ALL for at least half a year due to her work circumstances. She can only take off 3 days in a row cumulatively so even if I visit her we'll likely not be able to meet much.

She knows that I had a similar past long distance experience that didn't work out and I got dumped after waiting for about 6 months which is why I'm nervous about this. It's her first long distance relationship. 

She told me that she really values her current job and wants to get at least 1 more years work experience before moving and at the earliest she would come in March. She is getting a promotion in August, one that she has been looking forward to for 2 years now. I got upset with her on the phone before when she told me this and let out a huge sigh and kind of abruptly hung up. I felt like she values her job over being together. Even though I'm a little hypocritical because I can't go work in Japan. Although Australia is the best place for the future as we have both agreed and she even said she would rather have children in a western country. I feel like I can't plan my life going back because I don't exactly know when she will come and the fact that we won't see each other for so long. 

Am I the asshole here? Should I just acknowledge that this job is valuable to her and just wait for her to finish it before coming?"	No A-holes here	1	0
c7dv23	2019-06-30 13:33:18	Eruliaq	AITA for not talking with my brother?			0	1
c7duby	2019-06-30 13:31:57	tzholl	WIBTA if I refuse to pay	"I live in a house with a roommate let’s call her June. With the seasonal change in temperature and increase of humidity, (and just change of housing due to unreconcilable difference with the landlord) our house has got a minor mold problem. 


Now, June and I live in a cement house that has a metal roof. Previously I lived in a grass house during the last winter and have never experienced this before.  This past week, June has found mold growing on her backpacks and walls.  She has pointed out some mold near my baseboards. To my knowledge we are not experiencing any negative effects with coexisting with this mold. But she has started a warpath to kill it. Including using dangerous essential oils without notification or consideration for our dog despite my warnings about using EO in the close proximity of animals. 

Key info: 
-volunteers with very limited salary
- I have only three months left of my contract and will be moving
-June has an additional year.
-I have no significant mold growing around my room.
-Idc about mold
-I believe if she asked our bosses they would consider this a home expense and reimburse her for most costs
-I told her multiple times just use bleach and water let it air dry, ventilate properly. Yet she has bought gallons and vinegar and used EO to try and get rid of the problem
-she asked me to buy an item for her (mold related) while I was in our market Town and I did. I wrote this down as a cost on expense sheet, yet still ended up paying for it


Now, just today, she has arrived home with stuff for a DIY dehumidifier. This would go into her room.  And I’m already dreading and anxious about having to explain that I don’t want to pay for such things when we tally up the monthly expenses (we split household items such as rice, soap, etc)  I will be more than honest to say that there have been times where we have not seen eye to eye. I can be an insane grudge holder. 

I may just be jaded since I preform a lot more  work w our dog including waking up, feeding vaccines, carrying heavy dog food once a month for two miles, etc.  this is something we have talked about and she is working on. I do not want to let this part of our lives interfere and cause me to act like an ass. But in other aspects has shown real improvement in effort with the bush dog baby. 

Please help me. Would I be the asshole if I refused to split these costs with her? 

Best case I just wait out the only cold month left and tell her to ask our bosses for reimbursement, next best case I pay for bleach for my room and common room. Worst case I’m the asshole and I’m dumping tons of money into this shithole we rent. 

(No my LL will not remedy this situation this is a third world country lol.. and yes this may seem petty in a sense and make me an asshole but when your monthly budget is $80 USD every single dollar counts as I believe she has already spent well over $15 USD)

And June if you see this sorry just tryin not to be an ass"	Not the A-hole	0	0
c7dti7	2019-06-30 13:30:27	thejohnnygrey_666	AITA for telling a guy of because he accused me of being hypocritical about my sexual identity?	"I am 25 male in a relationship with a great guy been together for 7 years. Now I do not really relate to the popular gay culture. I do not enjoy things like cross-dressing, I am not feminine and do not wear what you call flamboyant outfits. But if being gay simply means a person who engages in sexual activities with people of the same sex, then I am gay.

Now my bf is the opposite of me. He enjoys cross-dressing once in a while and is a little feminine. But we love each other the way we are so no problems there. 
He also has this circle of close gay friends who love to hang out together like once a week. Last week was my bf's birthday and he decided to invite these friends over for a little celebration at our apartment. 

One of these friends, Jake (not his real name) has been living abroad for a few years and was back in town so I do not really know him. He is a very outspoken and somewhat cynical guy. When my bf introduced me to him, he started bombarding me with a lot of questions about every aspect of my sexuality, which kind of made me feel uncomfortable.

He then asked why he had never seen me before, and my bf, bless his heart, told him that was because I never went to gay bars or places where gay people love to hang out. He then asked me why I, a gay man, do not associate myself with other gay men, so I told him, first I just don't really like being labelled as to allow everyone to define what I am or am not. Second,  I prefer keeping my private life private. 

He then said ""There is no such thing as a gay man living his life like a straight man. If you're gay, you're gay. You can't just walk around and give people the impression that you're straight while you still have a dick in your mouth every night in your bedroom. You're just living a lie.""

That really rubbed me the wrong way because I sensed it that he was calling me a hypocrite. So I told him that what I am or choose to be is none of his business. My sexual preference is merely a part of my self-identity. And I am in control of it in accordance with how I live my life. Not the other way around. If having a dick in my mouth means I am gay,  then I am gay indeed. But not because I identify with what most people and some gay people think is appropriately gay.""

He wouldn't shut up about it and kept pestering me until I completely lost my shit and told him that if he is gay and proud then ""what are you doing in the house of a person like myself?""
He looked really offended and then left immediately. My bf thought I was being a little too harsh. Am I the Asshole?

EDIT : Now all of my bf's friends also think I am hypocritical based on their late night WA conversation, and I told bf that I don't give a shit about what they think but he said he gives a shit because it's between his good friends and me, the love of his life, and suggests that I be the bigger person and apologize for 'kicking him out'.  I, of course, said NO!

EDIT 2 : Thanks for one of you here who DMed me and accused me of posting a validation thread. This might sound like it is but believe me, a tiny itsy bitsy part of me is indeed feeling guilty because it was my bf's birthday and things were awkward after that one friend left, which completely ruined everyone's mood to celebrate more. So yeah I basically ruined my bf's birthday party.
Grammar.

EDIT 3 : Thanks to one of the commentators here who pointed it out to me that maybe bf's friends are just being jealous and upset that I somehow have influenced in him toning his gayness down a bit in recent years. He used to be more feminine and flamboyant but since we started dating I talked him into keeping it down a little. Not because I was ashamed of him, but because not everyone is as open as others when it comes to what is being perceived as 'normal'. I am from a small town where the people are so religious and not as accepting as those in bigger cities.

EDIT 4 : To everyone who does not understand. People here are crazily religious and homosexuality is not openly and widely accepted. Being gay means you are more prone to violence and denial of public privileges. I asked my bf to TONE IT DOWN for his own safety. I DID NOT force him to CHANGE HOW HE WAS. I love him and want to save him from harm and rejection because that's how it is living in this country as a gay person. And he understood my intention. He is openly gay and now knows better than to act 'all gay' in public places, which is my point actually.

EDIT 5 : To those who call me a homophobic gay guy it's okay. But at the end of the day I know and I get to decide what I am. Because I am the only one who understands me. My bf understood my well-meaning intention and is not making such a big fuss about it like some here. He knows exactly I love him and care about him. If he felt that I am forcing him to change himself or live a lie, or oppressing his freedom of expressing himself as a gay man, then he would have left me years ago.  We're still together and love each other and it's all that matters."	Not the A-hole	0	0
c7dthk	2019-06-30 13:30:25		AITA for not wanting to go on my dad's fishing camp?	"First I apologize for my English, but since I'm very conflicted and only downloaded Reddit to make this post, I hope you can bear with me. Also sorry for the formatting, I'm on mobile. 

So, my dad's a fisher. It's not only a hobby, he loves it so much he's the organizer of an annual fishing camp.
Many kids from ages ~7-16 sign up and go to a different location to fish every day for a week, get their food and sweets here as well, sleep in a tent, have to wake up early and have very limited access to electronics. They can also do the test to get a fishing license and they're teached the material beforehand. 
You can tell by these rules that only kids who really love fishing would want to stay there.

My mom doesn't fish, but she helps in the camp by working in the kitchen or helping kids who hurt themselves or want to go home. (she's basically the substitute mom here)

Now me (13) and my sister (11) go to this camp every year (I'm actually there in the moment of writing this) and we HATE it.

Here are our reasons:
× We both aren't very fond of fishing and are pretty bad at it.
× Almost all of the kids here are boys and they aren't really open to making friends with us.
× Also, we don't know anybody here.
× We forget all the important things every year (since we don't go fishing at any other time of the year) and are basically beginners even though we  have been going here for years. We also kinda get made fun of for that. 
× Because we are the children of the boss and the substitute mom, we have this ""entitled"" stigma which makes the others even less motivated to befriend us (and we both are pretty shy and introverted).

So yeah, we aren't here voluntarily.
Of course, we tried telling our parents that we despise going to the camp"		1	0
c7dssu	2019-06-30 13:29:27		IATA for being mad that, without asking, my mum cut my daughter's hair. It was her first ever hair cut.			0	1
c7ds51	2019-06-30 13:28:26		I’m having a mental dilemma. AITA for laughing almost uncontrollably at this?			0	1
c7dr4s	2019-06-30 13:26:45		Disagreement with long distance girlfriend			0	1
c7dqyu	2019-06-30 13:26:28		My broke boyfriend water-damaged my phone. AITA if I make him fix it?			0	1
c7dq18	2019-06-30 13:24:47	iwasplannedithink	AITA for not wanting to leave my house 2 hours before i planned to ?	"A little backstory: me and my boyfriend have been together for a little over 2 years. when my grandmother passed , i got her car so i would drive us both around. we have a baby boy (3mo) together , so clearly i need to(and do) sleep a LOT. recently he got himself a new car bc.. well, he needed a car lmao.

the car is a few years old and you have to manually shut the headlights on and off. a few nights ago he accidentally left them on and drained the battery. he got a jump , it’s working fine , no biggie. he was going to the dealership today so they can replace the battery.

i work at 12:30 . he texts me at around 7 to ask me for jumper cables , which i do have . we talk a little , then he asked me for the jump . he goes “i don’t want it rn bc once i get it , i cant stop until i get there and it opens at 11.”

Me: “i wasn’t leaving my house anyway.”
Him:”that’s why you’re leaving at 9.” 
Me:”no. i’m not.”
Him:”aiight see you then :)”

i rolled over and went back to sleep .

literally a few minutes ago my boyfriend facetimes me asking where i am. i groggily but casually said i was sleeping . he starts to get upset and argues that he cant go back inside bc they’re getting something removed from the house and cant go back in for a few hours . i argue back that i was leaving when i left for work (around 10:45 , 11) but eventually i said fuck it and just said

Me: FINE FUCK IT IM COMING
Him: nah don’t worry bout it (something something i wasn’t really listening bc i was half asleep) *hangs up*

we live a few neighborhoods apart , his bestfriend is right between us . why not call her ? why not plan ahead and ask me “hey if the car goes out tomorrow , can you wake up a lil earlier to give me a jump?”

i’m leavin to go down there in a little but

AITA for not jumping up as SOON as he wanted/planned?

TLDR; boyfriends car needs a jump , wanted it specifically at 9(2 hours earlier than i planned to leave). i told him wait , he gets mad

EDIT: i felt bad bout earlier so i ended up apologizing :( waiting for a response"	No A-holes here	0	0
c7dn7u	2019-06-30 13:19:52	Wtfdodido1234	AITA for not calling my girlfriend			0	1
c7dmww	2019-06-30 13:19:29		AITA for bitching out of this wedding?	"So I'm a bridesmaid at a wedding 2,000 miles away. I've bought a dress, plane tickets, and was ready to go. 

I've known the Groom since high school, and the bride I've hung out with maybe a total of 4 times since they live 2,000 miles away. We always got along though, so they invited me to the wedding. I planned accordingly and invited a plus one so I wont be traveling alone.

Anyways, on the official wedding count email, I wasnt given the option to RSVP a plus one, most likely just an over sight. But I've brought up having a plus one multiple times during the wedding planning process. Then a couple days ago the bride messages me basically flipping out about the additional costs of my plus one, and now I'm responsible to pay $260 so she can attend with me. Then is sure to include that this is MY fault, and also cover her ass with a couple lies as well. 

Then while talking to the Maid of Honor, the more I realized that I'm going to be there to control the brides family, who I've never met, the bride is already being enough of a bitch where I have to kiss her ass, and I'll barely be able to see my actual friend, the groom.

I'm already dropping a couple hundred bucks to even get to the wedding, getting a hotel, helping fund the Bachorette party, and buying a God awful bridesmaids dress. So, would I be the asshole if I trade in my plane tickets and go literally anywhere else? 

I've spent a year saving money for this, and put in the effort just to get bitched at. I feel like if I'm gonna throw over a grand into a trip I should at least have a good time. 

I know its incredibly rude, but so is not offering basic accommodations to a Bridesmaid.
Also, i got no clear answer about whether there's even an open bar included with the $260 so what's even the fucking point?

So, am I the asshole?"	Everyone Sucks	1	0
c7dm6i	2019-06-30 13:18:19		Without asking, my mum cut my daughter's hair. It was her first ever hair cut. IATA for being mad?			0	1
c7dkzk	2019-06-30 13:16:18		AITA for being upset my partner has ignored me the entire weekend of a wedding?			0	1
c7djbn	2019-06-30 13:13:25	Noteuroa	AITA for being against my swimming pool being womens-only?			0	1
c7dj6s	2019-06-30 13:13:11	ququqachu	AITA for blaming my boyfriend for his flakiness and not “bad luck?”	"My boyfriend has missed a lot of events and dates that were important to me over the past couple of months. A few include:

-canceling my birthday dinner because he had a rough time at work and just wanted to cuddle at home 

-cancelling our anniversary dinner for the same reason and because he was worried about money

-dipping out of our RESCHEDULED anniversary celebrations because he had a headache 

-trying to back out of coming to a performance I worked on because he was so late (somehow managed to take 80 minutes to get from his work to the theatre, which for reference was about a 35 minute walk away, or 20 minutes in public transport). 

-canceling our plans to go to the pride parade because he had a stomach ache. 

-canceling several more casual dates because he didn’t feel like leaving the house 

If it was one or two instances of this, I would absolutely understand. I want to support my BF if he’s feeling sick or had a bad day. But it seems pretty much impossible to get him to go out; every time I manage to get him out of the house, we have a big fight about something stupid. When we stay home, no such issues. 

He keeps saying these things are out of his control; feeling sick or sad is not under his control. And I understand that, but it feels like he could still be making an effort to reschedule when he feels better, or at least be understanding about why I’m upset. Every time I bring the issue up and ask him to do better, he gets really defensive and refuses to admit that he has done anything wrong 

AITA for blaming him for being so flakey and wanting him to do better?

Edit: thanks for your comments everyone. I knew that we both struggle with depression sometimes, but honestly it had never even occurred to me that his cancelling would be because of it (especially since he seems perfectly content whenever we stay home, not depressive)."	Not the A-hole	0	0
c7dh0d	2019-06-30 13:09:24	playmorezeppelin	AITA for asking her to miss a football game?	"AITA? I’ve been dating my girlfriend for 6 months now and it’s been going great so far - I really feel like I’ve found the right person for me. But one thing that’s gotten to be a little overbearing is her absolute obsession with her college football team (I’ll leave the school out to avoid any bias).

Besides music, sports are what I live and breathe for. Just like her, I take a lot of pride in my team and consider myself more than just an average fan. But last night we got into an argument when I invited her to go visit my friend and his wife in September and she said she would have to check to see if there’s a home game that Saturday. I expressed my concern that she wouldn’t be willing to miss a single home game (there are 6 in a season) for something I wanted to do together and she got extremely upset and said I was being too controlling.

We’ve both been out of college for 5 years and her old campus isn’t even nearby... it’s in the next state. I totally understand being a die hard fan of your team because I am one. But at what point in your life should you prioritize that less than your relationship? She says going to those games is a tradition among her friends and they always went in high school and college. But my thing is, yeah so did everyone else who went to a major school. She definitely holds her fandom over my head as if I don’t understand (even though my team has 8 championships and hers only has 2 or 3, but they’ve been more recent - just sayin). I’m rambling a bit so I’ll just cut it off. But I’m seriously struggling here because we didn’t really resolve the argument that well and it’s still bothering me. I really want to know if I’m in the wrong."	Asshole	0	0
c7dgth	2019-06-30 13:09:07	PimpinPopRocks	I hate all weddings, especially this one			0	1
c7devk	2019-06-30 13:05:48		WIBTA to report my drive instructor to the tax authorities	"English isn’t my native language, sorry if my grammar is bad or I mix up words.


So I’m currently taking driving lessons for about 6/7 months now. I need my drivers licence because my mother is very ill and I have 3 brothers that need transport from time to time.
I bought a package for 30 lessons + the exams.
Funny thing I had to pay in cash, it was a lot of money I didn’t thought  much of it, Although this means he doesn’t pay taxes over what he gets paid(atleast that is how it works in my country) and he has ALOT of students.
I was fine with that w/e he’s done this for 13 years. But now I’ve used up my 30 lessons even bought 5/6 more but I need his approval to do my practical exam in order to get my drivers licence he was supposed to get a date for when that is happening. Since it’s so urgent for me to get my drivers licence this pisses me of and I’ve mention multliple times that I really need to finish up. He keeps coming up with bullshit reasons. And still no date as of yet.

WIBTA if I report him to the tax authorities after I FINALLY finish up my driver lessons and have my drivers licence?"	Asshole	1	0
