id	created_ts	author	title	body	flair	was_deleted	was_removed
c7nt0z	2019-07-01 03:57:47	sbtrey23	AITA for wanting to sleep in my bed when I’m my moms house even though I’ve moved out?	"So in August 2018, my fiancée and I bought our first house in South Carolina and each moved out of our parents house. In May or June of 2018 (while living at my mom’s house), I decided to finally upgrade to a full bed after sleeping in a twin for 24 years. The logic was that my fiancée and I were sick of squeezing into a twin. At first I thought it was a waste because I knew we were looking for a house but her logic was we are still going to visit and when we do, it’ll be nice to sleep in a full instead of a twin. 

So anyways, fast forward to this summer. I’m home because we are getting married in Vermont (I grew up in Massachusetts). But while home, my brother has taken my room and my bed. He says that I don’t get the bed because I moved out and have my own house. Also, he said technically it’s not my bed because he took my bed to school and the bed at home is a new one that my mom bought to replace it (my mom bought literally the exact same bed). My logic is that I specifically bought the bed to have a nice bed to sleep in when I came home so I should get to sleep in it. Instead, my mom is siding with my brother and relegating me to the day bed in the den. It’s not the worst but it’s the principle. And now, my fiancée doesn’t even want to visit and stay over because a) the den doesn’t have a door and b) we don’t fit comfortably at all in the day bed. 

So AITA for wanting to use the bed I bought despite the fact I’m a homeowner and live 16 hours away?"	Not the A-hole	0	0
c7nrxr	2019-07-01 03:54:26	a_little_violet	AITA for getting annoyed when people speak in another language in a predominately English speaking online group?	"So I'm a part of a little online community - a discord server, to be precise - of maybe about 30-40 people. I wouldn't say everyone there is friends necessarily, but we are all acquaintances at the least. A few people in the server speak Korean - including the person running the server - and from time to time in the middle of discussions they will either speak an entire sentence in Korean or just a couple of words in Korean to each other.

&#x200B;

Just to be clear, these are by no means private discussions between individuals, they are general discussions that oftentimes involve other people who don't know Korean. It's not that I have a problem with other languages besides English, it just bothers me because it kind of feels like I'm missing out on part of the conversation. But so far I've kept my opinion to myself and never complained about it to them.

&#x200B;

EDIT: I can see I'm in the wrong here - I'll try to be more understanding about it in the future. Thanks!"	Asshole	0	0
c7nra5	2019-07-01 03:52:26		AITA for not joining my mom to my cousin's dance recital/graduation			0	1
c7nqgi	2019-07-01 03:49:53	kaiiuchiha	WIBTA for taking a break from a friend who has little to no care about herself?	"My friend, we’ll call her laura, has been throwing up for 2 months straight. She doesn’t have health insurance, she isn’t very good with money because she’s financially irresponsible. I’ve had to cover a few of her hospital bills as it is but now she’s refusing to go to the hospital because she can’t afford it. So instead, she just drinks and parties constantly knowing she’s clearly sick with something. I’ve warned her that if she’s throwing up all the time she needs to not party/drink alcohol because it will only make it worse but she continues to do drugs (and by drugs i mean coke) and drink and then complain about how she’s sick. A few days ago I had enough and I sent the address to a few free clinics and she ignored it. At this point I just feel like I need a break because she’s clearly not going to listen to me but continue to complain and it’s annoying for me. 
The thing is, we’ve been friends for 10 years, so I feel like if i take a break from this friendship it’ll be a shit move because she’s not well and it’ll make me out to be an asshole but it’s something that’s just annoying and intolerable rn, PLUS she got dumped a few weeks ago so she’s going through that as well. 

So yeah would i be the asshole for taking maybe a 2 week break from her or should i just suck it up?"	Not the A-hole	0	0
c7npjx	2019-07-01 03:47:07	mydadabortedme	AITA for being pissed about girlfriends sister coming to stay at out apartment while we’re gone?	"So my girlfriend’s sixteen year old sister is coming to stay at me(21M) and GFs(21F) apartment while we are gone to house sit for GFs mother. I’m upset for a few different reason and GFs mom thinks I’m overreacting. 

1.	I didn’t even find out until a week ago. I wasn’t consulted at all by GFs mom on whether how I felt about it.  TBH I would have said sure if maybe someone talked to me about it. However my GF didn’t really get a discussion either, her mom just called her and said that she had bought tickets for her to come. I think that’s pretty unfair that we didn’t even get a choice especially for a place that we live at. 

2.	Sister and mom are getting upset that we aren’t letter sister use the car. First off sister is not on our insurance. Second her sister is very irresponsible with driving, she has had her license less than a year and has totaled two cars, has been in numerous wrecks, and constantly smokes weed and drives. This is due to GFs mom spoiling her (GFs family is pretty wealthy) and letting her kind of do whatever she wants without consequence. I don’t want anything happening to our car due to this past history of recklessness. Sister and Mom are getting really nasty about sister not being able to use the car. We live downtown in a major city and everything is within walking distance and we have decent public transport, but that’s not good enough the sister ***needs*** the car for some reason and it’s really wearing down on my GF and I. 

3.	She’s bringing her other teenage friend with her, and then together is a god damn nightmare. I get it I’m a young guy and I know what it’s like being 16 and wreaking havoc with your friend, we all do. BUT I know better than to trust two 16 year olds in my home. I’m afraid it will be trashed and no one will be held accountable for if anything goes really wrong. We also live in a small apartment complex that has mostly old people and is pretty quiet most nights, I don’t want to have to be responsible for two 16 year olds staying at my apartment and causing trouble. 

So AITA here? GFs mom and sister are really being an ass to me and GF saying that we shouldn’t worry despite us having adequate reason to worry. 

TL;DR found out a week ago GFs sister is coming to stay at our apartment while we are gone. I don’t like the idea especially because me and GF were never asked if it was ok. Mom is being an asshole in turn because of our apprehensiveness."	Not the A-hole	0	0
c7npji	2019-07-01 03:47:06	Acheron9114	AITA for inviting a good friend to social outings but telling her not to invite her husband?	"My friends and I are close. One friend recently got married to a guy I completely despise and all our other friends aren't really huge fans of. I was planning a social outing with the group and one friend asked if she could invite her husband and I said ""absolutely"" because everyone loves him. The other friend asked if she could bring hers and I said I really didn't want him there. The guy just sucks. He is boring, is no fun, and brings his wife, who is usually very fun/energetic, down. AITA for not wanting to socialize with him?"	Asshole	0	0
c7novl	2019-07-01 03:45:05	lenovosky	AITA if I don’t want my sister to put me down on her will as guardians of her kids if something happens to her and her husband?	"I have 3 kids of my own, 2.5 and 4yrs old and 6 months.

My sister and brother in law recently made a will and basically told my wife and I that we were put down as the guardians of their kids should anything happen to them.

Part of me feels selfish for feeling this way... about how this would impact my life and my lifestyle etc...

Also, all their kids are older than ours so it kind of takes away from our oldest getting to experience that role..."	Not the A-hole	0	0
c7nnlv	2019-07-01 03:41:20	PlatypusDream	AITA, insensitive, or just dark humor?	"When saying goodbye to customers *(leaving a liquor store)*, most of the time I just say goodnight, have a nice weekend, stay safe, etc.                 
Always with that customer service smile.             


Last night there was a customer who was using a power wheelchair.                     
To him, I said, ""good night, and don't drink and drive"".                   
He sort of looked at me (hard to read his face).                           
I said, ""OK, so it wasn't a very good joke.""               
He agreed.              


So... asshole or just inappropriate humor?"	Asshole	0	0
c7nnft	2019-07-01 03:40:48	tetristheme	AITA for being mad at my girlfriend for bringing up her ex and friend all the time?	"I’m sure the title already makes me seem like an asshole, but allow me to further explain.

My girlfriend and I have been dating for several months now, and our friend groups have sort of meshed together. One of the people in our friend group is a girl we’ll call Ellison. Ellison and my girlfriend have been friends for over a year, and are super close.

Before my girlfriend and I got together, she dated a guy who we’ll call Leo. My girlfriend broke up with him after almost a year because they never spent much time together and they were growing apart. She seemed to be completely over him once we started dating.

A couple weeks ago, Leo and Ellison started talking properly, and are now exclusive. Ellison already asked my girlfriend whether she was okay with it (not that she needed her permission), and my girlfriend said she was. 

However, my girlfriend recently started making comments about them such as, “Now she has to deal with *insert friend of Leo*” or “I’m interested to see how this turns out”. My girlfriend is normally a nice person, and I know she loves Ellison more than anything. But for the past week or so, she’s been making odd remarks about her and Leo.

It’s been starting to get on my nerves. I don’t want to seem like a crazy boyfriend, but why does she care so much about Ellison and Leo? She told me she’s completely fine with them being together, but the comments she’d made about them (mostly Leo) to me says otherwise. It’s starting to annoy me, and I don’t know what to say to her. I’ve started taking longer to reply to texts (we’re somewhat in a LDR) and sending back dry replies whenever she brings the two of them up.

Part of me thinks she’s looking out for Ellison, as any friend would, but another part of me thinks she’s not happy to see them together.

AITA for being mad at my girlfriend for constantly bringing them up?"	Not the A-hole	0	0
c7nnfp	2019-07-01 03:40:48	pixiehaze	"AITA for ""flashing"" my boobs while changing in my own room?"	"I have this window in my upstairs bedroom and I like having the curtains open all the time. It is a bit wide, and you can probably look into my room if you live opposite, especially at night. 

I often don't bother to close the curtains while changing my clothes - it takes a few seconds for me to chabge and usually I turn my back towards the window anyway. However, this woman living across me told me (in a polite, but ""fuck you"" manner) that it is indecent for me to flash her kids and family every time I change my clothes and my bra is exposed. 

My bedroom is my own personal space, so I'm wondering if I'm really being indecent here? AITA?

**Edit:**

since there's some confusion, here's a reply I made to a comment:

> Bra is the term she used, but of course I change  out my bra sometimes when I change clothes and I think she might also be implying that. But as I mentioned, if I take off everything, I usually turn my back towards the window. (Side boob not guaranteed)

Basically what she said was ""and sometimes we can even see your whole, you know,... bra... *(does a very big hand sweeping motion around her chest area)* top""

**Edit 2:**

in reply to u/prettybirdgrayson

As for what's gonna happen next, I'll see what can be done. I just didn't like being called, in her exact words, ""fairly indecent, I'm sure your parents will not feel happy if they know you're just showing people your body like that, honey"", when I am: 

(1) changing 10 feet away from my window in my room, 

(2) not walking around naked all the time (I don't think you can even see the lower half of my body through the window, and I have long hair so not even a full bare back). It's literally a few seconds of me changing.

(3) my room is not visible from the streets. honestly the only neighbor across me is her family and I can't see their room clearly as they have this veil net thingy, so I'm not sure if someone is there or not."	Not the A-hole	0	0
c7nnai	2019-07-01 03:40:20	marypants1977	AITA Dumped my lifelong best friend			0	1
c7nn5k	2019-07-01 03:39:57	infamousjelq	AITA For cutting off a close friend?	"TL;DR at bottom

Posting on a fresh account just to be safe. 

Anyway, A few years ago my close friend started dating this girl and they both got into hard drugs. She seemed to be a lot more reliant on them than he did but they effected him enough to where all of our other friends had picked up on the warning signs. He started treating us like shit, acting manic, and owed some of my friends money. 

The girl dumped him, he ended up moving away, got clean and rectified most of the relationships he had abused and taken for granted. After about a year and a half he moved back and though none of us said it (we should have made it clear) we were all under the impression that our rekindled friendship was based on the fact that he wasn’t going to use drugs. 

He got back into drinking and smoking weed which my friends and I thought was fine as long as he could handle it which he seemed to be able to do. Then he started dating the girl he got into hard drugs with again (who had also gotten clean but via suboxone) which all of our friend group supported despite being weary. They started taking psychedelics which worried us but some of my friends including myself would trip from time to time so we didn’t really think we had the moral high ground to say they couldn’t. 

As the months went on he would only be down to meet up and hang when it was convenient for him and get offended when we were busy or didn’t feel like meeting up and when we did hang I started to see the manic behavior resurfacing. Though this behavior worried me I let it go until one day he kind of explodes because me and another friend didn’t want to meet up exactly when he did and basically says he wants nothing to do with us and he’s going to save up money and move again. Despite him acting completely irrational and impulsive I invite him to a bar me and my friends were at the next day to which he ghosts me. 

About a week passes and he apologizes and wants to hang but at this point I’ve got confirmation his girlfriend has been giving him her suboxone to get fucked up on and I don’t want to be friends with someone who can’t control themselves around substances. It’s been about 2 weeks and he’s text me a couple times which I have ignored and I’m wondering if I’m the asshole for not accepting his apology and attempting to cut him off?

TL;DR: my friend dated a girl, got into hard drugs, fucked over his other friends and myself, moved away then moved back and is displaying similar behavior and after confirming he’s using his girlfriends suboxone and an irrational blow out with him I’ve stopped responding to him. AITA?"	Not the A-hole	0	0
c7nmcz	2019-07-01 03:37:30	Snuzzlezs	Aita for blowing up			0	1
c7nm39	2019-07-01 03:36:44		AITA for firing the nanny without talking to my wife about it?			0	1
c7nk72	2019-07-01 03:31:23		AITA for continuing about my normal life while my mother has cancer?			0	1
c7njmw	2019-07-01 03:29:43	marypants1977	Dumped my lifelong best friend			0	1
c7nijf	2019-07-01 03:26:41	TwoHighboy	AITA for pursing my learning over making time for my S/O			0	1
c7nic0	2019-07-01 03:26:08		AITA for firing the nanny without talking to my wife about it?			0	1
c7nhvc	2019-07-01 03:24:53	throwinaway7777	WIBTA if I directly asked my friend about the rumors regarding his sexuality?	"I’ll start by saying I’m fully prepared to be called TA here, which is why I haven’t done anything about it and am wondering if I even should.

So I, (18f) just heard from someone that my friend (19m) is apparently gay. This surprised me, seeing as we had been in a relationship about three years ago. However it’s actually pretty ironic considering I have since realized I’m a lesbian. 

Our hometown though is a small, solid-red rural little place in Buttfuck, Mississippi. I’m not saying it’d be physically dangerous if he was outed but that would explain why his tires were recently slashed tbh. It would also really damage his reputation and I’m not sure how well his extremely conservative family would take it.

All this to say that apparently said friend has no idea that people know of or are spreading rumors about his orientation. I kinda feel like he should be informed so he could take whatever measures he wishes to either publicly declare his identity or try to hide it for protection as I’m currently doing. 

I feel like it’d be assholish behavior to privately ask him if he is in fact gay. All I know is that if people had started gossiping about my sexuality I’d want to know so I could try and closet myself better, for lack of a more fitting term.

WIBTA if I did this, or should I mind my own business?


Edit: I’ve gotten some really great advice on how best to handle this with more tact and I agree that I shouldn’t just ask him outright. I’ll simply inform him of the rumors and let him know that I’m actually gay too so he can always talk to me if he wants to.

Edit 2: This just got a lot more convoluted. The person I’d heard the rumors from was asking me how I felt about him being gay. I was a bit confused by the question of course and responded by saying how bad I felt that he didn’t even know about the speculation.

That’s when my friend then stopped and told me that I couldn’t tell him anything. Apparently she wasn’t even supposed to tell me about the rumors. Now I’m even more torn than before because she doesn’t know what it’s like to have your life ruined by being forcefully outed or even publicly having your sexuality questioned.

I still want to tell him about the speculation but it’s just a bit more complicated to do now as supposedly no one’s supposed to mention anything to him about it. But damn that just sounds a bit stupid to me. I haven’t even gotten the chance to talk to him yet. WIBTA if I still did tactfully inform him his orientation was being talked about?"	No A-holes here	0	0
c7nhq1	2019-07-01 03:24:25	raindropsandrainbows	AITA for ignoring when a family member tells me to get involved in a fight they are having with someone else?	"This happens to me quite a bit so just wanted to know if I might be being an asshole. Say my uncle and Grandma are fighting about something petty, and I'm just chillin on the side trying to ignore it. Then say my uncle tells me to ""tell my grandma what the problem is"". I usually just ignore when they say that and try to remain neutral and let them finish their fight. I'm worried though what if my uncle starts thinking I'm not being supportive enough and helping him out? Am I an asshole here?"	Not the A-hole	0	0
c7nhag	2019-07-01 03:23:09		AITA for respecting my mother’s wishes?			0	1
c7ngzm	2019-07-01 03:22:21		WIBTA if I picked my neighbor’s lock to feed her kittens?	So I agreed to watched my neighbor’s 2 kittens while she went out of town (3 days). She gave me a key to their deadbolt, but forgot to give me the key for the doorknob. I went over this morning (the beginning of the 3 days) and could not get into the house. When I called my neighbor asking if there was a spare key or if I should call a locksmith her response was that she did not want to pay the money for a locksmith and that the kittens would “live” until she got home. This may be true, but it’s not right IMO. They will be forced to drink toilet water (if they can reach it) and have nothing food-wise. They do not have auto food or water dispensers. When my neighbor left, there was about a cup of food and a cup of water left for them. I can not afford to call a locksmith myself, otherwise I would. So, WIBTA if I picked the lock myself (potentially causing the lock to break)?		1	0
c7nf3l	2019-07-01 03:16:59		AITA for not giving my parents access to my streaming accounts?	"I work full-time and go to college, but my parents still help me out financially quite a bit—car and health insurance mostly, but not a small sum and definitely more than I could afford without a loan. It’s usually their treat when we get together and eat at a restaurant or anything, and they are generous people who have never let me want for anything. 

They have even offered on some occasions to pay my way so I wouldn’t have to work so much because they love me and want me to do well in school above all else. 

Since I moved out about a year ago, I’ve been trying to put a little distance between us because a big reason for my moving down the street was to gain a little independence before moving out of state for graduate school. A minor part of this was creating and paying for my own accounts on Netflix and Hulu and all that (I used to use their accounts). 

Well, my mom called the other day and wanted the password for my Hulu account since she couldn’t figure out how to log on to theirs. I lied and told her I couldn’t remember my password, in part because I use the same password for everything and didn’t want her to know it but also because I don’t want them to know what I’m watching or how much. 

I feel bad about lying and worse about not sharing this little thing with them since they have done *so* much for me, but really I like my privacy from them even if this is just a small part of it (the biggest part being not living with them). 

Anyway, AITA for being selfish with my accounts and other belongings?"		1	0
c7ndr5	2019-07-01 03:13:12	Esthoriet	AITA for not basically killing my cat?			0	1
c7ndeq	2019-07-01 03:12:14		WIBTA if I picked my neighbor’s lock to feed their dogs	So I agreed to watched my neighbor’s 2 kittens while they went out of town (3 days). They gave me a key to their deadbolt, but forgot to give me the key for the doorknob. I went over this morning (the beginning of the 3 days) and could not get into the house. When I called my neighbor asking if there was a spare key or if I should call a locksmith their response was that they did not want to pay the money for a locksmith and that the kittens would “live” until they got home. This may be true, but it’s not right IMO. They will be forced to drink toilet water (if they can reach it) and have nothing food-wise. They do not have auto food or water dispensers. When my neighbor left, there was about a cup of food and a cup of water left for them. I can not afford to call a locksmith myself, otherwise I would. So, WIBTA if I picked the lock myself (potentially causing the lock to break)?		1	0
c7nb47	2019-07-01 03:05:34	throwaway435234521	WIBTA for telling my wife no to being a SAHM?			0	1
c7nawt	2019-07-01 03:04:58	Acenderit	AITA for wanting the air on	"In case you didn't know, the air is basically an air conditioning unit for a house.

Edit: central air

It can get up towards the high 80s daily in the house I live in, with high 70s to low 80s at night. In nearly every window, there are fans running on high. The living room, kitchen, and dining room are in one open space.

There are also 5 dogs, 2 are mine, and 2 cats in the house. My room is usually hotter than the rest of the house and my 2 dogs are laying around on the ground. Bread items are usually out on the kitchen table/counter. Medicine that says store in 68-77 degrees are stored in the cabinet. The bathrooms are unbareable to enter as it feels so dry in there.

I should also say during the cold/winter months, the electricity bill is ~$200 lower than the hot/summer months and I don't pay myself. I will be willing to contribute towards the electricity bill if needed. AITA?

Edit: I should have specified it is my grandma who pays the electric bill monthly and she doesn't want to pay a ~$400 bill. That's why she doesn't want it on."	Not enough info	0	0
c7naoz	2019-07-01 03:04:24	PlatypusDream	Asshole, insensitive, or just dark humor?			0	1
