id	created_ts	author	title	body	flair	was_deleted	was_removed
c7hp22	2019-06-30 18:20:44	pax_et_veritas	AITA for telling my mom I can’t help with chores for my sisters wedding the week after my baby is born?	"So my family keeps asking me for favors in advance while I’m on maternity leave for the next couple of months starting in the next couple of weeks. For context, I’m in the US so unpaid maternity leave for up to 12 weeks. I’m lucky enough to get paid in full for one paycheck and partial payment for the next 3. Then after that it’s all just using up our savings which we don’t have a ton of so I expect to only have 8 weeks before I go back to work. I’m also a first time mom. 

My sister is getting married in September and I’m the MOH. I’ve planned and hosted her bachelorette weekend while 8 months pregnant and have been the bridesmaids liaison as far as organizing dresses and fittings and schedules. All while trying to prepare for our first borns birthday. 
My parents have agreed to come help out once the baby’s here but my mom keeps suggesting that she’s bringing my sisters wedding chores for me to help out with when I get out of the hospital. I’ve told her on several occasions (mostly off hand) that I’ll be pretty preoccupied with my newborn. It’s kind of been brushed off until today. 

My mom called and once again said she is bringing up wedding craft stuff for me to help with once the baby’s here. I’m currently 39 weeks pregnant and have no cares to give anymore. I told her straight up that I’m going to be too preoccupied with my baby. She then says “well when the baby’s sleeping you can help”. Seriously?! I said “when the baby’s sleeping, I also plan on trying to sleep. If the baby’s sleeping and I’m not, I’m going to be trying to catch up on house chores that I thought you were coming up to help me with. I didn’t realize you were coming up the week of my child’s birth to hold him while I do stuff for my sisters wedding.” She then acted like I was being ridiculous and started the guilt trip. I just told her bring stuff that needs to get done but I’m not making any promises that we’ll get to any of it. I told her I wish she would’ve given me some stuff to do now while the nursery is prepared and I’m literally just waiting for labor on my days off. I would have gladly taken something to do as a distraction from all the waiting. Still she tries to guilt trip and says both my grandparents are helping out. It’s just cutting out paper hearts so it’s not like a big project. Idk. AITA?

AITA for telling my mom no to helping out with my sisters wedding chores the week after my newborn arrives?

Edit: I also plan on breastfeeding so I can’t just pass the baby off when he’s hungry every 2 hours or so."	Not the A-hole	0	0
c7hoow	2019-06-30 18:19:56		WIBTA If i tell my sister she is a self-obsessed cunt and report her?	"TLDR. Sister is a bitch-I respond with the truth that she's a self-obsessed cunt and threaten to report her to the police for mental issues. 

So my sister and I are usually quite friendly but she has a habit of being a fucking cunt at times and we only became better siblings following her going to uni as well as after I went to uni(I'm still at uni). 

She's currently studying for an exam in a couple of days, she normally doesn't stay at home since she's working and stays near her work however since her exam is near home she's back for the week and she leaves next sunday. 

Usually we are chilled with each other however ever since she went off to uni (its been 7 years) I've felt that she never really treats home as home and she takes my parents for granted and expects people to tidy up after her. My parents have normally tolerated her however today we were chilling and watching tv when she intentionally bumped into me while I was drinking coffee. This resulted my coffee spilling onto her. My reaction was WTF dude... to which she responded by blaming me and wiping the dripping coffee onto me to which I told her she's not welcome in the house, no one likes dealing with her bullshit and she's got problems and she's a selfish cunt who only looks out for herself. 

Following this she chose to violently try breaking her coffee mug and then poured all her coffee onto the sofa saying well now atleast its even...

WIBTA if I report her to the police citing mental health problems?"		1	0
c7hokl	2019-06-30 18:19:36	LonginusUbik	AITA for not wanting to skip work to travel?	"Apologies in advance for any spelling mistakes  


So, earlier this year, my father said he wanted to travel in September to the Oktoberfest, in Germany. Right away I knew it wasn't a good idea, since I would be close to graduating, and also i had to be on the lookout for a job, since I am 23 years old and never worked before, I was not comfortable traveling in such a critical period of my life, and told him so. We made a deal: He would make an insurance on the trip, so if i found a job by then, he would cancel it and at least would not lose all the money.  
A few months later, I got  a Job! It's not full hours, it's an 8-month contract, but its in my field, so I'm not really complaining. However, my father did not cancel the trip, he instead insisted that I should talk with my boss about skipping ten days of work for the trip, which is something I found completely absurd to do on my first job, and again, I told him so, so he's calling me selfish for not even trying and that I am ""ruining his dream""  
Am I in the wrong here? I'm trying to build something for myself, and while I really enjoy traveling, I think I need to have my priorities straight.  


TL;DR: Father wants me to skip 10 days of my first job to travel"	Not the A-hole	0	0
c7hn46	2019-06-30 18:15:56	Dillinjer882	WIBTA for not wanting to pay for replacement curtains that broke in my airbnb host's house?	So I pulled down on the string to draw the blinds upward (the way they are designed to be used, without using any amount of excessive force) and they broke off the mounting bracket. That is, they fractured irreparably and had to be replaced. He's requesting money through airbnb and in the text conversation (which did happen in the airbnb app) I said I would install them if he bought them. Only now he's requesting money for them. I should also include that last night we renegotiated how much money I'd pay for them and I did agree to pay a certain amount, however I still feel this is in no way truly my fault since I didn't pull on them too hard and they were simply not mounted into the window frame with the correct number of screws (2 out of 4 on each side; recipe for disaster). WIBTA here or am I right that this isn't my fault, he should pay for them, and it's nice of me to even offer to do the handy work?	Not the A-hole	0	0
c7hma1	2019-06-30 18:14:00		AITA for being a functioning alcoholic and being high most of the time?			0	1
c7hljs	2019-06-30 18:12:16	TheMightySnuffler	AITA for not wanting a relationship with my brother right now?	"Some backstory: my brother and I have a complex relationship, in part because we never grew up together (3 years apart but he went to boarding school when he was 8 and I was 11). We've recently gotten closer in the past couple of years and we usually talk almost daily through memes

&#x200B;

&#x200B;

It all started about a week ago when we got into an argument over dinner. It was over something stupid (politics in which we have very contrasting opinions) but it was getting heated and making both me and my parents uncomfortable. I tried to get him to stop by saying basically ""let's agree to disagree"" but he became nasty, and started to belittle me for very personal things that I'm sensitive about. As a complete kneejerk reaction I lashed out by hinting at something he had told me in private which my parents would be livid about (not ok but I didn't actually say the thing if that makes sense), to which he responded by calling me the c word. However we were able to continue dinner and I thought things were resolved.

&#x200B;

However the next day my parents and I travelled up to my university for my graduation. Since I couldn't keep my emotional support dog in the hotel I left her with him for the week. I was incredibly anxious about this as it's the first time I've left her with him and being away from her is hard at the best of times. But I left her, and expected to hear from him while on the road/once I arrived. However I realised that he blocked me on all social media and text as soon as I arrived at my uni, meaning I couldn't contact him about her/get pictures etc. This left me absolutely fuming as I already had problems being away from her and I felt this was vindictive and malicious on his behalf. However my parents said I was overreacting and I was in the wrong for being rude to him the day before.

&#x200B;

It's now a week later and he's (finally) re-added me on social media, sending me pictures of her. His excuse is that he ""needed some time"" away from me. Fair enough, but my dog is like my baby, and if you were babysitting you would not cut off the parent from contact. This, along with our already complex history has made me realise I do not currently like my brother for who he is, and I do not want to try and maintain a relationship with him at the moment. I don't think this will be forever, just until he matures a bit and learns some accountability - what he did hurt me and caused me immense stress at a time when I am meant to be celebrating. I'm leaving the country for a couple of months and have made the decision I don't really want to resume our day-to-day contact we had prior to this. However my parents (particularly my mother) think I am overreacting and that I should forgive him immediately. They argue that if I ignore him this is no better than his behaviour and to a certain extent I do see their point.

&#x200B;

So AITA?"	Not the A-hole	0	0
c7hleg	2019-06-30 18:11:55	Throawayacc42069999	AITA for not messaging a girl back?	This girl and I used to talk online. We only knew eachother online and not IRL.  She messaged me “hey” and then I didn’t message back. I had a girlfriend at the time, and a lot of other stuff going on, so I just forgot to text back, but after a couple days I message back “hey sorry for the late reply” and she said “are you tho?” And that really put me off. She then messaged me back a few days later “you’re a dick” and blocked me. So am I the asshole?	Not the A-hole	0	0
c7hl8a	2019-06-30 18:11:29		AITA for not helping my parents?	"I (22) got out of the military 2 months ago to go back to school and my parents offered to let me live with them, rent free. I took up the offer but I felt guilty so I loaned them $40k they needed to pay them back in some way (they keep avoiding talking about the money so who knows when I’ll ever get it back).

They opened a business not too long ago and I have a lot of free time until school starts so I’ve been working for them for free and taking care of all the house chores. I don’t mind this since I do have a lot of free time but this does take up most of my day (I work for them 6 days/week for 5-7 hours/day).

What bugs is me is that they don’t press my older brother (25) to take on the same responsibilities. He’s on summer break right now so he has just as much free time as me. Last night, I got home from work at 2am and had to be up for 7 to work again the next day but I didn’t get to bed until 4 because I was cleaning up after my brother. He always leaves his dirty napkins and dishes anywhere he pleases. He keeps promising to cover some of my shifts to help me out but when the time comes, he says he’s too busy because he has to do x, y, and z.

They’re also super lenient and supportive with him whereas they’re very short with me. They’ve paid for 6 years of university for him but I have to go to a 2 year college because I have to cover my tuition and a 4 year school is out of my budget. If he doesn’t want to work, they always make excuses for him like “he’s probably tired, you can just do it instead”. But last time I wanted a day off, they flipped out and said I was lazy and inconsiderate for even asking because they would be working so hard and I would just be relaxing.

I told them I’m not obligated to help them out and they way they treat my brother is bullshit so they can deal the business themselves because they wouldn’t be getting any extra help from me. AITA?"	Not the A-hole	1	0
c7hklb	2019-06-30 18:09:54		AITA for still getting mad at my gf for this?	"Me and my now girlfriend went through some conflict early on/before our relationship that still effects me now 3 months later AITA?   

My girlfriend and I met senior year of high school and talked on and off for that year and the summer following until she got a boyfriend. I went off to college but while dating her boyfriend she would often reach out to me for someone to talk to because he was mentally and sometimes mildly physically abusive to her. I’d spend hours upon hours talking to her, comforting her, and telling her how being with him was not good for her mental health etc. she turned to me for everything and told me many times if she were to breakup with him she would want to come to me, she feared being alone and I told her I would gladly date her.    
Months pass she ends up breaking up with her boyfriend and tells me right away. I take this as my queue to try and be with her as that was what she told me she wanted and I wanted it as well. A month and a half passes of me and her texting/FaceTiming all the time, and meeting up every once in a while as I was at college.   
We planned a weekend we would spend together as our birthdays are one day apart and happened to fall on Friday and Saturday, so we wanted to go out and have fun together, just us, because we knew we were good for each other and things were getting serious between us. She exclaimed how happy she was to finally be able to not hide that she loved me and wanted to be with me. Of course at the time, I wasn’t messing around with or texting other girls in order to make sure she knew that she is the one I am focused on, she was my focus. She would tell me countless times to “keep the girls away”.
Now roughly a week before our planned weekend she’s acting strange so I ask what is going on. She says some guy texted her to “hangout” and that she is going to “hangout” with him on our birthday weekend. I ask who, she tells me, and it’s one of my old friends who’s a total douche and I warn her of that. She denies my warning and starts going off on me saying “I can do whatever the fuck I want I’m single”. So all of this goes down, I hangout with her on her birthday and she “hangsout” with him on mine, coming to my birthday get together after her “visit”.   
Later on we talk more and more apparently he was an ass to her after (big surprise) and we start dating, things were good when we weren’t talking about what happened, but when brought up she says she was just trying to feel “wanted” and that tipped me off because all I had ever done for her was make her feel wanted. She later changed her reason to wanting to feel “reckless” and that she “had to do something” when she was single “you can’t just jump right back into a relationship”.   Now, it’s been 3 months and still comes up every once in awhile and is really the only thing we argue about, I can’t help but think how different things would be if that never happened but AITA for still being mad at this?"		1	0
c7hk43	2019-06-30 18:08:45		AITA for not wanting my stepdad to attend my highschool graduation?			0	1
c7hjzj	2019-06-30 18:08:28	aitarapperfightt	AITA for weighing in on the Cardi B/Nicki Minaj feud?			0	1
c7hjx5	2019-06-30 18:08:21		AITA for ignoring my friend's calls for summer sports?	"So summer's coming up, and my friends, who have been mostly unavailable throughout the year (except for rare pub gatherings which I do not prefer), have started jumping out of the woodwork, asking me whether I wanna join their summer frolicking. They kinda need me because there is just not enough friends in the group, but I don't wanna do it. Not on their terms.




They have been ignoring me for the rest of the year whenever I wanted to do sports, and I was forced to develop several solo-activities throughout the years so I can keep fit. I already did my solo-activity today, to which, btw, I literally invited you and you told me ""it's too early, bruh"". So I'm sorry if I'm not too psyched to go to an overcrowded town sports-area with all the normies just like you pretending like they do sports, in the comfy shade of the sunset and mosquitoes. I don't enjoy having to accomodate random pedestrians into my sport-zone if I don't have to. I get it that it's a popular time to  do sports, but I do mine in the morning because you have fresh cold air then and there are no assholes around who just do sports to sit around and look at other people.





So yea. Here is my calendar, and here are the times when I am available. And if you can't condescend to compromise even once on my desired time to do sports, then I guess we'll see each other in winter on one of those awful pub gatherings because that's somehow better than doing sports, and it's so very cold outside- not"		1	0
c7hjw1	2019-06-30 18:08:16	trodnxnd	AITA for yelling at restaurant employees for my meal?			0	1
c7hjuv	2019-06-30 18:08:12	thiccnessitself	AITA for ditching my family dinner	"So...

earlier in the morning i asked my older sister and parents if anyone wanter breakfast and they said no, then made myself a diet sandwich that i spent quite a while on it. when i went to eat it in the living room my entitled sister demanded half of it (keep in mind it's one toast sandwich and my only meal until dinner at night), so angrily i said no, and asked why the fuck she didnt tell me before because i spent a fuck ton of time cutting the vegtables. Then she was like ""it's just a sandwich"" so i felt bad after a few minutes and cut her a half. ""nO"" she responds...""i dOnT wAnT iT aNyMoRe yOu wErE a JeRk"". So then my dad walks in and see's the situation ""wHy wOuLd yOu dO tHaT, sHe's yOuR SiStER, iT's jUsT fOoD"" and proceeded to shout at me for a minute.
So i was having none of this bullshit so i wanted to go to the gym. my parents told me to go to dinner outside. (im on a diet, and i dont wanna slack because i already didnt go yesterday) so i said i cant and left. Apparently my mom had a breakdown in the car about how im a piece of shit and i rarely go outside (which i already explained to them i have social anxiety and insecure about being overweight). When they got back my sister called ME selfish and that i only care about myself. And then they're refusing to talk to me, so now, im here. My entire family doesnt like me so that's nice"	Not the A-hole	0	0
c7hjev	2019-06-30 18:07:06	cameronjerellnewton	AITA for breaking up with my fiancé over her divorce stimulations			0	1
c7hidz	2019-06-30 18:04:27		AITA for breaking up with my girlfriend?			0	1
c7hi54	2019-06-30 18:03:52	Xodannixox	AITA for blocking my ex, knowing that he is sucidal			0	1
c7hhtt	2019-06-30 18:03:07		AITA for asking a fat girl to move her fat rump and a blondie to piss off, and getting revenge on a plane after repeated annoyances?			0	1
c7hhsv	2019-06-30 18:03:04		AITA in this situation with my ex friend?			0	1
c7hhoj	2019-06-30 18:02:46	grayflagradio6	AITA for demanding that my husband take very exposed pics of me?			0	1
c7hhf6	2019-06-30 18:02:09		WIBTA for asking my friends to finish the day/eat dinner earlier or just ditching them so I can go home	"We're all studying abroad and got assigned to live in wildly different parts of the city. Some people can walk to our school in 5 minutes, others like me are living nearly an hour away and need to use public transit. The neighborhood I'm staying in has a lot of brothels and I've already been mistaken for a prostitute a couple times (I know, I know, but it's been around 100 F nearly every day for weeks out here, if I don't wear shorts or a dress I'll die) so I really don't feel safe walking to/from the nearest tram station after dark. 

Most of my friends live somewhere in between (10-20 minute subway ride) and are also staying with host families in much safer neighborhoods. Our usual schedule is like this:

* 9 AM - 5 PM class, morning is in a classroom and the afternoon is on our feet outside
* 5-8 PM work at a cafe or something
* 8-9 PM dinner

Here comes the second issue: I have mild scoliosis so I look mostly ""normal"" but it's enough to make my back muscles uneven and severely limit how much weight I can carry on my back, let alone for the whole afternoon in the sun. Basically all of our homework requires a computer and my laptop is too heavy for me to walk around all day with. Yes, I have already tried to push myself on how much I can carry, I can do it once in a while but every day is just asking to get injured and undo everything I've gained in PT. 

So for the 3 hours at the cafe I basically just sit there twiddling my thumbs or attempting to write essays on my phone. It's wasted time. If I don't go to a restaurant with everyone else for dinner I'll have no dinner that day because my host family doesn't cook and grocery stores close very early here so I can't even get stuff to cook for myself. 

And yes, I am looking into getting a lighter laptop for the next school year. I didn't anticipate needing to carry my laptop around for anything on this trip and do not want to buy a new laptop while I'm still abroad and also don't have access to the drives I'd use to transfer my files to a new computer.

**TL;DR** living situation and not being able to carry shit means that I can't stay out as late as my friends, WIBTA for asking them to either end the day earlier or just not working/eating with them?

edit: the formatting sucked"	No A-holes here	0	0
c7hh5z	2019-06-30 18:01:28		AITA for refusing to order off the “secret menu” at Starbucks?	"I was leaving Starbucks and asked my boyfriend if he wanted anything. He told me to ask the barista to make “whatever their favorite drink was off the secret menu”. As someone who previously worked in food service, I know how frustrating it was when people would put pressure on me to choose something random that I think they’d like or when people would order elaborate things that aren’t on the menu. It just puts you in an awkward situation. So, trying to be courteous to the employees, I told him that I’m not going to do that, and he can order something off their regular menu.  He told me that this is what they’re paid to do that I obviously care more about them than him. I’m starting to feel badly about making this bigger than it needs to be, but I go here often and don’t want to form bad relationships with the baristas. 

AITA?"	Not the A-hole	1	0
c7hg6c	2019-06-30 17:58:59		WIBTA for reporting this girl and her kids?			0	1
